line	text
88	مالك ياجميله فيكي شيء حاسه بحاجه
89	لاااه وقصت عليه ماحدث
90	فيه الخير والله راجل بصحيح
98	واني مستني بكره ده بفارغ
3	انت ماكالتش عاد كيف تنام
4	ماعاوزش
5	لاه اكده خطر انت ماكالتش حاجه واصل وتنام يجيلك هبوط ف القلب ولا حاجه لاقدر الله
6	ويهمك جوي ع الاقل ترتاحي من خلقني اللي ارفاكي
7	واااه انت ولد عمي مهما حوصل
8	طب نامي نامي اني مالياش نفس عاد هاكل غصب يعني
9	خلاص انت حر اني نصحتك عاد
13	ماتخافش هو ده اللي ليك عندي
19	واااه ياجميله ويضع يديه على وجنتيها
21	مافيش وتعطي له ظهرها مره اخري.
23	هو ماينفعش نتحدتو الا لما تقلبيها
25	ده اني اللي خميره عكننه
26	لاااه امي عاد
29	معلهش ياولدي جلجتك من منامك
30	لا ولا يهمك ياعمي اني لساتني صاحي خير
31	عندنا مشكله مع الشركه اللي بنوردلها المحصول ف مصر وعاوزين يغيرو العقد والاسعار.
33	خلاص ماشي ميتي
34	بكره الصبح اطلع من عندك بسيارتك ويوسف هياخد ياسر ونس طريق من اهنه ويسافرو وتتقابلو ف الشركه خلص انت العقد وعاود لمرتك ومبروك ع الحمل يوسف جالي
37	خلاص باكر باذن المولي هدلي مصر واما بخلص بعاود وخد بتك وصيها بنفسك حاكم دي مابتسمعش كلام حد واصل وحطيت صوابعي العشره ف الشق منيها
38	كيف ده هي صغيره دي ضاكتوره وفاهمه لافيهاني
40	ههههه الله يسامحك يابوي اني برديك اجيب برص
42	ف امان الله يابنيتي
44	انت هتسافر مصر
45	عندك مانع
46	لااه بس مابحبش السفر بخاف منيه وخصوصا سفر مصر
48	واني عيل صغار ولا ايه
50	لااه بس ماعاوزاش ابني يتيتم قبل مايشوف بوه
51	الملافظ سعد
57	وهو يقهقه فقد استطاع ان يستفزها
60	انا فعلا هكلمهم اخد اسبوع راحه حاسه بتعب
62	لاه مايستدعيش اني دكتوره وخابره زين دي اعراض عاديه للحمل دوخه وهبوط واكده يعني.
63	لو حوصل اي حاجه اتصلي بيا فورا لو ف نص السكه هعاود
64	لا ماتخافش اني زينه مافياش حاجه اني بس اللي عاوزه اريح هبابه على ما انظم نفسي
65	طب يلا نامي بقي عشان هقوم من بدري اسافر
66	لااه لازمن تاكل قبل ماتنام انت هتقوم بدري تسافر وماهتاكولش وممكن يحصولك حاجه وانت سايق
67	خلاص خليكي هسخن اي حاجه ماهخلصش منيكي
69	لازمن سفريه مصر دي عاد
70	وااه واني رايح العب ولا ايه
72	طب اجي وياك
73	تاجي فين ياسر جاي معايا ف عربيتي واخوكي هيقابلنا هناك
74	طب اوعاك تروح اهنه ولا اهنه ولازمن بيات ماتاجي كيف هاشم
75	هاشم هيخلص العقود ويعاود عشان مرته لكن اني هنتفق ع الاسعار واشوفهم وردو الشيك ف الحساب ولا ايه
76	طب ماتشوفه ف فرع اسيوط لازمن ف القاهره
77	وااه ولدي على حجري وادور عليه.
79	ماشي بس ماتتاخرش عليا
80	هو اني بقدر ابعد عنيكي دانتي ملكتي الروح والقلب
81	وانت كمان يايوسف عارف اني بحبك اد ايه
82	ماهو اكده ماهسافرش والواد ملطوع ف العربيه لما حمض وريحته طلعت لهنه
83	طب بالسلامه ياحبيبي تروح وترجع بالف سلامه.
84	ايوه يابيري احنا جايين مصر اهو
85	طب زي ماتفقنا عاوزنها مفاجاه
86	ماشي ياسيتي.
89	انا استويت وعاوز انام
90	تنام ايه احنا ف مصر
92	والله ماقادر مستوي ع الاخر
93	نام بس هبابه واني هصحيك في جماعه اصحابنا عزمينا
94	مين.
95	ناس اصحابنا من ايام الكليه
96	لو قدرت افوق بقي ابقي اجي معاك
97	لااه دا عاوزين يحتفلو بجوازك ياعريس
98	ماتقول مين دول
99	مفاجاه.
2	اني رايد صابحه يابوي
3	انت اتخبطت ف نفوخك عاد
5	ايوه ياابه واعي
7	صابحه بنت مسعده الخدامه انت عاوز تطاطي راسنا ف الوحل
8	انت واعي للي بتجوله ياخرفان انت لو عملتها لانت اخونا ولا نعرفك انت ناسي احنا مين احنا اكبر روس ف البلد وجاي توطيها وتجوز خدامه
9	الفقر مش عيب ياخوي.
10	على اد ماانت اجرب ولد ليا وانت الصغير لكن لو عملتها لاانت ولدي ولا لك ورث عندي
11	اني ماطمعانش ف ورث يابوي
13	اني عارف انك طيب واهبل وهي عرفت تضحك عليك كنت خايف عليك من خواتك لكن الخطر كان من بره عاد
16	حرام تقطع عيشهم يابوي
18	عيروحو موطرح مايروحو عاد ماعوزش حديت ماسخ ف الموضوع ده تاني
23	ماليش صالح عاد
26	والله مااعرف ياكبير
28	كان من بدري تعملي اكده وتوعيها ماتبصش لفوق
38	انا جاي معاكي وهنتجوز ماهملك واصل مش اني الراجل اللي يهمل حريمه اني هتجوزك واللي يوحصل يوحصل.
40	بس بوك عيحرمك من الورث
42	ماحدش بيموت من الجوع واني راجل وبصحتي وعفيتي وعشتغل اي شغلانه شريفه اني معايا مبلغ ندبرو بيه حالنا ونشوف دار ف اي بلد صغيره بعيده عن اهنه عشان لو لجونا عيجتلونا
3	اني ماخابرش طاوعتك وجيت معاك كيف لو اتجفشنا هتبقي مصيبه وهنتجتل وهتبقي بحور دم
4	واني هعمل ايه اني رايد اتحدت معاها ماقدرش انساها وهي كانت تحبني بس خايف تعصلج معايا فجيبتكو وياي عشان تخاف وتكش
14	اني رايد اتحدت وياكي
18	بعد يدك عني لاصوت والم عليك الجيهه بحالها وهنا خرج احمد اطلق غيارات ناريه ليجري اصدقاء محمود ويجري احمد على محمود يمسكه.
20	همله يااحمد خلاص الله يرضي عليك
22	اني كنت رايد اتخدت وياها
25	اني خابر انها بتحبني
26	حبك برص ياواطي
28	مش جلت سكري خشمك مش في راجل بيتحدت ولا مامليش عينك
29	لااه اسفه وانزوت ف جانب إلى ان يفرغ احمد منه
30	شوف اني هسامحك النوبه وماهجتلكش بس قسما بالله لو هوبت نواحيها لاكون دبحك ومقطعك لكلاب السكك
31	خلاص والله حرمت وجري من امامه
34	همليني ف حالي الساعادي
35	ابااي واني عيملت ايه عشان تزعل وياي
36	ماعملتيش بس اني متضايق فيها حاجه دي.
38	اباي بتشدي يدك مني اكده ليه
39	ماقيش هم يلا عشان اتاخرنا
44	لااه ماكانش قصدي والله
49	مابلاش الليله لو تعبان
50	اباي قلت يلا مافاضيش اتحايل طول النهار
51	ياباي مافيش تفاهم اكده وطلعت تاتي بكتبها
52	عامله ايه ياجميله اتعبتي من السفر
53	لااه اني زينه.
54	اهملك تنامي مع ولدك واروح مكان تاني عشان ترتاحي قدامنا سفر بكير
55	لااه ماهعرفش انام من غيرك
56	ماعايزش اتقل عليكي
57	اني زينه ماتخافش عليا
58	طب نامي ربنا يتم شفاكي على خير
59	يارب
62	اني اليومين الجايين هسافر كل كام يوم اكده عندي شغل
63	نعم نعم
65	ماتتلمي يابت يعني ماوثقاش ف جوزك جلتلك شغل
66	خلاص رجلي على رجلك حتى لو نصبولك خيه اجومك منيها
71	وسع اكده وماتبلفنيش
72	واني ماهوسعش.
4	المهم انت كيفك بخير يابوي
5	اني بخير طول مانتو بخير
8	متشكره ياعمي
9	هااا جلنا ايه اني بوكي
10	حاضر يابوي.
12	تعال يابنيتي
14	انت عارف ان شغلي ف بلدنا واني ماجدراش ع السفر اكده وكنت عاوزه تشوفلي حد كبير ينقلني لهنه
15	شغل ايه يابتي ده اللي عوزاه ويجيب ملاليم انتي مامحتجاش الشغل يابنيتي عندك ورث يكفيكي العمر
16	معلش يابوي لو ليا خاطر عنديك تساعدني.
17	بسيطه يابنيتي هكلملك واحد مسؤول كبير روحي خدي ورقك باكر وتجيبيه وياكي وتعاودي تلاجي مكانك اهنه محجوز
22	مالكش صالح
24	حاجه ماتخصكش
25	كيف يعني ماهتخصنيش انتي كلياتك تخصيني واي حاجه تخصك تخصني واياكي حاجه توحصل بناتنا وتروحي تجوليها هقطع خبرك.
27	عارقه اني مصيبتك وماتخافش مابقولش حاجه من اللي بتحصول
28	كويس انك عارفه انك مصيبه واتبليت بيها
29	ماهاردش عليك خليك بنارك وخرجت ورزعت الباب وهو يضرب كف على كف يابنت الفرطوس ماشي ياراويه والله لاربيكي من اول وجديد.
31	خير ايه مصحيكي من النجمه اكده هتوزعي لبن ع البلد
32	لا ياناصح راحه الشغل
35	لااه الا دي
37	واااه ياحلوتك يابت.
39	لااه مش القصد بس عمي يعرف ناس كبرات ويقدر ينقلني
42	جلت حاجه ماتهمكش
43	اني اللي احدد ايه يهمني وايه لااا ه
44	طب خلاص عاد هملني عشان البس والحق وقتي مش عاوزه اصغر عمي بعد. ماقال للراجل
45	ماشي ياراويه بتلوي دراعي وتشتغلي من ورا ظهري
47	لااه اني راحه لحالي.
48	اباااي عليكي
51	والله ماحد يحرق الدم غيرك يابعيد
54	رايح اوصلها تجيب اوراقها من مدرستها
55	ماشي ياولدي واني كلمت باشا كبير وقال تجيبه وتاجي اهنه ف المدرسه اللي حدانا
56	ماشي يابوي ماعاوزش مني حاجه.
57	عاوزك بعافيه ياولدي ربنا يسلملك طريقك
60	لااه خلصي وانا واجف جمب الباب اهنه ادخن سيجاره على ماتخلصي
62	بقي ده الوعد اللي وعدتهولي
64	اني ماوعدتكش بشيء
67	وحتى ماتجوليش انك. اتزوجتي وماشيه اكده لا سلام ولا كلام
68	مافيش كلام بناتنا اصلا انت زي اي حد اتقدمت ومافيش نصيب لا قرينا فاتحه ولا شابكه
69	بس انتي كنتي رايداني زي ماني رايدك ولو ماكانوش موافقين عليا كنا طفشنا زي بوكي وامك.
70	اخرس امي وبوي اشرف من الشرف امي جات اهنه ويا ستي وابوي مارضيش يهملهم لحالهم واتزوجها من اهلها
72	هملني وبعد يدك عني
76	وانت مين انت كمان
78	واللي بتتكلم عليهم دول مايستعنوكش تمسح جزمتهم انت فاهم ولكمه لكمه قويه اوقعته مره اخري ثم امسك به من تلابيبه ليرفعه له لو عنت تهوب نواحيها تاني ماهاخليش الدبان الازرق يعرفلك طريق جره
80	افهم بس يايوسف انت فاهم غلط والله مافي بناتنا شيء واصل
85	في ايه يا راويه وتاخذها لحجره راويه
91	اطلعي بره
4	رايده اقولك حاجه ياولدي
5	خير يااماي
6	بس ريداك تسمع كلامي وتهاودني وماتتعبنيش
7	اوامرك ياماي
8	اني رايده اعاود داري
12	واني موافق وهنفذلك طلبك
14	ومرتك ياولدي
15	مرتي ويا جوزها
18	وتهملوني لحالي
20	انتي ويا جوزك
22	بس برديك ماستغناش عن ماي.
23	بلاش تاجي ياولدي
25	خلاص ياماي مالوش عازه الحديت ده ماهملكيش لحالك
27	بلاش اكده ياولدي
29	ماعاوزش حديت واصل ف الموضوع ده
30	خلاص ياولدي ماتتعصبش عليا
34	طب ليه عاد حد زعلهم ولا داسلهم على طرف
35	لااه خاله صابحه بعد الوعكه دي رايده تموت بفرشتها وهاشم مارايدش يهملها لحالها
36	هاشم ولد زين وصابحه عرفت تربي تمام هيهمل القصورعشان يقعد جار امه
37	واني جياك عشان تقولي انه زين اني ماعاوزاش اهمل القصر اهنه واروح معاه.
38	الست مكانها مع راجلها ياجميله وانتي بت اصول وتعرفي الاصول زين
42	اهدي ياهاشم
44	ماحدش له صالح بيا وبمرتي
46	افتحي الباب ياجميله احسن لك
47	مافتحاش
56	اني مارايداش اهمل القصر واجي حداكو
59	ليه يعني ساحب جاموسه اياك
64	لااه ماريحاش معاك طلقني
68	اي هملني دراعي هينكسر.
69	ينكسر عشان تفوقي لنفسك
70	الحقني يابوي
71	والله لو طلعتي صوت لاكون جاتلك
74	ماعاوزش حد يدخل بيني وبين مرتي واصل اني اعرف احل اموري زين ومش الحريم اللي هيمشي كلمته علينا
79	شوفتي جبتلنا الكلام وسمعتي بينا الخلق قسما عظما لو ماقمتي تحضري الشنط لاكون دبحك كيف البعيرفجرت من امامه تخرج الملابس وتضعها ف الشنط بعدما رات نظراته الناريه التي توحي بانه ليس تهديد بل هو عازم الامر على قتلها ان تنفست
80	ماكان من الاول لازمن الفضايح
6	عملو فيك ايه ياولدي
8	ماتخافيش ياماي
10	لا روحو انتو اني اهنه ف بيتي خدت عليه.
13	خلاص ياولدي ماتتعصبش عليا اكده اني بس هروح معاك لكن لو مارتحتش هعاود داري اني خدت ع البيت واهل البلد اهنه
14	لما ياجي وجتها يحلها الحلال
16	هنعمل ايه يافالح
18	امال عاوزنا نشد احنا التنين لازم واحد يشد وواحد يرخي عاد
19	صابحه غذته حقد وغل.
20	صابحه الهبله
21	امال مين عاد وهبه كان طيب وغلبان ده طالع اكده لمين
26	واه انت معانا ولا معاه
27	خلينا ف المهم عاد
29	يعني هياخد ارضنا اكده ويروح يبيع ويشتري فينا
30	تعال ف المكتب رايدك ف موضوع
33	كيف يعني
35	وهاشم
36	نجوزه جميله ويبقي تحت طوعك وماهيخرجش الورث بره احفادك
37	واشمعنه انا
38	ابه بتي لسه صغار ف ثانوي
41	طب يوسف سهل نقنعه لكن جميله عنعملو ايه معاها
42	دي بتك وتكسر دماغها.
43	مش جميله ياهمام انت خابر
44	اني هجولك تعمل ايه وهمس لهبالخطه
45	يابن ال...
47	الحق عليا هي مابتجيش غير باكده
48	شوفتي المعفن الجربوع ده
51	ماتتحركش بقي اما اطهرلك الشلفطه اللي عملها فيك ايده مرزبه
54	ايه ياواد ياشرس ده انت بقيت خطر اوي.
58	يلا ابت اخلصي دي هتعملي فيها دكتوره بصحيح
61	انت هتهملهم ياجو يبرتعو اهنه
62	بس ياولد دول ولاد عمك
64	اني مش هتحدت ف الموضوع الا اما تكلم هاشم ف الموضوع ويوافجوا مش اني اعمل مع ولادي مشكله ع الفاضي والاخر هاشم يتمرع علينا ومايوافقش
66	ماشي ياخوي.
1	اتلمي ياراويه واحترمي نفسك اني مقدر حالتك
4	ده هو اللي مجننك عشان اشوف خيانتك بعيني
8	اعقل انت خليت فيا عقل
11	افهمي ياغبيه الموضوع مش كيف مافهمتي فيه سؤ تفاهم
12	سؤ تفاهم ايه وهباب ايه واحد راكب فوق واحده عاوز تفسرهالي كيف ابتلعبو صلح شوف يا ولد الناس زي مادخلنا بالمعروف نفترق بالمعروف وده اخري معاك.
14	طب اهدي بس نفهمو ايه الحكيوه
15	ماعاوزاش افهم واصل كفياني اللي شوفته بعينتي التنتين ولا عاوزني اخذقهم واكدبهم عاد
19	صحي جميله ولا اي حد يشوفها فيها ايه.
23	انت ايه حكايتك معايا ياهاشم
24	معلهش النوبه دي اختي
26	طب ممكن تتفضلو عشان اكشف عليها
27	كيف يعني اهمل مرتي مع راجل غريب ويكشف عليها واني بره قرطاس مثلا
28	معلش معرفش انك جوزها.
29	ليه ماحضرتش الفرح اياك
30	واني هفتكر كل اللي بحضر فرحهم عاد
31	خلاص ياعاصم اكشف وخلصنا
33	انتي البيريود ماخره عليكي
34	يجيلها سبوع اكده اواكتر
35	فالحه وازاي ماتكشفيش عاد وقاعده تروقي ومتشملله
37	كيف تجولها مفعوصه وجاعد تتحدت ويا مرتي
38	معلهش يايوسف عاصم جارنا ومتربي معانا وعارف راويه وهي صغيره وكان بيحملها وياي.
39	كانت لكن دلوقيت ف عصمه راجل
42	مش ابوه
43	لااه ده ابني اني بس
49	القصر ده اني مامعتبهوش تاني طالما من خلقتك
53	لااه داانتي نسيتي نفسك عاد
55	ايوه اكده.
56	تعملها ايه انت هتعوم على عوم المجنونه دي
57	اني مجنونه تحب اوريك الجنان على اصوله وهمت بالصويت فجري هاشم اغلق فهمها
61	ربنا يعينك استاذن انا.
63	حاضر يادكتور
65	تعالي اهنه وفهمني ايه اللي حوصل بدل مااني كيف الاطرش ف الزفه
66	اني هملتك وخلصت معاهم الحسابات وروحت الفندق مستوي وعاوز انام المهم نمت ولقيت ياسر بيصحيني ويقولي زمايلي عاملين حفله عشان اجوزت واكده ولازمن اروح دي ليا مخصوص واني ماكنتش قادر.
71	وايه عرفها ووداها هناك.
72	ماخابرش وده اللي هيجنني دااني نفسي ماكنتش اعرف اني رايح ولا اعرف العنوان ياسر اللي وداني
73	الموضوع اكده فيه ملعوب ومكيده
75	اه ياولد عمي شكلها اكده
77	اكيد واللغز ده ف يد ياسر صاحبك لازم نفهم منيه كل شيء عن الحفله دي
78	وانت هترفعلها البتاع الخلع اللي بتجول عليه ده
79	اني بس بهديها على مانعرف الحكايه.
80	ماشي واني هستناك نروحو لياسر عشان يبقي جصاد عينك كل حاجه
81	ماشي
82	يوسف
83	صحي النوم القتيل صحي اهااا بعد الحفله ماانتهت
84	حفله ايه عاد انتو كنتو عاملين حفله من غيري
85	خشي نامي ياامه هبقي احكيلك الصبح ولا احنا بقينا الصبح اصلا منكو لله وحداي محكمه اروح اقولهم
90	هي راويه اهنه كمان
91	مش جلتلك كانت حفله هي هتنفع من غير الطرف التاني عاد
96	لاااه اني ماشي ماقادرش ع الخناق اني استويت وهستناك نروحو لياسر بليل
97	ماشي براحتك
101	لا دي قصه طويله لما اعاود احكيهالك بالاذن اني
102	وااه وهتفوتني اكده الفضول يجتلني
103	عشان تفوجلنا عاد بدل مابتنامي كيف الجتيل اكده.
4	امال نوح فينه
5	نام من بدري استناك كتير وعوقت الليله مش بعاده يظهر السهره كانت مطوله
6	اباااي عليكي
8	لا ماهزهجش
10	يمسكها من ذراعها
14	طبعا مابقناش اد المقام ماهي السنيوره الجديده جلبتك علينا
15	اباي ع المخ الفاضي
20	اني سالت بوك وجالي مافيش حداكو شغل برات البلد يبقي بتروح فين ياولد عمي
21	وكيف تسالي ابوي ياام مخ تخين
23	بقي اكده ماشي يايوسف
32	ورا يوسف وحسك عينك يزوغ منك واياك تجيب سيره لحد هقطع عيشك
35	اباي امال بيقول مصر ليه عاد وهو رايح اسيوط ووهبه هيوديه فين
38	واااه مين اهنه ف المستشفي
41	واااه ايه اللي بيوحصل ده خوي ماله ومخبي علينا ايه وذهبت لتفتح الحجره وتجد جميله منهكه بالفراش وهم حولها وتحاول مداعبه وليدها
42	ايه اللي بيوحصل بالظبط ومالها جميله
43	اباي ايه جابك اهنه
46	اهدي يايوسف
48	لاااه خيتك اتجنت خلاص.
49	ابااي عشان بحبك وبخاف تضيع مني يبقي اتجنيت
51	جميله عندها سرطان ف الثدي وهتعمل عمليه
53	وكيف ماتقولوش ليا
55	يوسف اتصرف وبيجبلنا وكل بيتي من جماعه اهنه بيوصيهم.
56	وبعدين ياام مخ فسفس انتي لما تاجي اهنه تبيتي معاها هنقول ايه هجينا كلياتنا من الكفر ولا مين ياخد باله من الولاد
58	هملته مع امي على مانعاود
59	طب همي عاودي امك. ماقدراش ليه
60	لاااه اني هعاود معاك وهقول لعم ابراهيم يمشي
61	فضحتينا عاد لما يقول لحد مرتي بتراقبني شكلي يبقي ايه امشي قدامي وزقها امامه
63	امشي انت ياعم ابراهيم.
64	واياك تجيب سيره لحد واصل هقطع عيشك
67	همي وياهم على مااجيب الاكل
68	لاااه اني جايه معاك
69	اباي مش جايه تقعدي وياهم
70	لااه ماهملكش لحالك تسوق
71	اركبي
73	بتقول حاجه يا سي يوسف
74	ياسي يوسف ويخفي ابتسامته
79	ابااااي عليكي والله اخنقك واتاويكي اهنه ماتسكري خشمك ده يابت عاد اني ماناقصكيش
80	واااه انت حمجي اكده ليه
82	شوفي يابت الناس بعدي عني
84	واني عيملت ايه يعني
87	ايوه اجرمتي
91	
96	واني عيل صغير برياله عاد
102	واااه احنا ف الشارع ابت
2	انتي بتهببي ايه بتسقطي نفسك
3	وااه اسقط ايه
5	اتساهلها ولا تسقطها يامخبوله انتي
6	انت كابتني اكده دايما
7	طب روحي هزي نفسك واعمللنا لقمه نفطرو بيها بدل الهبل ده وربط راسه من الصداع بمنديل
9	هههه ان عامل كيف برج اكده ليه
10	برج مين يامخبوله.
11	ده لاعب تنس قديم كان يربط راسه اكده والي يعملها نقول عليه كيف برج
14	اه ياني منك ع الصبح اكده وعيان كمان
15	يمكن دماغي تفك
16	حل عني اني مانقصاش بدل مااولد ف يدك
18	يلا ياهاشم هنتاخر
19	ماني جاهز اهااا
21	ده مش طريق المستشفي
22	ماني عارف.
23	اكده هتاخر
24	مافيش شغل انهارده اني حجزت اوضه ليا اني وانتي ف اوتيل ف اسيوط عاوز ابقي معاكي لحالي انهارده
27	طب مش تقول اجهز نفسي
