line	text
56	يعني ماينفعش توريهالي الا ف اوضه النوم
58	واااه كيف بتعملي اكده وقام ليلقيها هي ع السرير لتمسك يده وتجذبه لها ليقع فوقها
64	جايه اشوفك يا سبعي
66	استني ياراويه انتي مافهماش حاجه لتجذبه بيري
75	اني راويه ياخوي افتح
81	اخرج بره ماعاوزاش اشوف خلقتك العفشه دي تاني
1	احنا عملنا اللي علينا وعملنالها غسيل معده بس لحقناها على اخر لحظه النبض كان ضعيف جدا
4	ربنا يستر ليه يابتي تعملي فيا اكده دااني ماليش غيرك
5	اهدي ياعمي ماتقلقش
6	في ايه؟
14	ربنا يطمنكو عليها وتقوم بالسلامه
18	لا روح انت كتر خيرك مالهاش عازه قعدتك اهنه وماتقولش لامها.
21	ماشي ماهقولش شيء
24	على ايه ياعمي دي مرتي وعرضي واي كلمه عليها ماقبلهاش واصل واللي يمسها يمسني
25	وهبه ربي رجال صوح
28	ممكن اخشلها يادكتور دقيقتين
29	طب دقيقتين بس وماتجهدهاش لو لقيتها فاقت
35	ديه عامله تعمليها ليله جوازنا يابت عمي
41	انت مش عاوز تتجوز عليا.
43	انتي عبيطه حد يهمل بت عمه ويتجوز عليها
44	مش انت اللي قلت اكده
45	واني اي حاجه اقولها تصدقيها ياهبله بضحك عليكي عاد مانهزروش مع مرتي
46	لاااه انت بتكدب عليا وبتتعمد. تهني وتذلني
48	في حد بيتجوز عشان يذل مرته
50	واااه انت جليل الحيا يااحمد اخرج بره
51	انا اكده اطمنت عليكي.
58	حاضر يادكتور
59	يابنتي انتي لسه صغيره
63	يعني اكتبلك خروج
64	تهز راسها
66	ايوه يا يوسف بيه خلاص قربت اوصل ورايح اجيبها عشان معاد المدرسه هودي الدكتوره جميله لاسيوط ف المستشفي وبعدين زي ماتفجنا نجيبو مرتك ع المكان اللي ورتهوني
67	ماشي واني مستنيك هناك وهنتظرك ادام باب الفيلا
68	تمام وربنا يستر
69	يارب ماتقلقش
72	حاضر ياعم ابراهيم
74	خلاص اهو اني جاهزه
77	يلا ياعم ابراهيم هتاخر اكده
78	في طريق جديد هنروح منه بسرعه
79	طب اني هنام هبابه لحسن الحمل جايني بالنوم اني كمان كنت بتريق على جميله بقيت اكتر منيها
81	ماشي
89	روح انت يا عم ابراهيم
90	لااه انت هتهملني وياه لحالنا
92	دا جوزك يابتي وانا مهملك مع راجل غريب
93	بالسلامه انت عاد سيبك منها
99	سكري خشمك يابت بقي بدل مااخدك على بوزك ودخل واغلق الباب.
1	تعال ياولدي ماتعملش ف حالك اكده
4	كيف ريداني انسي كل اللي صار
8	ياولدي كل ده احنا اللي عملناه بنفسينا واخترناه بيدنا
13	ماقدرش ياماي كيف ريداني اهمل سنين عمري اللي راحت بلاش
15	خلاص ضيع سنين عمرك الباقيه عاد
18	هي عمرها ماحبتني هي بتتكبر عليا ومفكراني اقل منيها ولا جاي اشحت منيهم
22	هاتها اهنه اوضه امي اني خلصتها وفرشتها
29	ماتجلجش اكده ياعريس هتبقي اب قريب
32	حاضر يادكتور
35	واحنا بنهرجوا ولا ايه ياصاحبي كل الاعراض بتجول اكده
38	اني ماهخليهاش تعمل حاجه واصل وهروق الشقه كلياتها وانا ف ديك. الساعه لما ابقي عمه
39	ماتستقويش على حالك انتي كومان لتكوني حامل
40	يعني هنقعدوا احنا الاتنين ومين هيعمل
41	اني اللي هعمل
42	ههههه من ميتي ده
43	طب استاذن انا
44	اباي اقعد اشرب حاجه
45	معلهش سايب العياده لحالها
52	بس ياخوي مايصحش اكده ماتنساش انها حامل
53	والله لولا انك حامل ماكنت خليت فيكي حته سليمه
54	خدي اخوكي واطلعي بره ياراويه وهمليني مع مرت اخوكي
58	طب تعالي اقعد
59	ماهتزفتش همليني لحالي
60	خلاص انت حر
66	لاااه اني مارايداهوش ولا رايده عيل منيه
70	لا والله بقي هتجتلها مش شايف حالك بص لنفسك ياخوي انت هتجنن عليها
73	انتي بتهبلي تقولي ايه
77	لااه ده مريض نفسي واني مانجصاش جنانه ده انتي ماتعرفيش ابيعمل فيا ايه اني ماعاوزاش الحياه دي
79	طب بس يابنيتي عشان اللي ف بطنك واحتضنتها
81	هاشم طيب وحنين بس شاف كتير ومحملكو ذنب حياته اللي عاشها ف حرمان وانتو ف العز بتاعه ولا سائلين عنيه.
82	والله ياخاله بوي وعمي ما بطلوش تدوير عليكو حتى بوي كان يقول ليوسف قول لزمايلك ف الكليات لو لمحو اسم الاسيوطي لحد معاهم يقولو اكيد عمك. خلف عيال يمكن نلاقيهم عشان اكده لما جه هاشم ماتفاجأناش ولا حاجه لاننا كنا بندور عليهم لكن زي ابره ف كوم قش لا عارفين عمي مخلف بنات ولا شباب ولا اسمهم ايه ولا سنهم فكان صعب علينا نلاقيهم لكن والله ياخاله بوي ماكان له سيره الا عمي وهبه كان بيحبه جدا ودايما يقول عليه كلام زين وطلعنا نحبه من كلام بوي عنه وعن طيبته وشهامته.
83	وهاشم كيف بوه بس القسيه اللي شافها
88	لااه ياخاله ماعوزاش اسيبك اني هنام جمبك
94	بقولك نزلني ماعاوزاكش تحملني.
95	مش عشانك. عشان اللي ف بطنك انتي لسه كان مغمي عليكي بدل ماتدوخي تاني وتسمعي الكلام وبلاش نشوفيه دماغك دي
99	بعد الشر عليك ياخوي ماتجولش اكده
101	ماليش نفس لما اعاود ابقي اشوفلي لقمه وكليها هي و امك قبل ماتمشي
105	مش قادره ياراويه انتي ماخبراش حاجه واصل اني مابدلعش والله اني جواتي نار قايده منيه
106	طب بس يوسف جه ماعاوزنهوش يحس بشيء
11	فيه ايه داانتي لسه اول التاسع
12	شكلها ولاده مبكره حبتين خلص وديني المستشفي
21	يابنتي العمليه اسلم حل لكي الورم ف مكان بيستأصل وتكملي حياتك عادي
22	لاااه ماهعملش عمليه اني رايده ابدا بالكماوي ونشوف
24	انا مستغربك وكاني مش بكلم دكتوره وفاهمه
33	ماتفوقلنا شويه ياهانم وتراعي ولدك ولا احنا مش اد المقام
41	جميله فوقي اكده وجوليلي فيكي ايه
49	انتي غبيه
53	اني ماعوزاش شفقتك دي وماقدرش اجول لبوي يموت فيها
55	كنتي جوليلي ولا ليوسف
56	يوسف كان هيجول لراويه مابيخبيش عنها حاجه واصل وهي كانت هتقولك واني ماعوزاكش انت بالذات تعرف وكمان هو ملخوم مع مرته وولده ماعوزاش اشغل حد معاي واقلقهم علي
63	اني مامصدقاش حكيك ده واصل
65	كلام ماقدرتش انفذه
70	على فين.
3	اتفضلي ياماي ويقبل يدها
4	تسلم ياعيني
7	اني لوح يابنت وينظر لصابحه
9	انسان مغرورمستفز
12	اني سمعت انك مدرسه
13	ايوه اني مدرسه ف مدرسه حدانا ف البلد
15	انا اتخرجت من طب بجيت دكتوره ف الوحده الصحيه حدانا
16	ماشاء الله بت عمي ضاكتوره حته واحده
17	لاه حتتين ونص
18	الله يحظك ياجميله
20	واني كمان بس يوسف بيحاول يسد الفراغ ده واحنا اصحاب.
21	اباي عليه وده يتصاحب من انهي يامه ده
22	بجي يوسف تجولي عليه اكده امال هاشم ده التور الهايج
24	هاشم دي طيبه الدنيا كلاتها فيه بس هو ماشافش شويه وبعد موت بوي بجي مسؤل عنا حتى جبل موته
26	سيبك من السيره اللي تسد النفس دي نسينا نرحب بخاله صابحه
28	بخير يابنيتي
31	الله يرحمها ياخاله
32	واااه ماتت ياكبدي كانت جميله صوح وهاديه وبنت اصول
34	متشكره ياخاله
37	ايه دكتوره دي عاوزني اجولك يادكتور ولا ايه احنا ولاد عم اني جلتلك احمد تجولي جميله
38	ربنا يحفظك يابنيتي
41	همي يابت سلمي على ولد عمك احمد وبت عمك راويه والكبير جوه مع بوكي وتقولها بارف
42	ولاد عمي مين عاد هو ابوكي اتجوز على امك
43	لا ياهبله دول ولد عمك وهبه انتي ماخبراش كنتي لسه ماتولدتيش اصلك صغيره
46	وينه عمي ده.
47	مات اني كمان ماوعاش عليه طفش وكان يوسف لسه بيرضع بس كان بوي وعمي همام بسمعهم دايما يجيبو سيرته وحكولي اني ويوسف عنه لكن انتي صغيره ماحدش عرفك وامبارح. كتي ف درسك ماحضرتيش الخناقه ولسه سيادتك جايه مشرفه من الدرس اتاخرتي اكده ليه
48	هاااا ولا تاخير ولا حاجه كان في مساله معصلجه مع الاستاذ على ماشرحها
49	لا والله معصلجه مع الاستاذ طب سلمي يافالحه
50	ازيك ياخاله
53	الحمد لله
54	اني طالعه بقي اشوف المساله المعصلجه دي
55	ماشي ياسمرا مش مرتحالك
60	ودول طلعولك منين عاد
61	والله مابعرف
63	طب ماتيجي نطفشو احنا كمان.
65	ماشي ياست الضاكتوره
68	بس اني رايداك وابوي مابيرفضليش طلب
69	بس ده جواز مش اي طلب
70	بس بقي ماتجفلهاش
73	بوري الخاله صابحه وراويه اوضتهم واحمد اوضته ويبقي ياخد اخوه معاه
74	واااه هم هيقعدو اهنه
75	واااه ماجلتلك ليهم زي مالينا حقهم عنكلو عليهم ولا ايه
76	خلاص خلاص واني مالي
77	وانتي بتكلمي مين عاد
78	اني مابكلمش حد
79	امال ماسكه الموبيل ليه
80	وااه مسكاه وخلاص ودخلت وقفلت
83	وااه دي تعجب الباشا كل حاجه من يدك جميله يابنتي
84	تسلمي ياخاله واحست صابحه بالدموع في عيني جميله
85	مالك يابنيتي
90	على ايه ده حقكو
93	اني فعلا اول مره احس ان ليا اخت.
94	ربنا يخليكو لبعض ولا يفرق بينكو ابدا.
2	عاوزك تاخد الورق ده تقدمه ف المدرسه عندك بتاع مرتي
4	مالك هو الجواز تعبك ولا عجزت اياك
5	ماعاوزش حديت كتير مافايجش ليك عاد واغلق السكه
7	في ايه يايوسف خضتني عليك
9	يوووه جلتلك مافيش عاد
10	اكده في وفي كمان
12	انت اتجنيت اياك كيف تجول على كرتي اكده وكاد يخنقه
13	خلاص يايوسف في ايه يااخي
15	اني اجول لكن ماحدش يجيب سيره مرتي والا اجتله حتى لو صديقي هتخيب اياك
16	في ايه ياصاحبي عمري ماشوفتك اكده واصل انت حبيتها ولا ايه
17	سرح لااه مش حب بس ببقي مبسوط واني وياها وبضحك على حركاتها تحس انها طفله اكده
23	اباي اني عريس جديد وعاوزني اجول لبوي هنزل مصر
25	ماشي نعديها المره دي
27	ورق ايه
28	اباي مالك يايوسف عاد
30	ااه ده ورق نقل مرتي
32	موجود ف الورق هي كتباه
33	تمام.
40	لاااه ماليش نفس
41	يوسف ماتتعاملش معاي اكده اني ماغلطش وجلت لك الصدق
45	بحرج من قربه لها
47	اهاااجميله
49	لااه هي كانت بتحكيلي على عيشتكو ف مصر
55	انا خابر زين بس مقدرتش اتحمل وهو ماسك مرتي اكده
58	اني خفت منك
59	ليه ابو رجل مسلوخه اياك
64	بجد يا يوسف
65	اني لما شوفته ماسكك كنت هصور جتيل
66	بتغير عليا اياك.
67	اني مابطقش حد يهوب نواحي حريمي اقطعه قطيع
69	في ايه
70	جميله زعلانه وبتبكي
71	انت كنت جاسي معاها جوي وهي كانت رايده موصلحتنا
73	وااه ماكنت مسدود نفسك حالا
74	واااه اتفتحت عاد
76	لااه بالهنا
77	طب يلا بدل ماهقمش من اهنه واصل
79	تسلملي.
80	بس مافيش شغل عاد
81	وااه ليه بقي
82	اني جلتها كلمه ماهتنيهاش تروحي تعملي اجازه
84	والله لو رفستي كيف الاطفال ف الارض ماهرجع بكلامي.
1	سلام عليكم
2	وعليكم السلام
3	امال فين المدرسات والمدرسين
4	كلياتهم ف الفصول
9	كنت منتظرك
12	بس انا ظروفي حاليا ماتسمحش ومقدرش اجول لامي واخوي انا هتجوز وجهزوني حالا ده انا مايبقاش عندي دم
13	المهم انك رايداني زي مانا رايدك لو هنتظرك العمر كله انتي عارفه حالتي زي حالتك وعلى مادبر حالي واجمع تمن الشبكه والعفش واجدد دارنا لساتني باقي كتير
15	ربنا يجدم مافيه الخير
17	واني كمان يلا بينا
18	وانت هتفضل جاعد اكده لا شغله ولا مشغله.
19	اعملك ايه مانت صاحب نفوذ جد اكده ولا راضي تجول لحد يعيني ف بنك ولا حاجه عليها الجيمه
20	والارض وحسابات العزبه مش تراعي مالك ولا تسيبه للناس تنهبه
21	مانت مراعيه 24 جيراط
22	ياولدي حرام عليك انا تعبت ومحتاجك جمبي
27	واني اعمله ايه عاد
29	وماله مش ارضك وتراعيها
32	والله احلي ايام اتخنجت يا جوجو والله
36	هههههه بقي اكده ماشي شوف مين هيخرجك عاد
37	استني يابت عاد اهو احسن من الخنجه دي يمكن نلاقي موزه تايهه اكده ولااكده
38	يا سوادي عليك مافيش فايده فيك اياك. تعملنا فضايح اهنه والله اجتلك بيدي
40	هو مين الكبير فينا ابت
41	انت بس مخك اصغير.
42	ماشي يابلغه وياخذها من راسها تحت ذراعه فهو يعشق اخته وهي صديقه له
45	بخير ياولدي طول مانت بخير
47	خيرك مغرقنا ياولدي والدكان بيطلع والحمد لله
48	اني عاوز نصفيه وتجعدي بقي انتي تعبتي واني بشتغل والحمد لله وفتحت مكتب اني وزمايلي اهنه غير مكتب المحامي الكبير ماهسيبهوش
49	ربنا يكتر رزقك ياولدي.
50	وانتي ياراويه كيفك ماعوزاش حاجه
51	لا ياخوي ربنا يخليك. لينا ومرتبي كويس وبجيب جهازي بيه
52	طب خدي دول
53	معاي والله خليهملك
54	ابه لما اقول كلمه تسمعيها عاد روايه: حاضرياخوي ماتزعلش نفسك
55	وانت يااحمد ماشي زين ف الثانويه
56	الحمد لله ياخوي نفسي اجيب مجموع صيدله
57	ان شاء الله تجيبه واي حاجه تعوزها مايهماكش
58	واحنا حمل صيدله ياولدي ماتخش زي خواتك.
59	لاااه اللي يعوزها يخشها ولو طب اني رجبتي سداده
60	تشكر ياخوي.
2	ايوه يا عم كمال رايد ااجر فيلا مطرفه ف اسيوط الجديده شهر اكده
3	ماشي يايوسف بيه طلبك عندي لسه جماعه مسافرين وجالولي ااجرها لهم فتره سفرهم
4	بس مطرفه ماحدهاش جيران
6	بن حلال مصفي
8	ماشي اني جاي اشوفها حالا
9	كيفك يايوسف امال راويه مش هتعاود ولا ايه
10	قريب ان شاء الله اصل الحمل تاعبها وقاعده جار امها.
11	مش هتفطر
12	لااه عندي مشوار افطر انت واهي سمرا جات تفطر معاك
14	اصباح الخير
15	اصباح النور
22	اني كلب اجرب يامقشف
26	ايه رايك يايوسف بيه
27	ديه تمام التمام جوي جوي كومان
29	ماتخافش سرك ف بير
31	جرا ايه ياولدي هي الناس كلياتها هاجرت من القصر
34	اصل الحمل تاعبها وجاعده جار امها ماعاوزش اضايقها عشان الحمل لكن شويه وهتاجي ماتجلجش يابوي واني بروح اشقر عليها.
35	ماشي ياولدي اللي يريحكوا عاد انتو ادري بموصلحتكو
36	ماتخافش علينا يابوي
40	انتي كيف تاجي ف انصاص الليالي وبالشكل ده
42	اني ماليش صالح تلبس ف مصيبه ف اتوبيس ولا لوري حتي
52	بكره هبقي دكتوره واحسن منيك كمان
53	ابقي قابليني.
58	جايبه الثقه دي كلياتها منين
60	اخرس ياقليل الحيا
63	عشان تفكري الف مره جبل ماتتحدتي معاي وغوري من اهنه
67	والله ياعمي مافي حاجه من اللي ف دماغك دي هي اللي جاتني
71	يانهارك اسود اني يا بنت الكدابه عيملت اكده
77	ده الامانه اللي امنتهالك ياولد خوي
79	والله ماعملت حاجه
80	اكرشه يابوي من اهنه
81	انتي تخرسي خالص
83	اني
85	مافيش حل الا نكتبو كتابكو ونداري الفضيحه دي وماعاوزش حد يعرف بالموضوع ده
86	نهار اسود اني اتجوز خليفه جانكيز خان ده
88	اني اجوز الصايع، وتوقف حتى لايقول امام عمه.
90	واااه واللي شوفته ده ايه
93	عامله ايه يابوي ماعملناش حاجه داني بساله ف مساله
95	برديك هنكتبوا كتابكوا بكره عشان ابقي مطمن ماهحطش البنزين جمب الكبريت واقعد اتفرج لما تولع وتاكل الاخضر واليابس.
97	واااه واني يعني اللي مبسوطه واني كنت اعرف ان ده كلياته هيحصل
98	يلا كل واحد على اوضته واوعاكي رجليكي تخطي اهنه تاني
100	يخرب بيت ام الليله اللي مش فايته
102	اني ماكنتش اعرف ان ده كلياته هيوحصل.
104	لا اكده واكده ماخلاص لبست فيكي ياعملي الاسود ف الدنيا اني كان مالي تمشي مع ده ولا تكلو بعض حتي
105	لاااه يااحمد اهرب من اهنه
107	حوش حوش اني اللي رايدك جوي
111	وااه ماانت بتحب اها امال محرمه عليا ليه.
114	مش بالجمال
116	واني بنته مش زينه
124	ابتضحكي والله ماهتجبيها البر الا اما يطخنا عاد
3	اني خلاص ماعتش قادره استحمل غيرتك وشكك الزياده دول
9	اهااا جلتي صغار.
11	لا يااحمد انت كده بتحسسني انك مش واثق فيا
15	ده متربي وياي
16	اباي مابيتربو سوا ويتجوزو عادي واني عارف كان بيحبك ولا رايدك ولا ايه وضعه ده.
23	امي بتنادي
24	طب يلا نروحلها انتي مش قلتي في حاجات واقفه معاكي ف الفيزياء
26	مش هعطلك بخجل
27	لااه اني فاضيلك انهارده
29	حاضر
31	في ايه يااحمد خف ع البت شويه دي لسه صغار ياولدي ومالهاش غيرك بعد ربنا واني وابوها لا ليها اخ ولا اخت
32	مافيش حاجه يامرت عمي
34	خلاص ياماي مافيش حاجه
36	طب ياوليدي ربنا يهدي سركوا
37	امين
39	هستناكي ف المكتب بليل.
41	ليه اكده
42	عندي امتحان
43	طب هستناكي عشان ماتعاوديش بليل لحالك
44	ماشي
47	ماشي ياعمي.
49	اني ريحتك ع الاخر اهو وجينا كلياتنا وياكي الدار
53	ماام السيد ويايا يا ولدي
54	لااه هناك راويه ويوسف واعمامي وخدم يخدموكي وهبقي مطمن عليكي لو حوصل حاجه يتصرفو
57	واااه ماهتاخدوش الولد وياكو
58	ماهنبقاش فاضيين وانتي عارفه جميله شغلها لبليل ساعات
61	هتطولو كتير
62	ماخابرش ياماي دعواتك نخلصوا على خير
64	على طول اكده وهي تتامل دارها التي طالما جلست تتسامر مع زوجها فيها ولكن احيانا تقتضي الضروره والظروف بان نترك ذكرياتنا
67	اتوحشتك جوي جوي ياماي
70	كيف يعني ماتجوليش حتى ليا
71	ماعوزاش اقلقك معاي ياخوي
72	تقلقيني!
76	تسلم ياخوي ربنا يخليك ليا ولا يحرمنيش منيك ابدا
79	اتكلم على نفسك عاد ههههه.
4	واااه اخس عليك ياحمد اكده تفزعني
8	ليه يعني انتي مرتي
9	لااه لسه ده كتب كتاب بس.
10	ولو عاوز ادخل من بكره ماحدش يقدر يقولي لاااه
11	واااه انسيت اني ثانويه عامه
13	طب يلا اما اشرحلك عشان الحق اناملي شويه عندي كليه بكير
14	افهمتي
15	لااه
19	وااه ماني فاهمه من اول نوبه
21	بقي اكده طب والله ماعاتقك داانتي نشفتي ريقي
22	طب اجيبلك عصير
23	لااه
24	طب مايه
25	لااه مش ده اللي هيبل ريقي فجرت منه للباب
27	الكل نام ثم يشوفنا اللي يشوفنا واني بخاف
28	لااه اني طالعه
29	طب خدي يابت كتابك
30	ماعاوزاهوش خليه عنديك يفكرك بيا
31	ماشي يا شقيه يامجنناني
34	لااه يااحمد لازمن تطلع معيد عشان تشرحلي
35	بتاعه موصلحتك
37	لااه يااحمد بعد عني
39	ابتعملو ايه السعادي
41	احمم كنت بذاكر لسمرا شويه فيزيا مافهماهوش
42	فيزيا ماشي ربنا يقويك
44	اه ماحنا كنا بنجفل اهاا.
45	بتجفلوا طب يلا همو كل واحد على اوضته الوقت اتاخر
46	حاضر يلا ياسمرا ونزل هاشم وهما طلعا
47	شايف عمايلك عاد
48	واني عيملت ايه يعني
50	حاضر ياخوي ويبتسم لفهم اخيه لما يحدث
51	والله لو جبت اقل من الاول لاعلقك كيف الدبيحه
52	ماتخافش على خوك
53	اني ماخايفش عشان وهبه ماخلفش غير رجال.
55	خشي يابت اتخمدي عاد
57	واااه حاضر كنت بطمن عليك انك اطلعت
58	يابوي طب انام كيف اني اكده
60	وانت من اهله
61	انتو لسه واجفين عاد
66	الفجر لساله حبتين قلت اتوضي واقرا شويه قران على مايدن.
69	لاه ماهعرفش انام تاني
71	ماشي
73	ايه مصحيك ياخوي بكير اكده
74	هاجي معاكو واني ههملك لحالك اكده الا اما اطمن عليكي الاول واشوف الوضع ايه
76	يلا نتوضا الفجر قرب ونلبس وهحصلكو بالعربيه بتاعتي وراكو عشان اعاود بيها
78	انت ماسبتش حاجه عاد مافكرتش فيها
79	واني ليا كام اخت ياعبيطه
83	ربنا يجومك بالسلامه ياخيتي.
85	تسلملي ياخوي ويخليلك ابنك وتخاويه كمان
