line	text
97	إسمه أتلييه يا مرات عمى، بس ده بروحه أقتل الفراغ اللى بحس بيه، بدل ما أتأمر عالشغالين عالفاضى والمليان واعمل فيها صاحبة كلمه.
99	جولت قبل إكده، لا كلام على طعام، خلونا نتعشوا مع بعضينا، في سكات.
100	جدتى كنت عاوزك أنتى وبابا في موضوع خاص.
101	تعالى لمجعدى.
106	خير يا كارم عاوزنى ان وابوك في أيه؟
107	همس.
108	مالها همس ياولدي، أنا كنت عنديها من كام يوم وكانت زينه وبتصل عليها كل يوم ومش بحس هي كمان بتصل على وصيفه عشان أطمن أكتر.
110	هي بتقول إنها مرتاحه كده، بس مش ده السبب اللى كنت عاوزك فيه يا جدتى، أنا طالب مساعدتك.
111	أساعدك في ايه ياولدي، أنا خلاص بجيت ست كبيره ومش قد المناهده، جول اللى عاوزه من غير كلام كتير.
112	الحچه هدايه مش قد المناهده، بس عندك حق يا أمى، فعلا أنا عاوز أعرف كارم عاوز يوصل لأيه.
113	أنا طلبت من همس إننا نتجوز في أقرب وقت وهي رفضت.
117	أنا سبق وقولت لها إنك طلبتها للجواز، وسكتت مردتش، قولت يمكن موافجه.
118	لأ يا بابا مش موافقه ولما حاولت أقنعها سابتنى ومشيت وحتى بتصل عليها مش بترد وكنت هروح لها الشقه، بس قولت أخليها تهدى شويه، وأطلب من جدتى تساعدنى وتحاول تقنعها نتجوز.
119	حاضر يا ولدي هستنى كام يوم واروح أحاول أقنعها، أنا مش هطمن عليها غير لما تكون مرتك، حتى لو مرضتش تكشف إنها لساتها عايشه.
120	بس هي توافق تتجوزنى واللى يحصل بعدها يحصل حتى لو قالتلى نهاجر مش همانع.
123	كارولين، رأى بسمة شفاها التي كانت تفتنه سار مغمض العين، الى أن وصل الى مكان الفراش وجلس عليه متنهدا، منتشيا، ثم فتح عينيه ليتحسر قلبه بعدها، الغرفه خاليه من كانت تسكن خياله قبل لحظات، رحلت وأخذت قلبه معاها، وهب حياته من بعدها لاولاده، كأن القدر يعاقب العشاق بالفراق، من عشقها رحلت وأخذت روحه وسعادته معها، ومن تزوجها ببدل ومازالت تفتعل المناوشات ظلت هي معه، أهنالك عقاب أقسى من ذالك، لو تبدل الوضع وعاشت كارولين، لأصبحت أما حقيقيه لأبناؤه الأربع وربما زادوا عن ذالك وعاشت تلك الفتاه التي أخذت معها والداتها، كارولين كان بقلبها الحب فائض، حتى على أبناء ضرتها، كانت تسعد بهم كانت تود عائله كبيره، لكن كان القدر معها معاندا حاولت الإنجاب بعد قماح أكثر من مره لكن لم يكن يحدث، وحين حملت بعد أكثر من تسع سنوات كانت سعيده لكن كان هذا الحمل لعنة النهايه لها ولفتاتها.
125	سلسبيل نبع المايه العذب، حاسه إنها إتخلقت علشانك، يا قماح، أوعى في يوم تزعلها.
126	وأنا كمان بحب سلسبيل عشان إنتى بتحبيها ياماما ولما تكبر مش هخلى أى حد يأذيها ولا يقرب منها.
131	خير يا ماما.
132	خير يا دنايا، كنت عاوزه أسألك، ليه بجيت بنغيب عن الدار كتير، ده قليل لما بتچتمع معانا على الوكل.
133	مفيش بس مشغول الفتره دى أدعيلى بالخير.
134	بدعيلك انت وأخواتك بالخير، بس مشغول في إيه جوى إكده.
135	إشتريت كافيه في منطقه كويسه وبجدد فيه.
136	كافيه، قهوه يعنى، طب ليه يا ولدى مشتغلتش مع أخواتك الإتنين في الشون بتاعتنا.
137	أخواتى تلاته مش إتنين ياماما، وانا مش غاوى أشتغل في الكار ده، كفايه محمد وذل رباح له، وتفضيله لنسيبه على أخوه، ده قماح بيعامله أحسن من رباح.
138	جولى موضوع أيه اللى كنت عاوز چدتك وابوك فيه؟
139	كنت بطلب من جدتى بمناسبة إنى خلاص خلصت تجديد في الكافيه اللى اشتريته، تجى تبخره وآخد بركتها وبابا كان علشان يقنعها معايا.
140	بركتها، ثم أكملت بإستهزاء وهي تضرب على صدر كارم بخفه: ربنا يديها طولة العمر إحنا عايشين في بركتها، هروح اشوف ابوك زمانه طلع لأهنه، تصبح على خير.
145	مالك هو الصداع مش كان خف عنك، رجع تانى ولا أيه.
146	مش عارف ليه رجع من تانى، حتى علبة الحبوب اللى كنت باخد منها قربت خلاص تخلص، وكنت بفكر أجيبها من أى صيدليه.
147	لأ بلاش الصيدليه.
148	قصدى يعنى ده دوا مستورد ومش هتلاقيه في الصيدليات موجود، أنا واحده صاحبتى أخو جوزها عنده صيدليه بتبيع أدويه مستورده، وهقولها تجيبلي علبه، طالما بتريح الصداع عندك.
149	ربنا يخليكي ليا يارب.
150	وربنا يخليك ليا، انا ماليش غيرك، في الدنيا، بعدك.
152	هو قماح وسلسبيل متخانقين، أنا كنت سمعت صوت قماح عالى بعد الضهر، وكنت هروح أشوف في ايه، بس قولت ماليش فيه، ده راجل ومراته.
153	تصدقى ممكن يكون بينهم خلاف، سلسيبل كانت رايحه تقعد جنب هدى، بس جدتى قالتلها مكانها جنب قماح.
154	طبعا الست سلسبيل حبيبة قلب هدايه، معندهاش غيرها عالحجر، كأنى انا كمان مش مرات حفيدها، دى معفرتش رجليها بتراب السلم وطلعت تطمن عليا، بعد ما سقطت، لو كانت سلسبيل مكانى حتى لو جالها صداع عندها إستعداد تطلع السلم عشر مرات، لكن انا طبعا ماليش قيمه عندها.
155	إنتى أغلى الغالين يازهرت مش جديده على جدتى تفرق في معاملتها، أنا نفسى بتفرق بينى وبين قماح، بس أنا بقيت بفوت اللى يهمنى انا وأنتى وبس.
156	رباح في بنت صاحبتى ودلتنى على محل لبس حريمى إنما إيه بعتتلي صوره لقمصان نوم وعبايات مستورده إنما أيه ذوق عالى قوى، كنت بفكر بكره أروح أشترى شوية لبس كده أدلع بيهم وكمان أخرج من حالة الإكتئاب اللى عايشه فيها بعد ما سقطت.
157	وماله يا روحى اخرجى براحتك، بس قبل ما تخرجى من البيت أبقى خدى إذن جدتى، علشان هي مضايقه من خروجك من البيت بدون إذنها.
158	ده اللى ناقص كمان اخد إذن هدايه قبل ما اخرج من البيت، ليه مش متجوزه راجل ولا أيه.
160	متجوزه راجل يا زهرت بس انا بقول بلاش تشدى قصاد جدتى، هي عاوزه تحس إنها صاحبة كلمه في الدار، بس طبعا الكلمه دى مش عليكى، يا روحى.
161	علشان خاطرك هستحملها، بس أنا وعدت صاحبتى أفوت عليها بكره عشان اشترى شويه هدوم، كم قميص نوم عحبونى ولما تشوفهم عليا هيعجبوك قوى.
162	إنتى زينة الصبايا يا زهرت بتزينى أى شئ تلبسيه.
163	وكمان عشان اجيبلك دوا الصداع يريح دماغك شويه.
164	آه ده مهم قوى، أنا دماغى مش برتاح غير عالدوا ده.
165	كنت محتاجه فلوس معايا.
166	بس كده اللى تطلبيه يا قلبى، ودلوقتى تعالى في حضنى مش بعرف أنام غير وأنتى في حضنى.
167	وانا كمان مش برتاح غير في حضنك، يا حبيبى.
175	صوت التلفزيون عالى وصحانى من النوم.
176	لأ مش عالى، بس تمام أهو قفلته خالص عشان تعرف تنام، تقدر ترجع للأوضه تكمل نومك تانى بدون إزعاج.
177	وانتى هتكملى نوم هنا عالكنبه.
178	والله الكنبه مريحه جدا بالنسبه لى.
181	إنتى قصيتى شعرك.
182	أيوه أنا متعوده أقص جزء من شعرى من فتره للتانيه حتى هم...
184	سكتى ليه متعوده أيه؟
185	متعوده أقصه وخلاص وبعدين هو كان شعرى ولا شعرك، لازمته أيه التحقيق ده، عادى فيها أيه أما أقص شعرى؟
189	إنتى كلك ملكى، كل جزء في جسمك ملكى. وبعد كده ممنوع تقصى سنتى واحد من شعرك، مش عاوز أظهرلك وشى التانى يا سلسبيل.
192	بعد كده ممنوع تلمسني.
193	هتحرمى نفسك عليا إياك.
194	أيوا يا قماح من النهارده إنت بالنسبه ليا إبن عمى وبس، وتأكد طلاقنا هيتم في أقرب وقت.
6	بث (بص) يا عم نثيم (نسيم) انا خدت عشر كيلو رز ومعاهم سبعه كيلو دقيق قمح وتلاته دقيق دره، هو ده حسابك وكفايه إنى محسبتش أجرة التوكتوك اللى هروح بيه المفروض كان يبقى عليك.
7	توكتوك أيه يا سميحه الحساب ناقص أصلا عشره جنيه، يا بنتى أنا صاحب بقاله على قدى مش فاتح فرع لسوبر ماركت كارفور، هاتى العشره جنيه والمسيح الحى أنا مديكى البضاعه بتمنها اللى جايه ليا بيه، طب أجولك نقسم البلد بينا هاتى خمسه وخليلك خمسه اللى مش هتركبى بها توكتوك أنا ألف مره أجول للست فتحيه بلاش تبعتك تاخدى منى حاجه إنتى بتناهدى معايا وبتفاصلى في حق باكو اللبان، وأنا مبقاش فيا حيل كبرت عالمناهده بتاعتك دى، أنا جايل ل فتحيه تتصل عليا أو حتى تبعتلى أى حد من الشارع وأنا هبعتلها اللى عاوزاه لحد باب الدار.
8	قصدك أيه يا عم نسيم يعنى مش عاوز تشوف وشى، أنا كان قلبى حاسس من زمان إنك مش بتحبنى وأنت اللى معصى الواد كيرلوس إبنك ابو عيون إزاز عليا ومش عاوزه يتجوزنى.
9	يا بتى كيرلوس ميجوزش ليكى، إنتم مش على مله واحده، إنتى ناسيه إنك مسلمه وهو مسيحى.
10	مش عيب يا عم نسيم الواد كيرلوس ابو عيون إزاز يعمل زى عمر الشريف لما أسلم علشان يتجوز فاتن حمامه، هي فاتن حمامه أحسن منى في أيه، إن كانت هي سيده الشاشه العربيه، أنا سيدة خط الصعيد الأولى، وهيبقى عندى آتلييه لصناعة الخزف.
11	قصدك القلل اللى بتبيعها ل إستير على إنها فازات آثريه، غير أنها بترشح المايه، ولا الماجات كمان اللى بتفرقع من الميه السخنه.
12	أى فخار بيرشح مايه، ده صحى عن ماية التلاجات، وكمان قولتها بلاش تغلى الميه قوى قبل ما تفرغها في المج.
13	آه الفخار بيرشح، بس دى مش بترشح دى بتسرسب المايه في مفيش قبل ما نشرب منها تكون فضيت، عيب في الصانعه.
14	عيب في أيه!
16	هتشيلى على راسك ليه مجيبتيش شنطه معاكى كنتى شيلتيهم بين إيديكى.
17	لأ إيدى تخدل وتوجعنى على ما أوصل، يلا خلصنى وشوف الزبون اللى واقف ده عاوز أيه.
19	ساعدنى يا أخ أحط الكاتونه دى على دماغى بدل ما أنت واقف بقالك ساعه تتسمع على كلامنا.
20	البرطمان ده خلاص مفيهوش غير كم كرملايه، هاخده أتسلى في الكرمله وانا بخبز وأدكن البرطمان لما نعمل مربة الارنج أبقى أخزنها فيها ومتخافش نايبك محفوظ يا عم نسيم.
21	كم كرملايه أيه يا سميحه هاتى البرطمان وأما يفضى أبقى خديه.
22	لأ أنا خلاص اخدته، سلام بقى هبقى أجيب ل إستير كم رغيف عيش بنى زى هو اللى بتحبه.
23	إستير بتحب عيش الرده إنما إنتى بتضحكى عليها بالعيش بتاعك مصبوغ دقيق أبيض باللون البنى.
24	يا عم هي إستير بتركز في اللون إنما الطعم عندها مالوش لازمه، يلا وآه قبل ما أمشى قول ل استير، الدراسه هتبدأ الاسبوع الجاي، أنا مش عاوزاها تعملى سندوتشات لانشون وسجق سمعت انهم يفرموا فيران مع اللحمه، أقولك قولها تعملى سندوتشات جبنه رومى وحلاوه طحنيه بس بالمكسرات اللى الواد كيرلوس ابو عيون إزاز بياكل منها، يلا أهى آخر سنه وأتخرج وأرتاح من الدراسه وأنطلق نحو المستقبل.
25	كل سنه وانتى طبيه بمناسبة رجوع الدراسه، سلميلى على فتحيه.
26	أستاذ حضرتك عاوز أيه.
27	كنت عاوز تشكيلة حلويات مع بعضها شوية كرمله على لبان وبونبونى.
28	الكميات عاوز قد أيه.
29	ممكن تملالى برطمان من بتوع الحلويات اللى قدامك ده.
31	المبلغ المطلوب أقل من كده بكتير مش معاك فكه.
32	لأ للأسف.
33	حضرتك أول مره أشوفك هنا، أكيد عابر طريق، الحلويات دى واخدها لعيالك مع إن شكلك صغير على إنك تكون متجوز.
34	فعلا أنا مش متجوز، والحلويات دى واخدها لنفسى أتسلى بها في الطريق، سلام.
39	أول مره في حياتى أبات بره دار العراب ماما عمرها ما سمحت إن واحده فينا تبات بره الدار حتى لو عند أى حد من قرايبنا حتى رحلات المدارس والجامعه ممنوع في أماكن بعيده.
40	ليه كذا مره سافرنا نصيف او نتفسح وكنا بنبات بالأيام بره دار العراب.
41	بس كنا بنبقى عارفين إننا راجعين تانى ل دار العراب، المره دى بابا قال هنعقد في الاوتيل كم يوم على ما يدبر لينا بيت نعيش فيه، بصراحه متوقعتش إن بابا يوافقك ويسيب دار العراب حتى ماما كمان معترضتش زى عادتها على حاجه واحده فينا عاوزها.
43	لو حاسه بتعب أنادى لبابا يرجعك للمستشفى تانى.
44	لأ أنا كويسه مش تعبانه كل اللى حاسه بيه شوية إرهاق وعاوزه أنام يمكن من تأثير الادويه اللى أخدتها، طفى النور وتصبحى على خير.
45	وأنتى من أهل الجنه إنشاء الله هتصحى كويسه.
49	ليه بتبكى يا نهله.
50	ببكى على ضعفى، اللى كان هيضيع منى بناتى واحده وراء التانيه في الأول خسرت همس، وسلسبيل كمان كنت في لحظه هخسرها، عقلى بيشت لما بفكر إن الرصاصه كانت ممكن تصيبها وتموت هي كمان جدام عنيا جلبى مكنش هيستحمل أفجد بت تانيه من بناتى، حتى لما ربنا نچاها والرصاصه صابت قماح مقدرتش تصلب طولها وأغمى عليها، قد ما فرحت ببراءة همس قد ما قلبى إنخلع لما شوفت وعرفت قسوة قماح على سلسبيل اللى كانت بداريها جدامنا لحد مافاض بيها، أنا لما أمى هدايه جالت إن قماح عيتچوز من سلسبيل فرحت وجولت واد عمها وأكيد مش هيعايرها ب همس بس كنت غلطانه كنت هستنى أيه من واحد زى قماح إتچوز وطلق مرتين قبل أكده، إزاي مفكرتش في أكده.
51	أنا عندى إحساس مؤكد قماح بيحب سلسبيل، أنتى مشوفتيش ملامح وشه لما سمع طلب رچب سلسبيل لابنه، بس مستغرب ليه عاملها بالجسوه دى، حتى سلسبيل نفسها عندها مشاعر ناحية قماح، وأها شوفتى بنفسك مجدرتش تتحمل منظره وهو عايم في دمه وعقلها فصل حتى أول ما فاجت كان أول حاجه قالتها سألت على قماح.
52	أول مره أسيب دار العراب من تلاتين سنه من يوم ما أتجوزنا، حاسه بغربه وضياع.
53	تعرفى إن إستغربت إنك معترضيش لما سلسبيل طلبت إننا نسيب الدار مش قادره تتحمل تجعد فيها.
54	أنا نفسى إستغربت إزاى قبلت إنى أسيب دارى، بس سلسبيل كانت أول فرحتى، وراحتها تهمنى.
55	لسه فاكر يوم ولادتها ولما شيلتها أول مره حسيت إنى ملكت سعادة الدنيا كلها، كانت فرحه إتشوقنا ليها سنين.
56	لما خلفت التلات بنات حسيت إن قدريه فرحانه، كنت بأسى عليهم عشان ميبقوش زيي ضعاف، كنت ببقى مبسوطه لما يعارضونى ويجولك يطلبوا منك توافق على حاجه أنا رفضتها، حاولت أربطهم بيك عشان ميحسوش بالضعف، يحسوا إن وراهم سند، أنا أتربيت يتيمه وكنت أنا وأختى وأمى لوحدنا، شوفت أمى كانت في بيت العيله خاضعه لقرارات غيرها، فاكره مره جدتى كان عمى جايبلى عريس يخلفنى وياريته كان فيه ميزه، خوفت وجتها جدتى توافق عليه وتدمر حياتى معاه، بس هي اللى رفضته عارف لو جدتى وافقت عليه أمى مكنتش هتعترض، أنا دايما جوايا خوف عشت بيه في بداية جوازى منك رغم إننا إتجوزنا عن حب، بس كنت خايفه.
57	كنتى خايفه من أيه؟
58	لما حصل وإتقدمتلى زمان، عمتى سألت عنك، وجالوا لها الحچه هدايه شديده جوى، غير ولدها الكبير متجوز مرتين، وقتها عمتى لمحتلى أنى ممكن إنت كمان مع الوجت تتجوز عليا مره تانيه، بس أمى جالتلى في إيدك تكسبى الحچه هدايه، كلمة حاضر بتريح خليكى تحت جناحها، ورغم أنى كنت بحبك وعارفه إنك بتحبنى، بس دخل لجلبى الخوف ده، ولما دخلت دار العراب وغبت في حكاية الخلفه، حتى لما خلفت البنات وراء بعض، كنت بخاف إنك في لحظه تجولى هتجوز عشان أخلف ولد يشيل إسمى ويحفظ مالى.
59	بس إنتى كنتى عارفه إن مفيش فيكى عيب وتقدرى تخلفى، العيب كان فيا من البدايه، وأنا اللى كنت محتاج لشوية علاج، وأنتى أستحملتى ده معايا كله وصبرتى وعمرك ما حسستينى إن فيا عيب، ييجى بدل ما أكفئك أروح أتجوز عشان أخلف ولد، لو كان مكتوب لى خلف الولد كان هيبحى منيكى يا نهله، إنتى رفيقة عمرى كله.
64	عشان ماما كانت بتحبها
65	كداب مش ده السبب الوحيد الجواب إنك بتحبها مقدرتش تدخل لقلبك غيرها حاولت وفشلت.
67	قماح إنت موجوع أتصل عالدكتور.
68	لأ يا بابا أنا كويس بس إتحركت حسيت بشوية وجع بسيط.
69	الحمد لله إصابتك مكنتش خطيره، بس مقولتليش قولت أيه للظابط في التحقيق، أصل أنا قولت له أن ناصر كان بينضف السلاح وطلقه خرجت بالغلط.
76	في عندنا بيت صغير في بنى سويف قريب من المقر كنا عاملينه زى إستراحه لو حد من الأدارين اللى في القاهره بات هنا لأى ظرف طارئ، هبعت حد ينضفه ونروح نعيش فيه الفتره دى على ما أشوف بيت أوسع مش معقول هنعيش في الاوتيل ده كل إتنين في أوضه كده زى سكن التلامذه.
77	كان نفسى أدخل جامعة القاهره وأعيش في سكن الجامعه، بس ماما رفضت وقتها.
78	وكنتى هتدرسى أيه في القاهره مش موجود هنا، وبعدين إنتى مبتعرفيش تعملى أى حاجه خالص إزاى كنتى هتعيشى لوحدك في القاهره، كلى من سكات.
79	ده المحامى الخاص بالمقر هرد عليه.
80	طب وليه إستدعونى تانى للتحقيق مش قدمت أقوالى قبل كده، عالعموم نتقابل في القسم بعد ساعه.
81	خير سمعنا من ردك عالمحامى إنهم إستدعوك للقسم.
82	معرفش السبب المحامى بيقول يمكن شوية إجراءات، يلا أنا شبعت هقوم أقابل المحامى، وبعدها هطلع على الشغل، وأشوف إن الاستراحه جهزت النهارده نروح نعيش فيها، يلا أشوفكم المسا.
84	لازم زى الدكتوره ما قالت تحافظى على أكلك وعلاجك، خلينى أجى معاكى للأوضه التانيه.
85	لأ متتعبيش نفسك أنا هروح أخد العلاج وأرجع لهنا من تانى.
89	ليه إستدعوا بابا في القسم، مش سبق وقدم اقواله.
90	أنا معرفش السبب أنا لسه داخل القسم ولسه هعرف السبب.
91	بس أنا متأكده إنك تعرف سبب إستدعاؤ، ياريت بلاش لف ودوران.
92	بصراحه قماح بيه إتهم ناصر بيه إن هو اللى ضرب عليه الرصاصه.
94	طيب وبعد ما إستدعوا بابا للقسم ممكن أيه اللى يحصل.
95	ممكن يتحول للنيابه والنيابه ياأما تخرجه بكفاله أو تتحفظ عليه، ده إتهام مباشر قماح بيه بس هو اللى يقدر يسحب إتهامه.
96	تمام شكرا لتوضيحك الآمر ليا.
97	قماح لسه مستمر في جبروته، بس انا هعرف إزاى اوقفه عند حده.
99	مدام سلسبيل لسه قافله معايا وعرفتها بإتهامك لناصر بيه إن هو اللى ضرب عليك الرصاصه.
100	تمام كويس، دلوقتي قفل المحضر زى ما إتفقنا سلام.
101	المحامى إتصل على عمى وقاله على الاستدعاء، وكمان زى ما توقعت سلسبيل إتصلت عالمحامى تعرف منه سبب إستدعاء عمى، وقالها على قولت له عليه.
102	تفتكر هايجى بفايده وعمك ومراته وبناته هيرجعوا لدار العراب من تانى.
103	متأكد قبل المسا عمى هيرجع هو وهما لدار العراب من تانى.
104	أتمنى ده اللى يحصل، وياريت يكون ده فرصه تانيه لك مع سلسبيل وتصلح اللى عملته معاها وخلاها تطلب الطلاق قدام العيله كلها.
107	جدته روحت البيت بالعافيه بعد ما الدكتور قالها إنك ممكن تخرج بكره من المستشفى وتكمل علاجك في الدار، أنا عندى مشوار مهم هروحه دلوقتى وهرجعلك بعده هتصل على محمد يجى يقعد معاك لحد ما أرجع.
108	لأ مالوش لازمه خلى محمد يشوف شغله أنا كويس وإن إحتاحت حاجه هطلبها من الاستقبال.
109	تمام أنا مش هغيب، وهخلص مشوارى بسرعه وأرجعلك.
112	هند!
