line	text
4	فتحت الملف اللى عالابتوب اللى هدى باعتته لك.
5	أيوا فتحته مخدش منى وقت طويل.
6	ها قولى محتوى الملف ده فيه حاجه تدين حماد؟
7	تدين مش بس حماد تدين عيلة العراب كمان، ساعه بالكتير وأكون عند حضرتك في المستشفى بالابتوب تشوف محتوى الملف بنفسك.
8	تمام في إنتظارك.
11	خير، أتصلت عليا وطلبت منى أجى لهنا للضروره.
12	طبعا عارف إن.
15	طب وأنا مالى باللى وجدتوه بالشقه، أنا كان بلاغى عن هند إنها خاطفه إبنى؟
16	في حاجه وجدنها في الخزنه، كان في صوره لزوجة حضرتك، وكمان إحنا شوفنا أكتر من سى دى من السيديهات دى، ومحتواها إباحى.
17	مش فاهم قصدك، بوجود صوره لزوجتى والسديهات!
19	أتفضل دى صورة زوجتك اللى كانت موجوده في الخزنه.
20	دى صوره عاديه حتى محجبه فيها، معرفش أزاى صورها نائل، أكيد صورها خلثه.
21	أكيد طبعا بس مش صورة المدام هي المهمه، السيديهات ومحتواها الفاحش.
22	قصدك أيه، ياريت بلاش لف دوران.
23	السيديهات دى مصوره نائل مع واحده، إحنا إستخرجنا لها صوره لوشها من أحد الفيديوهات، هجيبلك صورتها يمكن تتعرف عليها.
24	زهرت!
30	خالى ناصر ساعدنى أنا مظلوم والله...
32	بتضربنى ليه يا خالى؟
33	لو بأيدى كنت ضربتك بالرصاص، بعد ما ساعدناك وأمنا لك مستقبل عمرك ما كنت تحلم بيه عضيت الايد اللى أتمدت لك بالخير، إنت خسيس وجبان وخاين كمان كنا بنآمن لك تدخل دارنا وتقعد وسطينا وأنت ألعن من الشيطان، الكلب اللى كنت آمره يخطف هدى ويجيبها لعندك أعترف عليك وهنا في القسم، واضح من ملامح وشك إنهم هنا في القسم رحبوا بيك كويس لأ ولسه كمان الابتوب بتاعك والملف اللى كان عليه يثبت كل جرايمك القذره وصل بيك الخيانه إنك كنت بتنقل ل رجب السنهورى المخدرات وسط بضاعتنا، ولا صور المنحوتات بتاعة سلسبيل اللى كنت باعتها لتاجر أثار وعاوز تبيعها له على أنها أثريه وتورط سلسبيل كمان، هدى ونظيم فتحوا الملف والابتوب قدمنا الملف للشرطه، ولا القذر اللى كنت طالب منه يجيبلك هدى بعد ما يخدرها بنفس طريقة همس، قذارتك هتضمنلك بقية عمرك في السجن، ده إن نفدت من أيد رجب اللى كان هيشرف معاك كمان بعد ما خونته هو كمان وسرقت بضاعته، أستغليت إنشغاله في موت نائل شريكك في القذاره، وفي الآخر شيلك قضيه مخدرات.
34	أمى كانت دايما بتمد إيديها بالخير لكم، بس الخيانه كانت في دمكم، سواء إنت ولا أختك، بس اللوم مش عليكم اللوم على اللى زرعت في قلوبكم السواد والطمع من الأول، عطيات هي السبب بطمعها وجشعها، أنا كان سهل عليا أقتلك بس أنا مش هلوث أيدى بدمك ومش ضعف منى، ده قوه هسيب القصاص ل ربنا وهو عادل، والقانون هو اللى يخلص منك حقى.
36	إنتم السبب كنتم بتحسسونا إننا شحاتين أنكم بتعطفوا علينا وكل ده كان حق أمى اللى لهفتوه.
37	مش متفاجئ من كلامك الغبى، بس أمك الطمع عماها، أمك أخدت حقها في ميراثها من أبويا بالكامل ويزيد كمان، حسب الشرع وقسمة الحق، الحق إن أبويا مكنش يملك غير حتة أرض صغيره ودار العراب، القديمه اللى كانت صغيره، وبمجهودى انا وأخويا كبرنا كل شئ، إحنا اللى كونا وعملنا إسم وأملاك العراب، بعرقنا في الشرد والبرد كانت عطيات بتبقى نايمه متهنيه وأنا وأخويا عالسكك بين الفلاحين بنشترى منهم بالآجل أو عربون بسيط نربطهم بيه على ما نبيع محصولهم وبعدها نسدد لهم كل مستحقاتهم كنت أنا وأخويا بنشيل شكاير القمح والدره والرز على كتافنا زينا زى العمال.
38	مبروك عليك شوف خدت أيه من طمعك وخيانتك، قدامك قواضى تتسجن فيها بقية عمرك، أو رجب السنهورى يخلص عليك بسبب خيانتك له، أحب أطمنك، رجب كان محضر اللى يقتلوا سلسبيل في سجن الترحيلات لو مش قماح هربها يمكن كان نجح في مؤامرته، بس ربنا كان كريم بيها وظهرت برائتها إنما إنت كل التهم لابساك وبالدلائل والبرهان.
44	عارف نيتك يا معلم من الصور دى هتبتز همس بكده ضمنت موافقتها عليك بقولك المره الجايه أنا عايز سلسبيل بنفس الطريقه، بس إنت مش هسيبك تلمسها.
45	لأ سلسبيل مش على مزاجى ومعتقدش هتعرف تجيبها بنفس الطريقه، سلسبيل من يوم ما خلصت دراسه نادر لم بتخرج كله طبعا من قماح أفندى، عامل حصار عليها، لا منو بتجوزها ولا منه سايبها تشوف نصيبها، عيونه فضحاه، بس البت سلسبيل مش على بالها خالص دى مش بتقعد في مكان هو فيه، عاوز سلسبيل مفيش قدامك غير الطريق المباشر وإنت وحظك، بس عارف مين اللى تساعدك وتسهل لك الطريق، هند أختك لو قماح ردها يبقى الطريق خلى قدامك، بعدين هطير الدماغ اللى عملتها بسيرة سلسبيل ليه.
46	أنا بستغرب إنت ليه عملت كده في همس مدخلتش مباشر ل دار العراب، دى بنت خالك.
47	همس مغرمه ب قماح بيه، وهو مش شايفها، وكارم مغرم بها وهي مش شيفاه.
48	كفايه كده لازم أروح عشان عندى شغل بكره في الشونه عشان أعرف أدس البضاعه بتاعتك وسط البضاعه اللى هتتسلم بكره، بقولك المره الحايه عمولتى هتزيد خمسين في الميه.
49	بلاش طمع ولا مقاطعه، كفايه عشىرين في الميه أنا عملت معاك الواجب النهارده، كنت هتجيب الموزه فين.
50	تشكر، يلا لو فضلنا نرغى الدماغ اللى عاملها هتروح منى، سسس
55	. لو مكنش الموبايل إتحرق وقتها كنت ساومت همس بالصور لكن الغبيه كمان مستنتش وعملت فيها البريئه وخلصت عارها بإيدها وإنتحرت، عاود حديث ناصر برأسه هو الآن أمامه كل الطرق مغلقه نهايتها الظلام الذي إختاره بيده حين تطمع.
59	تسلمى يا بتى، .
61	الحجه هدايه بخير أطمنوا كلكم بلاش الوقفه دى يلا شوفوا أشغالكم.
64	جيت أطمن على جدتى وكمان في شوية أوراق محتاج أمضتك يا بابا عليها.
65	تمام تعالى بينا عالمكتب أمضيلك عالأوراق اللى معاك دى.
67	واضح إن الجينات الوراثيه غالبه على العراب الصغير، تعالى معانا المكتب أهو تاخد خبره بدرى وتريح جدك.
68	ربنا يديك الصحه يا عمى.
69	هاروح أعملك كوباية ينسون.
70	كنت لسه هقولك إعملى لى كوباية ينسون تبل ريقى وتجرى الدم في عروقى بدل المحاليل اللى زى المايه الماسخه.
71	ربنا يديك الصحه يا جدتى، ثوانى وهرجعلك، قبل ما ناصر يغلب عمى والقاه جايبه وجاى.
74	قولى الحقيقه أيه اللى في الملف اللى معاك ده، أنا فوتت إنك جاى عشان أمضتى، بس أنا عارف إن في موضوع تانى.
75	إتفضل.
77	جايبلى ملف صور، قولى اللى عندك
78	الضابط اللى كان بيحقق في قضية خطف هند ل ناصر إتصل عليا وطلب أنى أروحله لآمر هام...
79	إتصال مش مهم كمل كلامك.
81	وخاينه كمان، نفسى أعرف كان ناقصها أيه محدش في الدنيا حبها قد رباح ليه أذته كل الاذيه دى.
82	قصدك أيه يا بابا، هو رباح فين، أزاى محضرش عزا والداته أنا سألت محمد وكارم قالوا مجاش العزا، شئ غريب مع أنه كان الأقرب لوالدته.
83	معرفش، المهم الكلام اللى قولتلى عليه دلوق ميطلعش لحد واصل، حتى مراتك سلسبيل.
84	بس دى خاينه والمفروض...
85	الموضوع ده ميخصش غير رباح، كل اللى مطلوب منك تسكت.
86	متأكد إنك مدارى حاجه بخصوص إختفاء رباح، بس تمام زى ما تحب هسكت.
87	تعالى خد ناصر وديه ل سلسبيل، شكله هيبدأ يزوم.
91	الست زهرت مرجعتش من إمبارح الصبح للشقه.
92	أكيد بدور على وغد تانى تخون معاه، بس لازم تظهر عشان أعرف اللى في بطنها دى إبن مين، رباح ولا نائل، لو إبن نائل يا ويلها.
93	حبيب جلبى إتوحشتك يا نور عينى، هاته ليا يا قماح.
95	فين عمى؟
96	بابا في المكتب وأنا هرجع تانى للمقر، أشوفكم المسا.
97	تعود بالسلامه يا ولدى، روحى مع جوزك لحد العربيه يا سلسبيل، وسيبيلى ناصر أشبع منيه، لو أن النظر ميشبعش منه واصل.
98	مقولتليش الظابط كان عاوزك ليه؟
99	أبدا كان شوية معلومات عشان يقفل القضيه.
100	معلومات عن أيه مش أخد أقوالنا إمبارح.
101	معلومات عاديه، وكمان قالى إنهم عندهم شك في عقلية هند وهيحولها عالطب النفسى يشوف إن كانت بتدعى الهزيان او لأ، يلا لازم أرجع للمقر أشوفك المسا.
104	مش عارف الواد ده شقى كده ليه، خدى يا نهله حفيدك أهو.
105	ناصر قماح شقى جدا فعلا، الوحيده اللى بيبقى هادى معاها هي الحجه هدايه.
106	أكيد شقى لباباه، مامته نبع المايه طول عمرها هاديه وكهينه ولئيمه زى الحجه هدايه.
107	انا دايما بقولها كده، هقولكم سر البت سلسبيل وهي حامل في ناصر كانت بتتوحم على قماح.
108	بطلى سخافه شويه.
109	طب أنكرى بقى، فاكر يا بابا الليله اللى بيتناها في الاوتيل، أنا كنت نايمه جنبها، وسمعتها بتقول بحبك يا قماح.
110	لأ هي بتحب قماح من زمان بس كانت مداريه والنتيجه قدامنا أهى، الواد ناصر في كتير من ملامح قماح حتى شعره نسخه من شعر قماح.
111	طب بطلى كدب أنتى وهي بقى، ناصر نسخه من عمى النبوى مفيهوش من قماح غير شعره، وبعدين قماح جوزى يعنى مش عيب لما أحبه.
112	وشها إحمر.
113	كفايه يا بنات بلاش تحرجوا أختكم مهما كان هي الكبيره، بس تصدقوا وشها فعلا إحمر.
114	حتى إنت يابابا هتتريق عليا زيهم.
120	نفسى أنام أسبوع بحاله من وقت ما رجعنا لهنا وأنا مش بعرف أنام كويس.
121	الحمد لله جدتى ومرات عمى رجعوا لدار العراب بخير.
122	أنا حاسه بيك يا كارم، وفاة مامتك مأثره عليك.
123	كان نفسى أقابلها قبل ما تتوفى بس الظروف والوقت كان ضيق، كان نفسى أبوس إيدها وأقول لها إنها كانت فاهمه غلط، والحقيقه إن بحبها رغم إنها كانت بتفضل علينا رباح دايما.
124	إبكى يا كارم طول ما أنت حابس الدمعه في عينك هتفضل حاسس بالوجع.
128	بتبكى ليه؟
129	معرفش، بس يمكن هرمونات حمل، بصراحه أنا الكلام خدنى وانا في شقة بابا ونسيت أتعشى وجعانه أو مش أنا اللى جعانه أكيد إبنك.
130	نسيتى تتعشى غريبه مع إنى شايف الشغاله نازله بصنية أكل من شقة عمى، ولما سألتها قالتلى إنك إنتى اللى كنتى طالبه منها الأكل ده...
132	ده شئ مؤكد، وبعدين أنت مش عندك مطعم أعتبرنى زبونه، ولا هما زباينك أحلى منى لأ أنت هتستخسر فيا أنا وأبنى من أولها لأ أنا عاوزه إبنى يبقى ملقبظ.
134	بحبك يا كارم، ولو رحع بيا الزمن كنت هحبك من أكتر.
140	أيه كنت ناويه تكملى سهر للصبح في شقة عمى، أكيد لو مش ناصر نام مكنتيش هتطلعى دلوقتي.
141	لو مكنتش عاوزه أطلع كان بسهوله أنيم ناصر في أى أوضه وأكمل سهر للصبح في شقة بابا، بس أنا طلعت علشانك.
142	طب وطلعتى عشانى ليه.
143	طلعت عشان مبقتش أعرف أنام بعيد عن حضنك.
146	أنا حجزت لينا أسبوع في الغردقه، من بكره الصبح هنسافر.
147	طب وزحمة الشغل متنساش إن عزا مرات عمى مخلصش، ومحمد مش هيكون موجود.
148	بس بابا وعمى يسدوا أنا قولت ل بابا قبل ما أحجز للسفر وقالى إحنا مش في موسم هجمة شغل وهيوالى هو وعمى الشغل.
149	طب طالما مش وقت زحمة شغل أيه الملف اللى كنت جايبه لعمى بعد الضهر، ومشيت من غيره.
150	ده ملف طلبيات جديده وسيبته ل بابا يشوف المناسب لينا ويقرر هو نتعامل مع مين.
159	انا جاى مخصوص للسيد رباح العراب في أمر خاص، كان ممكن أبعت له إستدعاء ويجى للنيابه بس أنا حبيت أجى بشكل شخصى بناء على سمعة عيلة العراب الطيبه.
160	متشكر لذوقك، بس خير أقدر أعرف سبب زيارتك الكريمه.
161	فين السيد رباح، هو الشخص إلى الأمر يخصه.
162	رباح مسافر من حوالى أسبوع وقدامه وقت على ما يرجع من السفر، أقدر أسد أنا مكانه وأعرف الأمر ده.
163	مسافر فين؟ لان لازم يثبت مكان تواجده وقت حدوث جريمة قتل زوجته السيده، زهرت مجاهد حماد.
164	بتقول زهرت أتقتلت أمتى وإزاى.
165	مش غريبه تبقى مرات إبنك ومتعرفش عنها حاجه.
166	هي فعلا مرات إبنى بس هي سايبه الدار من مده وكانت ساكنه في شقه بعيد عننا وصلتنا بها كانت مقطوعه.
167	يعنى تعرف طريق إبنك ومتعرفش حاجه عن مراته.
168	للآسف زى ما قولتلك هي اللى قطعت الصله عننا، وإبنى للآسف مريض وبيتعالج وإنشغلت معاه ونسيت أسأل عن مراته.
169	لأ ألف سلامه عليه، هقول لحضرتك المختصر، زوجة إبن حضرتك لقيوا جثتها من تلات أيام في أحد اكوام الزباله والجثه منزوعة الأعضاء الداخليه، والمستشفى قدمت بلاغ، وأحنا قدرنا نوصل لهاويتها عن طريق البصمات الخاصه بها، يعنى لو صحيح إن أثبت وجود إبن حضرتك في مكان بعيد عن هنا هيشيل عنه تهمه كان ممكن تنتسب إليه، لآن المرحومه زوجته وإزاى تختفى لمده ومقدمش بلاغ بالبحث عنها.
170	حضرتك زى ما قولت لك إبنى مريض، وعندى إثباتات بكده.
171	تمام عالعموم حضرتك لازم تجيب إبن حضرتك النهارده ومعاه إثبات عن مرضه، وكمان عشان يستلم الجثه.
172	تمام.
177	أمر التقرير، سهل أكتبه لحضرتك، بس خروج رباح من هنا ممكن يحاول ميرجعش تانى لهنا، خصوصا أنه لسه في أصعب مراحل بداية علاجه من الادمان.
178	تأكد إنى هرجعه بنفسى.
179	تمام، أنا هبعت معاك إتنين مرافقين يعرفوا يتعاملوا مع الحالات اللى زى رباح تحسبا مش أكتر.
185	تقدروا تعملوا إجراءات إستيلام الجثه عشان الدفن.
191	أنا عاوز أخف يا بابا ساعدنى مش عايز أعيش متعذب، أرجوك خليك جانبى بلاش تتخلى عنى.
192	مستحيل أتخلى عنك إنت حته من روحى.
2	إنت كداب الكوليه ده دهب أصلى حتى مطعم بفصوص ألماظ.
3	لو سمحتى يا مدام بلاش تعلى صوتك في المحل عشان الزباين، قدامك محلات الصاغه كتير تقدرى تسألى فيها، بس متأكد إن الكوليه ده تقليد متقن والفصوص اللى فيه دى مش ألماظ دى أحجار صناعيه ملونه، زى الإزاز كده.
6	عاوزاك تتأكد تانى، وشوفلى كمان اللى في بقية العلبه دى.
7	تحت أمرك.
8	للآسف كل اللى في العلبه دى مش دهب، ده مشغولات فالصوا، زى ما قولت لحضرتك تقليد متقن.
9	بس الكوليه والمصوغات اللى في العلبه كمان، اللى أشتراها ليا كان بيشتريها من محلكم حتى معايا العلب اللى كان بيجبها فيها.
10	يا مدام عادى إحنا اوقات كتير بينطلب مننا علب دهب كنوع من الهدايا مع الشبكات او حتى كنوع من الدعايه لينا...
12	لأ.
13	أمال مين ده أكيد واحد نصاب بلغى عنه...
14	ولا تكون دى لعبه وجايه تنصبى علينا هنا في المحل، وتسوئ سمعة المحل، أنا ممكن أطلبلك البوليس فورا.
15	إزاى الحقير ده قدر يضحك عليا، كان يستحق القتل والتقطيع من جتته.
21	لو بس أعرف هو فين متأكده أنه هيصدقنى، ويرجعنى تانى دار العراب، حتى لو غصب عنهم زى قبل كده والمره دى هيبقى سهل أدخل وسطهم بالجنين اللى في بطنى لازم أحافظ عليه هو دلوقتي فرصتى إن أرجع غصب عنهم، بس أنا دلوقتي محتاجه مصاريف الغبيه هند خدت كل الفلوس اللى كانت فاضله معايا، كانت غلطتى إنى بدل ما كنت الفلوس أحطها بإسمى في أى بنك كنت بقول الدهب أفضل، ضحك عليا الحقير نائل وكان بيجيلى دهب مغشوش، مفيش قدامى طريق غير ماما أهو أطلب منها مبلغ أمشى بيه نفسى لحد ما رباح يظهر...
28	ممنوع تقرب ميه من الجرح، لآنه جرح كبير موصل للعضمه، هكتبلك نوع مسكن تأخده غير مضاد حيوى وتقدر تجى للمستشفى كل يوم تغير عالجرح مالوش لازمه وجودك هنا.
29	تمام متشكر يا دكتور.
32	قماح حبيبى مكنش قصدى.
33	قصدك ولا مش قصدك إبعدى عن حياتى يا هند سبق واعتذرت لك.
34	لأ مقدرش أبعد عنك يا قماح ولا عن الولد، سلسبيل هي اللى لازم تبعد عن حياتنا نهائى.
37	جدتى قالتلى لازم ترجعى ومعاك قماح مش هطمن عليه غير لما أشوفه بعنيا.
39	طب ليه حاطه وشك في الأرض، إرفعى عينك في عينى وانتى بتتكلمى مش معقول حفيدة الحجه هدايه تحط وشها في الأرض قدام جوزها، فين سلسبيل اللى كانت ند ليا.
40	أنا عمرى ما كنت ند ليك يا قماح وإنت عارف إن سلمت لك من أول يوم إتقفل علينا باب واحد، بس بصراحه خوفت تصدق الكلام اللى قولته، إنى كنت بتلاعب بيك.
41	بصراحه صدقت.
42	والله مش صحيح أنا كنت بقول كده بحاول أشغلها عشان متأذيش ناصر.
43	وأيه يثبتلى إنك الكلام اللى قولتيه ده مش صح؟
44	قولى أيه اللى يثبتلك وأنا مستعده أعمله.
45	بوسينى وأنا أصدق إن مكنش قصدك الكلام ده.
46	قماح إحنا في المستشفى وممكن أى حد يفتح الباب يدخل علينا.
47	طالما مش عاوزه تبوسينى أنت أبوسك أنا.
48	الحجه هدايه قالتلى سلسبيل راحت وغابت جوم، ومترجعليش غير ب قماح عاوزه أشوفه واطمن عليه، مش مصدقه سلسبيل لما قالت لها إنك بخير بس جرح اللى في إيدك.
49	تمام خلينا نروح لها أنا كمان عاوز أطمن عليها.
50	دخل النبوى الى غرفة هدايه قائلا: جبتلك قماح أهو عشان تطمنى بنفسك عليه.
51	تنك زين يا ولدى، مبارك إن ربنا رد لكم ولدكم ربنا يباركلكم بحياتكم.
52	ويبارك لينا فيكى يا جدتى.
53	وادى ناصر بيه العراب اللى رعب قلوب الكل عليه، أنا بقول آن الآوان بقى إن سلسبيل تخاويه عشان ميبقاش دلوع أكتر من إكده.
54	والله قولت كده قبلك يا بابا، حتى إسأل سلسبيل.
56	ده من كارم، هرد عليه.
57	الحجه هدايه الحمد لله، المهم وأخوك محمد عامل أيه؟
58	محمد مذهول، وانا كمان مش بس مذهول أنا متأثر جدا، بحمد ربنا إنى آخر مره كلمتها من يومين ردت عليا، صحيح كانت مكالمه مختصره بس سمعت صوتها أنا كنت ناوى أزورها النهارده، حتى همس هنا في عزا الحريم.
59	كل شئ قدر البقاء لله، خليك جنب أخوك لنهاية العزا.
60	عزا مين يا عمى؟
61	قدريه إتوفت.
62	إمتى؟
63	النهارده، ومحمد وكارم بياخدوا عزاها، وهمس كمان لما عرفت راحت تاخد العزا مع سميحه.
64	إنا لله وإنا إليه راجعون.
65	البقاء لله، أنا كمان لازم أروح أعزى، عشان خاطر ولاد عمى.
66	خلينا نرجع دار العراب نغير هدومنا ونروخ نعزى سوا.
67	ربنا يخليكي لينا يا جدتى.
69	سلسبيل غيرت قماح كتير في فتره صغيره.
70	قماح فهم وعرف إن سلسبيل كانت خجوله مش كارهاه، والفضل يرجع ليك لما واجهتيه وقولتى له مفتاح شخصية سلسبيل وعرف الفرق بين الخجل والنفور وأتعامل مع خجلها وعرف إنه مكنش نفور منها له.
77	تحدث بود: هدايه أنا عارف الظروف اللى بتمروا بيها الايام دى، وأنك مش قادره تروحى الجامعه حتى السكاشن العملى مش بتحضريها بعرض عليك أساعدك في أى شئ مش فهماه.
78	بصراحه مواد الجامعه مش صعبه عليا، بس في مشكله في الابتوب بتاع حماد بصراحه كنت مكسوفه أطلب منك تساعدنى فيها.
79	أيه اللى على الابتوب بتاع حماد وعاوزه تعرفيه، ليه شاغل بالك قوى كده.
80	هيكون أيه ده ملف عادى، وانت اللى عرضت المساعده، بس تقدر تعتذر.
