line	text
51	ده عمى، ويبقى والد همس.
52	همس عندها شبه إنهيار عصبى سبق وحذرت بلاش نضغط عليها، أنا اديتها حقنه مهدئه هتنام لوقت طويل النوم هيساعدها أنها تتخطى الحاله دى، وزى ما قولت قبل كده بلاش ضغط على أعصابها، وأنا هتابع حالتها مع الدكتوره اللى في دبى.
53	تمام متشكر جدا يا دكتوره إنك جيتى بسرعه.
54	ده واجبى، واتمنى حالة همس تتحسن في أقرب وقت.
56	كنت متأكد أنا بابا هيقولك على كتب كتابى أنا وهمس.
57	همس طول عمرها كانت هشه كانت أضعف بناتى رغم شقاوتها بس كانت هشه سهل كسرها، انا عرفت إنكم هتسافروا دبى.
58	فعلا وللاسف هضطر أخد همس وهي نايمه ونسافر القاهره دلوقتي عشان نلحق الطياره بكره الصبح.
59	توصلوا بالسلامه، هبقى أتصل عليك أطمن على همس.
60	همس أمانتك يا كارم بلاش تخذلنى زى قماح ما خذلنى مع سلسبيل، همس مش هتستحمل بعد كل ده.
61	أنا مش زى قماح ياعمى رغم انى عارف إن قماح من جواه ندمان، همس هي حياتى اللى رجعتلى من تانى ومستحيل أفكر انى أخذلها وأطمن.
64	هاميس خلاص لازم تعود من تانى وسط عيلتها اللى كانت هي بسمتها.
74	عمى أنا سلسبيل، أنا محجوزه في القسم؟
75	خير، محجوزه في قسم أيه، وأيه سبب حجزك.
76	نائل إتقتل وهند بتتهمنى إنى أنا اللى قتلته.
77	مش فاهم وأنتى مالك ب نائل وهند ليه بتتهمك بقتله.
78	كفايه كده يا مدام مسموحلك بمكالمه قصيره ممنوع تحكى كتير قصاد اللى بتكلميه.
79	بتصل على بابا مش بيرد عليا. من فضلك يا عمى ساعدنى، وبلاش تقول ل قماح.
81	ألو ألو سلسبيل.
84	سلسبيل فين خرجت من المقر بطلبها عالموبايل مش بترد عليا، وحضرتك كنت بتقول ألو يا سلسبيل قولى هي فين؟ وليه خرجت من المقر قبل ميعادها.
85	يمكن خرجت لحاجه مهمه، وموبايلها فصل.
86	بابا قولى فين سلسبيل، متأكد أنك عارف هي فين، هي كانت معاك عالتليفون.
87	مش وقته لازمن أمشى عندى مشوار مهم دلوق.
88	فين سلسبيل يا بابا.
90	هي كانت بتكلمني والخط قطع يمكن في مكان مفيش فيه شبكه، سيبنى ألحق مشواري، وحاول تتصل عليها يمكن ترد عليك.
92	عاوزك تقابلنى فورا قدام القسم ده.
95	سلسبيل بنت أخويا محجوزه في القسم بقضية قتل، ده كل اللى عرفته من إتصالها عليا.
97	سلسبيل قتلت نائل، قتلته عشان ما يفتش العلاقه القذره اللى كانت بينهم.
98	بلاش كذب يا هند، وخرجى سلسبيل من دماغك سبق وقولتلك خلاص حكايتنا إنتهت وإن اللى بينا هو الشغل وبس.
99	أنا مش بتهم سلسبيل بكذب تقدر تقولى أيه اللى وداها للشقه اللى إنت أشترتها ليا، وكمان نائل أتقتل في الشقه دى؟
100	أنا واثق من سلسبيل أكيد في حاجه غلط.
101	أنا عاوز تطلع النهارده سلسبيل من القسم.
102	أنا هدخل أشوف محضر التحقيقات وهشوف ابعاد القضيه.
104	بشرفى قبل ما أخد عزا إبنى هتكون سلسبيل سبقاه للقبر.
105	لما تثبت الجريمه على سلسبيل إبقى إحلف بشرفك، أنا واثق في مراتى.
107	للآسف مدام سلسبيل المشتبه فيه الوحيد، والقضيه لبساها.
108	قصدك أيه مستحيل متأكد أن سلسبيل بريئه.
109	كل الادله ضد مدام سلسبيل، الحسنه الوحيده في القضيه إن سلاح الجريمه مفقود، غير لسه تقرير البصمات موصلش للنيابه، ولما سألت مدام سلسبيل قالتلى أنها مقربتش من جثة القيل، بس وجودها في مكان الجريمه إدانه قويه لها وكمان في إتهام مباشر من أخت القتيل لها بوجود علاقه بينها وبين القتيل.
110	قصدك أيه؟
111	أنا عاوز أشوف سلسبيل.
112	أنا جبت لحضراتكم أذن أنكم تقابلوها إستثناء في أوضة التحقيقات والمقابله تكون قصيره.
113	تمام أنا داخل لها وأنت يا قماح مش هتدخل معايا.
114	اسبقنى انت يا بابا هتفاهم مع المحامى يشوف طريقه يخرج بها سلسبيل على ذمة القضيه.
115	شوف طريقه تخرج سلسبيل بها من هنا، اى كفاله أنا مستعد أدفعها حتى لو مليون جنيه، سلسبيل مش لازم تبات هنا في القسم.
116	خروج مدام سلسبيل صعب أنا عرضت الكفاله ووكيل النيابه رفض، كل اللى أقدر أعمله أنى أجيب لها إستثناء الليله وتبات في أوضه هنا في القسم قبل تحويلها بكره على السجن.
117	قصدك أيه هي كده الجريمه لبست سلسبيل، فين دفاعك، قولى أنك مش قد القضيه، أنا على إستعداد دلوقتي أجيب بدل المحامى عشره.
118	أنا عاذر حضرتك، بس زى ما قولتلك موقف مدام سلسبيل ضعيف، حتى أجوبتها عالأسئلة وكيل النيابه مش مقنعه، حتى لما سألها عن وجودها في الشقه دى، جاوبت وقالت انه كان إتصال هاتفى بينها وبين مدام هند، ووكيل النيابه أمر بتتبع المكالمات، ونفس الوقت مدام هند قالت إن تليفونها كان مفقود وهي غيرت رقم تليفونها من مده قصيره.
121	عمى، بابا فين أتصلت عليه مش بيرد عليا.
122	أنا معاكى، منفعش مكانه.
123	مش قصدى يا عمى.
124	قوليلى أيه اللى حصل وأيه اللى وداكي لشقه دى.
125	هند أتصلت عليا وطلبت مساعدتى.
126	كده وضحت ممكن هند تكون هي اللى قتلت نائل، وطبعا أستغلتك عشان تشيلى القضيه، كبش فدا.
127	مش معقول يا عمى، قصدك إيه بإن هند ممكن تكون هي اللى تكون قتلت نائل! مستحيل ده أخوها الوحيد.
128	مفيش حاجه مستحيل يا سلسبيل، أنت غلطى كان فين عقلك إزاى توقعى في فخ هند بالسذاجه دى...
130	وقماح صدق الكدبه دى؟
131	مش قماح المهم دلوق المهم التحقيقات.
135	سيبنى مع سلسبيل يا بابا وأرجع أنت للدار، أكيد زمان الخبر إنتشر وهيوصل، ولازم حد يطمن اللى هناك عالمدام.
137	وإنت هتعمل أيه؟
138	أنا هفضل هنا مع المدام.
140	تمام هرجع للدار وهحاول أطمنهم وهكون معاك على إتصال.
143	أيه اللى وداك الشقه دى؟
144	هند أتصلت عليا حتى بعتت لى صور لها، أنا مكنتش هروح لها بس هي إستنجدت بيا، وأنا قولت إن باباها غضبان عليها و...
145	هند هي وباباها أتصالحوا، عندى يقين إنهم حتى مكنوش متخاصمين من أساسه.
147	سلسبيل العراب اللى الكل بيشكر في عقلها وحكمتها وقعت في فخ زى العيال الساذجه.
148	أنا مش ساذجه، أنا لو ساذجه كنت أتهمتك أنك عاوز ترجع هند بعد ما شوفتك معاها في الكافيه اللى قريب من المقر من كم يوم، وقبلها لما كنا في المكتب وقولتلى روحى انتى مع السواق، وأنا هقابل عميل، وقبل ما أوصل للدار يجيلى رساله من هند أنكم مع بعض في الكافيه.
149	أنا فعلا قابلت هند في الكافيه ده، بس بصفتها عميله هند رجعت تشتغل تانى مع باباها حتى سابت الشقه اللي كنت جايبه لها ورجعت لبيته تانى، وأنا طلبت منها بعد كده ياأتعامل مع باباها أو أخوها ياأما هنهى تعاملنا معاهم نهائى، وطبعا وافقت إنى بعد كده أتعامل مع أخوها، اللى حضرتك متهمه بقتله لأ ومش بس كده كمان إنك كنت على علاقه بيه، ليه قبل ما تخرجى من المقر متصلتيش عليا تقوليلى على اتصال هند بيك.
150	خوفت تحس بالندم إنك السبب في بعدها عن أهلها، وقولت...
151	قولتى أيه يا سلسبيل، قوليلى أعمل أيه القضيه لبساك، حتى لو هند فعلا كانت محتاجه مساعده كان بسهوله تتصل بأى مستشفى أو دكتور يجوا لها لحد الشقه، ليه، ليه، ليه، قوليلى حل دلوقتي
153	وأنت صدقت إنى ممكن أكون على علاقه ب...
154	سلسبيل أنا عندى ثقه فيك لا متناهيه، لكن هند وقعتك في فخ أثبتت إنك ساذجه ومتأكد ان معاها دليل برائتك وهتساوم بيه.
155	قصدك أيه إن هند ممكن تطلب منك أن ترجعها لذمتك قصاد برائتى، ولا ممكن تطلب منك تطلقني؟
157	والله أنا دخلت الشقه فوجئت ب نائل بينزف حتى ملمستوش.
158	أنا متأكد من برائتك يا سلسبيل، وبتمنى تظهر الحقيقه بسرعه وتأكدى إن مش هسمح بدخولك السجن ساعه واحده.
162	ماله رباح؟
163	هقولك بعدين يا أمى بس وسعى للرجاله تدخله للدار في أوضته القديمه.
165	عندى شبه تأكيد رباح مدمن، هتصل على حداد يجى يركب لشباك الأوضه دى حديد قبل ما يفوق من تأثير المخدر، والباب يتقفل عليه بالمفتاح لحد ما نتيجة التحليل تطلع بكره، رغم أن في دكتور أكدلى إدمانه وقالى على إسم مركز لعلاج الإدمان وكنت هاخده عليه مباشرة بس قولت أستنى تأكيد التحاليل عشان أخدها بالمره معايا وأنا موديه لمركز علاج الادمان يبقى عندهم علم بعلاجه من الماده المدمن عليها.
166	كنت شاكه بس كنت بكدب نفسى، رباح ضيع نفسه بجوازه من زهرت هي فين؟
167	معرفش لما روحت له الشقه كان لوحده.
169	مالك جاى منين دلوق؟
170	جاى من قسم الشرطه
175	جدتى قوليلى في أيه ردى عليا، لكن الهاتف كاد يسقط من يد هدايه لولا تلقفته سميحه وردت هي على همس قائله بدموع ودون وعى منها: مرات عمى نهله وقعت من طولها.
176	ماما، مالها. ردى عليا.
178	أنا لازم أنزل مصر دلوقتي سميحه بتقول إن ماما وقعت من طولها.
9	المقرئ بقى مخلص أكتر من خمس أورده من القرآن، ولسه فيه معزيين موجودين بالصوان، قولت له يريح شويه ويرجع تانى يقرأ.
12	شايفين مين اللى جايين العزا.
15	ده رجب السنهورى وإبنه نسايبك القدام يا قماح، والله عندهم واجب. وناس باقيه عالعشره.
28	العزا تلات أيام بكده العزا خلاص إنتهى من بكره كل واحد يرجع تانى لشغله، كفايه تعطيل مشاغل لحد إكده.
29	والله المرحومه كانت غاليه عيندى، ربنا العالم قد أيه، ربنا يرحمها ويغفر لها وزرها.
30	ربنا يرحمنا چميعا بكفايه عاد وچودك هنا، روحى دار بجالك تلات ليالى فايته دارك وإبنك وچوزك المريض، لازمه رعايه ربنا يشفيه.
31	يارب، والله لما زهرت إتصلت عليا وجالتلى عاللى حصل أنا مصدجتش همس تعمل إكده إزاى؟
33	همس مجتلتش نفسها، همس ماتت بالغلط، مكنتش تعرف إن السلاح متعمر، وزى ما جولت العزا خلاص إنفض والسيره دى كمان إنفضت يا عطيات.
37	بعد إكده مش لازم بنت تتعلم وتروح الچامعه حتى هدى ملهاش لازمه الچامعه لا تسوى كيف أختها، المره دى ربنا لطف بينا ومش رايد لينا الفضيحه.
38	أمى لما خدت الدبلوم رفضت إنى أكمل علام بعده عندها حق لما قالتلى العلام العالى للبنات مبيجيش من وراه خير، وأها، همس...
39	جولت العزا خلص ويلا كل واحد يروح مطرحه، وبلاش كلام فارغ، هدى هتروح چامعتها وتكمل دراستها، وسر همس هيندفن إهنه بين حيطان الدار وإياك إسمع بس طراطيش كلام باللى حصل للناس بره الدار مفهوم، وزى ما جولت من شويه كل واحد على مطرحه تصبحوا على خير.
45	أنا مستحقش اللى حصل عمر عنينا حتى ما بصت لواحده نظره مش كويسه، كنت بخاف ربنا، ليه يحصلى كده، ياريتنى كنت...
46	إستغفر ربك يا ناصر، كل شئ قدر من ربنا وعد ومجدر يا ولدى.
47	اللى قهرنى إنها فضلت الموت عن إنها تتكلم وتقول ليه عملت كده ومع مين، ليه دارت عليه، بشرفى لو عرفته كنت خليته يسكن القبر قبلها، وحتى لو كان غصب عنها ليه سكتت كانت تقول.
48	خلاص يا ناصر، زى أمى ما جالت كل شئ قدر ومكتوب.
52	إبعد عنى، كفايه اللى إحنا فيه؟
53	وأيه اللى إحنا فيه، إحنا حلوين أهو.
54	حلوين فين، مش شايف معاملة جدتك لأمى دى شبه طردتها من الدار، حتى أنا لما إتكلمت إتوففت ليا، ياريتها عملت كده مع بنت عمك يمكن مكنتش جابت العار لينا.
55	بس بلاش تجيبى سيرة همس زى جدتى ما قالت، وبعدين أمك بنت جوزها وعارفه طباعها قد أيه شديده، خلينا في نفسنا، يا زهرتى قميص النوم ده يجنن.
56	مش قميص النوم هو اللى يجنن، القالب غالب يا عزيزى.
57	القالب غالب فعلا وأنتى هوستينى بجمالك من زمان قوى يا زهرت ولسه بتهوسينى.
59	ضحكت عليا، بس أنا لسه زعلانه من كلام جدتك القاسى لماما.
60	فوتى يا زهرت جدتى ست كبيره وكلمتها بتمشى عالكبير قبل الصغير في البيت ده، بلاش تتوقفى لها وحاولى تقربى منها أكتر، شايفه مرات عمى نهله وأمى نفسهم ماشين بأمرها، حتى بابا وعمى كمان كلمتها لهم واحده.
61	بس قماح الوحيد اللى مش بيمشى بأمرها، إشمعنا هو؟
62	مش عارف ليه قماح الوحيد اللى مش بتقدر تتنى عليه كلمه ومع ذالك بتفوت له، حتى لما كان غايب عنا هنا وعايش في اليونان مكنتش بتبطل سيرته كأنها كانت خايفه إننا مع الوقت ننساه، ولما رجع تانى كأنها لقت كنز، وهو منفوخ علينا كلنا، وقال أيه هو اللى زود أسم واملاك عيلة العراب بذكاؤه، وده كله حظ مش أكتر.
65	قولى لى اللى إحنا فيه كابوس وهصحى منه هلاقى همس عايشه بينا.
69	متأكده همس مش خاطيه...
72	قولى غلطنا في أيه علشان همس تعمل فينا كده، أنا يعلم ربى من يوم ما دخلت الدار دى صونت لسانى عن الغلط في أى حد وعاملت ربنا فيك وفي بناتى ليه همس ظلمتنا الظلم ده.
74	قولى سبب للحسره اللى سابتها ليا همس في قلبى، قولى يا ناصر
76	قدر ومكتوب يا نهله وعلينا بالصبر، حتى قدام بناتنا. بلاش يشفونا مهزومين كده.
80	كانت تقدر تقول ووقتها كنت هصدقها
81	كنت هتصدقها أيوا هصدقها، همس مستحيل كانت تغلط الغلطه دى، همس كانت ملاك.
82	عليك اللعنه أيها القلب، ربما لم تبوح لها بمكنون قلبك، لكن لمحت لها أكثر من مره، ماذا كنت تنتظر، لما لم تبوح بمشاعرك ربما كانت تحاوبت معك وبقيت حيه، لكن فات الوقت، همس ماتت ولم تقتل نفسها فقط بل قتلتك معها، ضع هذا السلاح الآن برأسك وألحق بها في جهنم.
89	قماح!
90	بلاش اللى بتفكر فيه يا كارم، صدقنى الموت مش هيريحك من الآلم اللى حاسس بيه، لو الموت كان بيريح كان زمانى موتت من زمان، بلاش تبقى إنهزامى كده، همس مش آخر بنت في الدنيا صدقنى، شيل الوهم اللى في دماغك، خلينا نرجع للبيت من تانى.
96	قماح!
107	أنا بعتذر يا جماعه إننا جينا بدون ميعاد وأتمنى الآمر اللى جاي علشانه يغفرلنا مجينا بدون حتى إتصال مننا ناخد منكم ميعاد.
108	لأ أبدا، يا رجب إنت مش غريب، إتفضل بلاش الوجفه دى، أنا هخليهم يچهزوا الوكل حالا.
109	لأ يا حجه هدايه خيرك وكرمك سابق أنا كل اللى عاوزه كوباية شاى نشربها وإحنا بنتحدت مع بعضينا في الآمر اللى جاين عشانه.
113	خير يا رجب جولى أيه الآمر اللى جاي عشانه.
114	خير يا جحه هدايه، بصراحه أنا عارف ومقدر حزنكم على المرحومه، وإن ممرش وقت كبير على رحيلها، بس ده ميمنعش الخير اللى جايين علشانه.
115	خير إدخل في الأمر مباشر.
117	إحنا جايين نطلب إيد سلسبيل ل (نائل)إبنى، وقبل الرد منكم هقول الجواز مش هيكون قبل سنه.
118	للأسف جيت متأخر يا رجب، وسلسبيل إتخطبت وفرحها كمان إتحدد بعد شهر.
119	بس اللى أعرفه إنها مش مخطوبه أمتى إتخطبت.
122	سلسبيل كانت إتخطبت جبل ما موت المرحومه همس، بس اللى حصل آجل الأعلان، بس خلاص مالوش لازمه التأجيل أكتر من إكده.
123	ومين العريس حد نعرفه؟
124	قماح هو عريس سلسبيل.
127	عالعموم ألف مبروك وربنا يتمم بخير وآسف مكنتش أعرف بس العيب مش عليا.
128	فعلا مش العيب عليك والموضوع في أى عيب أساسا كل شئ نصيب وسلسبيل نصيبها قماح، ربنا يرزق نائل بالخير يارب.
129	نستأذن إحنا.
130	نورتم قوم مع الضيوف يا نبوى وصلهم للباب.
132	كلام فارغ أيه اللى قولتيه لرجب ده يا أمى، كنا رفضناه وخلاص، أسهل من كده، ومالوش لازمه نورط قماح في كلام فاضى.
133	جول لعمك يا قماح حديتى اللى جولته من هبابه كلام فارغ.
134	كلام جدتى مش فارغ يا عمى وأنا بطلب منك إيد سلسبيل.
135	بس أنا مستحيل أتجوز دلوقتي همس مكملتش سنه ميته، مش بفكر في الجواز أصلا.
137	بس ناصر موافج يا سلسبيل، هتصغرى أبوكى جدامنا إياك.
138	ده يوم المنى قماح عريس أى بنت تتمناه سلسبيل قالت كده من المفاجأه بس، ربنا يتمم بخير والله لو مش الظروف كنت زغرطت.
140	طالما موافجه يبجى خير البر عاجله، وزى ما جولت من هبابه، فرح قماح وسلسبيل بعد شهر يكون قماح جهز الشجه (الشقه)الچديده لسلسبيل والعفش نشتريه چاهز وكمان الفرش وحاچات العروسه كمان.
142	بس همس لسه مكملتش سنه يا جدتى، الناس هتقول أيه.
143	همس بتنا وأنتى كمان بتنا وقماح ولدنا، يعنى الحزن بتاعنا والفرح بتاعنا، ومحدش ليه عيندنا حاچه واصل، الفرح بعد شهر، وأنت يا قماح چهز الشجه اللى في الدور التالت جصاد شجة رباح، سلسبيل مش هتدخل في الشجه اللى إتچوزت فيها جبل إكده.
152	أنا ماما. همس ماتت يا سلسبيل، فوقى من الهلاوس دى بقى، الليله زفافك على قماح.
160	تعالى يا سلسبيل. عاوزه أيه؟
162	جولى اللى چايه عشان تجوليه وبطلى نحنحه، بلاش تضيع وجت
164	آحب على رچلك يا چدتى إنتى الوحيده اللى جادره توجفى چوازى الليله من قماح.
166	كملى ليه وجفتى حديت، تشيلى خطية أختك اللى حطت راسنا كلياتنا في الوحل وبعدها مجدرتش تجول مين اللى فرطت في شرفنا معاه وفضلت تنتحر وتموت مش بس خاطيه لاه وكمان كافره.
167	أنا متأكده أختى لا خاطيه ولا كافره يا مرت عمى، وأنا مش بتحدت إمعاكى أنا بتحدت مع چدتى، بترچاكى يا چدتى بلاش تأخدونى بذنب غيرى وتچوزونى قماح.
168	ماله قماح زين الرچال ألف بنته تتمنى تراب رچليه، ولا إنت كيف أختك عاشجه. وهتكملى بجية عارها ونتفتضح چدام الناس بالكفر.
169	لاه أنا مش عاشجه. بس كمان ما ريداش إتچوز من قماح، قماح اللى مفيش ست من الإتنين اللى إتچوزهم جدرت تتحمل طبايعه الصعبه الله أعلم كان بيعاملهم إزاى، أنا شوفته بعينى كان بيضرب واحده منيهم عشان عصت أمره وراحت تزور أمها العيانه وبعدها طلجها، ده واحد مريض نفسى محتاچ علاچ.
170	إتحشمى ولمى لسانك عاد، تجصدى أيه بمريض نفسى، قصدك إن ولدى مچنون...
172	جطع يدك...
176	سلسبيل إعلمى كويس عمرى ما هسمح لأى حد يذلك حتى لو كان قماح نفسه.
177	في بنتين چم عشان يزينوا سلسبيل.
