line	text
107	هي رقابتك رجعت توجعك من تانى.
108	ده آلم بسيط، شويه وهيروح.
109	أنا شوفت جدتى كذا مره وهي بدلكلك رقابتك تفك تشنج عروق رقابتك وممكن أعمل زيها لو تحب.
110	براحتك هقوو...
111	تمام مش هنخسر حاجه إتفضلى دلكى رقابتى أشوف يمكن الوجع يروح على إيدك.
113	لأ واضح فعلا إنك ورثتى بعض المهارات من جدتى، الآلم شبه راح.
114	بجد وجع رقابتك خف.
115	أيوا خف كتير، صحيح مش زى جدتى بس ممكن مع الوقت تبقى أفضل، المره الجايه لما رقابتى توجعنى هقولك تدليكها إنتى وأستغنى عن الأدويه بقى.
116	بعيد الشر، قول يارب ما يرجع الوجع من تانى، قصدى يعنى ربنا يشفيك أنا حضرت لك الحمام، من شويه وطلعت لك غيار كمان أهو، هنزل أنا بقى أحضر الفطور، وكمان النهارده هيبقى اليوم طويل وشغله كتير، علشان العزومه اللى جدتها بتعملها، تجمع أفراد العيله كلهم، وكمان عمتى عطيات وجوزها وإبنها حماد الغ...
118	إبنها أيه؟
119	الغتت الغلس، لكن قالت لقماح: إبن عمتى الغالى زى ما بتقول عليه، هنزل أنا بقى وأنت خدلك دش والغيار أهو.
123	الأكل المره دى طعمه حلو قوى، أكيد ده نفس سلسبيل سمعت إنها كانت بتطبخ مع عمتى ومرات خالى.
124	الطبيخ كله ماما هي اللى تعتبر عملاه، أنا وسلسبيل كل اللى عملناه هو السلطه ومرات عمى كانت بتتأمر عالشغالات اللى كانوا بيناولوا ماما المكونات اللى بتحتاجها.
125	مرات خالى نهله نفسها حلو في الطبيخ.
126	إسألوا حماد وجوزى دايما اقولهم، نهله مرات ناصر أخويا الميه من إيدها ليها طعم تانى.
128	المثل بيجول لا حديث على طعام، ياريت ناكل في هدوء وبلاه كلام، وبعد الوكل نبجى نتحدت براحتنا في أى شئ، دلوق كلوا وأنتم ساكتين.
130	ليه مقومتيش مع نهله وسلسبيل وهدى تساعدى الشاغلات في فض السفره وتعملى الشاى.
131	أنا تعبانه شويه يا جدتى حتى قرفانه أدخل المطبخ، مش طايقه أشم ريحة الآكل.
132	ليه مالها ريحة الوكل، كانه فاسد إياك، ولا جلع ماسخ وخلاص.
133	مش جلع يا جدتى، أصل زهرت حامل، والوحم جاى لها بقرف من الآكل.
134	ألف مبروك ربنا يجومك بالسلامه بحچرك مليان، وتكبرى نسل عيلة العراب...
135	يارب يا عمتى، ربنا يكبر نسل عيلة العراب وعجبال ولاد قماح جريب يارب، ربنا يطعمه المره دى الخلف الصالح اللى يعوض صبره.
136	يعوض صبره على أيه، أوعى لكلامك شويه يا قدريه، قماح مش معيوب عشان تجولى إكده، وربنا بكره يرزجه هو سلسبيل الذريه الصالحه اللى تقر عيونهم، باركى إنتى لولدك ومارته ومالكيش صالح بقماح عاد، وبعدين فين كارم مشوفتوش من كذا يوم.
137	كارم معرفش بقاله كام يوم إكده بيخرج من صباحية ربنا مش بيرجع غير المسا عالنوم ولما سألته جالى أنه بيفكر يشترى كافيتريا في مكان عالنيل، والله غلبت فيه ينزل يشتغل مع قماح ورباح أخواته زى محمد بس هو بيجول هو مش رايد، هو دماغه إكده طول عمره، هتوهى عنيه.
138	مالها دماغه، مش شغال بالحلال، يبجى ربنا يرزوجه من وسع في اللى هو رايد يشتغل بيه، وكله خير.
141	ها قولى لى الموضوع اللى خليتنى أقوم بسببه.
142	الموضوع يخص شغلى، سبق يا بابا قولتلك إنى عاوزه أشتغل وحضرتك كنت موافق وقولتلى إنك كلمت أستاذ مجدى في الحسابات أنى أدرب تحت إيده.
143	الكلام ده كان قبل ما تتجوزى، كنا ممكن نقول هتتسلى، دلوقتي بقيتى متجوزه وبكره تخلفى وتنشغلى مع ولادك و.
144	خدي رأى قماح يا سلسبيل ولو وافق أنا معنديش مانع وهرجع أكلم الأستاذ مجدى وهو يدربك زى قبل كده لما كان بيدربك على تقفيل الميزانيات وانتى في الجامعه.
145	حاضر يابابا هقول لقماح، وعندى شك إنه يوافق أصلا بس بتمنى حضرتك تقنعه.
146	حاضر، لو رفض وقتها هحاول معاه وأقنعه علشان خاطرك.
147	شكرا يا بابا، ربنا يخليك ليا أنا وأخواتى...
148	قصدى يخليك ليا أنا وهدى.
150	مكنش لازم توافق سلسبيل إنها تشتغل، لازمته أيه تشتغل وتتعب نفسها، هي مش محتاجه للشغل، إنت شايف زهرت أهى كانت بتشتغل قبل ما تتجوز وعلى زى ما أتجوزت شوفتها طلبت تشتغل تانى، وكمان معتقدش قماح هيوافق إنها تشتغل، يبقى ليه تجيب خلاف مالوش لزوم.
151	وفيها أيه أما سلسبيل تشتغل، اهو تتسلى بدل من تنقيح قدريه، وكمان زهرت مش أفضل منها، بلاش طريقتك دى، سيبى سلسبيل على راحتها.
152	وبعد ما نسيبها على راحتها وأفرض قماح رفض وقتها، أو سلسبيل أصرت على طلبها، ممكن يحصل أيه.
154	كل شئ نصيب يا نهله وبلاش قسوتك دى مع سلسبيل وهدى.
155	دى مش قسوه دى خوف يا ناصر، انا بقيت بخاف واحده منهم تطلع من البيت بقى عندى وسواس أن اللى حصل مع همس هيتكرر معاهم هما كمان، أنا أرتاحت لما سلسبيل إتجوزت من قماح، رغم إنى حاسه أنها مش سعيده.
6	الخدامه قالت لى إنك عاوزانى.
7	الخدامه دى ملهاش إسم تجولى عليه، ولا لازمن تحسسى الناس الشغالين بالدونيه عالعموم ده مش موضوعنا أنا فعلا بعت ليكى عشان عوزاكى، أنا ملاحظه في الفتره الآخيره، رچلك چريت على دار أمك وبتفضلى عنيدها طول النهار مش بترچعى غير عالمسا.
8	ماما من يوم وفاة بابا وهي نفسيتها تعبانه، وبروح أحاول أرفه عنها الحزن شويه.
9	مچاهد بجاله فتره متوفى.
10	عارفه بس دى مع الوقت زى ما يكون بتحزن أكتر وبتتآلم من غيابه، وكاتمه في نفسها، وأهو بروح لها بحاول أطلعها من حالة الحزن دى.
11	آه وبترفهى عنه إزاى بجى، بتغنى لها عالربابه، بصى يا بت الناس، أنا من زمان مطنشه على خروجك الكتير من الدار، بس بعد إكده ممنوع تخرجى من الدار بدون إذن منى.
12	أنا باخد إذن رباح قبل ما أخرج من الدار.
13	كلمتى أنا اللى بتمشى في الدار دى عالكبير قبل الصغير، ورباح مش الكبير، يبجى متعارضيش إمعايا، بعد اكده هي مره واحده بس في الاسبوع اللى تزورى فيها أمك ومفيش مانع تبجى عندها طول اليوم كيف ما تريدى، أما خروج يوماتى ده إنسيه، أمك محتاچه ليك الدار أبوابها مفتوحه وهي مش غريبه منينا.
14	عاوزه تعيشى معانا إهنه في دار العراب أنا كلمتى هي اللى بتمشى، كيف ما جولت لك.
18	كويس إنك متوجفتيش ليها، وهاودتيها.
19	معرفش أيه اللى سكتنى عليها كان نفسي أخنقها وأريح الدنيا منها العقربه دى.
20	كويس إنك مردتيش عليها، وسمعتى حديتها، مش شايفه سوت أيه في عمتك، بلاش تحرمى نفسك من خيرهم.
21	خيرهم، آه بعد خالى ما جمد توقيع ولاده على سحب الفلوس، مبقتش عارفه أسحب من رباح حاجه عليها القيمه، بس وماله أتحمل العقربه دى شويه أما أشوف آخرتها أيه
25	سايب شغلك في الشونه وجاى المقر ليه؟
26	هو أنا ممنوع أجى المقر ولا أيه؟
27	تعالى أقعد مش حكاية ممنوع، بس ليه سايب شغلك وجاى هنا أكيد في سبب.
28	فعلا في سبب، أنا جاى لحضرتك في موضوع تجميد توقيعى على سحب فلوس من البنك.
29	سبق وقولتلك إنى جمدت توقيعكم إنتم التلاته ولو كارم كان هنا هو كمان كنت جمدت توقيعه، يعنى مش إنت لوحدك.
30	يعنى عمى سايب لبنته صلاحية التوقيع اللى بتقعد في مكتب مكيف وبمزاجها وقت ما تحب تنزل تشتغل، وحضرتك اللى إحنا رجاله وشايلين الشغل كله مجمد توقيعنا.
31	أولا عمك حر مع بنته، ثانيا سلسبيل مش بتنزل الشغل بمزاجها هي لها ظروفها الخاصه، دى خلاص قربت تولد، ومش معقول هتنزل تشتغل في الوضع ده، ثالثا، إنت بتاخد مرتب كبير جدا كل شهر، وأعتقد أنه بيفيض عليك، وبعدين ليه مروحتش تعمل الفحص الطبى الشامل اللى قولتلك عليه قبل إكده.
32	أنا كويس ده كان صداع وخلاص الحمد لله مبقتش بحس بيه.
33	بس شكل وشك متغير وغير مش شايف رعشة إيدك عالسيجاره اللى ولعتها، تشربها جدامى من غير إحترام، إعمل حسابك في أقرب وجت هاخدك بنفسى تعمل الفحص الطبى، ودلوك إطفى السيجاره اللى في يدك وممنوع بعد إكده أشوفك بدخن.
35	إعمل حسابك محمد هيرجع يشتغل معاك في الشون، وممنوع تفضل عليه حماد، وتقول أنه عنده خبره عن محمد، محمد اللى أخوك مش حماد، إنت مكنش عندك خبره والبركه في عمك ناصر هو اللى علمك الشغل بيمشى إزاى، اللى عمك ناصر علمه لك علمه لأخوك أخوك هو اللى هينفعك، مفهوم.
37	تمام ودلوقتي، روح شوف شغلك، وبلاش تسمع لحديت مرتك الفارغ.
38	زهرت مظلومه، ده مش كلامها أنا بتكلم من نفسى وبعدين زهرت مرتى وأكتر واحده يهما مصلحتى.
39	رباح هنا في المقر خير؟
40	هو أنا ممنوع أجى المقر ولا أيه أيه الغريب إنى اجى للمقر؟
41	لاه يا ولدى، المقر نور بيك.
42	ما هو واضح فعلا، عن إذنكم هرجع لمكانى اللى محدش بيسألنى فيه جاى ليه.
43	بإستفسار متعجب: ماله رباح بيرد عليا كده ليه؟
44	رباح متغير في الفتره الاخيره مضايق إنى جمدت توقيعه هو وأخواته على سحب أموال من البنك.
45	مش عارف إنت ايه هدفك من إكده.
46	رباح هو السبب المباشر، إنت مشوفتش المبالغ الكبيره اللى كان بيسحبها، وعلشان كده جمدت توقيعم هما التلاته عشان ميقولش إشمعنا هو بالذات.
47	ربنا يهديه.
49	الملف ده سلسبيل خلصته وبعتته معايا.
50	سلسبيل النسخه التانيه من الحجه هدايه كان حجك سميتها هدايه، بدل سلسبيل، نفس الخصال، أهى خلاص كلها أيام وتولد وبرضك رغم إنها في البيت بس كملت شغلها.
51	فعلا زيها جلبها حامى وحانى في نفس الوجت.
52	ربنا يقومها بالسلامه.
53	آمين دى نهله بقالها سبوع مش بتنام في الليل ساعتين على بعض حامله هم ولادتها، بتجول إتحملت كتير وهي حامل مش سهله جواز قماح عليها، صحيح بتظهر إنها مش فارق معاها، بس دى بنتى وعارفها كويس بتكبت في نفسها كتير.
54	فعلا قماح غلط في سلسبيل كتير وهي إستحملت، بس برضك هي مش ساهله دى مسوياه عالهادى، بتجاهلها له، صعبه عليه هو غلط بجوازه عليه وندم، مش ساهله عليه برضك تبجى جدامه وبعيده عنيه.
55	يستاهل والله ده أقل رد منها، كان فين عقله.
56	مش بدافع عن قماح إنت عارف إن بعز بناتك يمكن زى ولادى وأكتر كمان، بس قماح السنين اللى عاشها بعيد عننا الله أعلم عاشها إزاى وأكيد أثرت عليه.
57	مش مبرر للى إنه يتجوز على سلسبيل، بس أنا سايب ل سلسبيل القرار، ولو كانت طلبت الطلاق مكنتش هعارضها، زى ما حصل ليلة ظهور براءة همس.
58	قماح خذلنا كلنا، كان نفسى يبجى زى كارم ويحدد طريقه بنفسه.
59	كارم كلمنى إمبارح وقالى إن المطعم بتاعه مشاء الله شغال.
60	كارم النسخه التانيه منك يا ناصر فيه عنده قدره على إحتواء اللى معا.
61	ربنا يوفقه، وأسمع عنه الخير دايما
65	يحق لك يتغر لما يسمع كلامكم ده عليه، أيه مشوفتوش مدرسين قبل كده، المفروض تركزوا في دراستكم، مش شكل وهيئة الأستاذ، حتى هيئته متجذبش، المفروض دكتور جامعى ده حتى عمرى ما شوفته بجاكيت بدله فوق القميص.
66	وماله لبسه شبابى وإسبور، ولا هو عشان يعجبك لازم يكون لابس بدله ماركه عاليه، طبعا إنتى بنت العراب، والمظهر الخارجى هو اللى بتلفت نظرك.
67	أنا عمر المظهر ما لفت نظرى، بس فين الوقار بتاع دكتور الجامعه هو ده قصدى، المحاضره خلصت ومفيش محاضرات تانيه، بلاش أضيع وقتى في تفاهات، عن إذنكم.
68	ليه بتضايقى لما البنات بتتكلم بإعجاب عن نظيم.
69	ولا بضايق ولا حاجه بس مش بحب هوس البنات.
73	أهلا يا هدايه، خير.
76	تمام أتفضلى أقعدى وقوليلى إستفسارك أيه.
77	مالوش لازمه أقعد هو سؤال خاص بإختراق الملفات على الابتوب، في ملف مهم ومش عارفه أوصل ليه، حاولت أخترق الملف برضوا مفتحش معايا
78	والملف ده بتاعك.
79	لأ ده ملف خاص ب سلسبيل أختى خاص بشغلها وهي كانت عامله له باسورد خاص ونسيته، ومش عارفه تدخل عالملف ده، وأنا خاولت إختراق الملف وفشلت.
80	مافيش حاجه إسمها فشلت في مجال التكنولوجيا، لأن التكنولوجيا بتطور بشكل مذهل في كل ثانيه، ممكن تجيبلى الابتوب بتاعها وأنا أحاول من عليه أخترق الملف ده، هيبقى أسهل من أنى أخترق الحساب بتاعها من جهاز تانى.
81	هو الملف مبقاش على الابتوب بتاعها، لانها كانت عملت له فورمات، ويمكن هو ده سبب نسيانها لكلمة السر بتاعة الملف، ومش عارفه تستعيده رغم أنه محفوظ على جهاز تانى خاص بالمقر.
82	تمام سهل برضوا مش هنغلب، ممكن أروح لها المقر وأحاول على الجهاز التانى اللى محفوظ عليه الملف، وسهل أفتحه لها.
83	بصراحه كده، الملف مش على لابتوب سلسبيل ده على جهاز شخص تانى وأنا عاوزه أسترد الملف ده، لو في طريقه أقدر افتح بها الملف ده من غير الشخص التانى ده ما يعرف قولى عليها.
84	بس ده يبقي شغل هاكر، بس هقولك على طريقه تبعتى بها فيرس للابتوب اللى عليه الملف ده، ووقتها الابتوب هيعطل تقدري وقتها تجبيه ليا وأنا بسهوله أفتحلك الملف.
85	تمام إتفضل قولى إزاى أبعت للابتوب ده فيرس.
86	إتفضلى أقعدى لأن ده لازمه شرح عملى على الابتوب.
88	دى بعض الخطوات بإختصار في عندى سى دى عليه الشرح بتوسع، محمد إبن عمك معزوم عندنا النهارده عيد ميلاد سميحه، هبعتلك السى دى معاه في شرح وافى، وبسيط.
89	كل سنه وهي طيبه، هتصل عليها أنا وسلسبيل نعايد عليها، وتمام، شكرا، وآسفه إن كنت عطلتك.
90	لأ أبدا، أى إستفسار أنا جاهز للرد عنه.
91	أكيد في الكورس الجاى هناخد كيفية إختراق الأجهزه الذكيه.
92	آكيد بس لسه وقت على بداية الكورس ده، تقدرى تسألينى عن أى شئ يقف قدامك، يمكن نلاقى له حل سوا، إحنا خلاص نعتبر بقينا أهل، وبينا نسب.
94	فوق يا إبن بهنسى متنساش نفسك في النهايه إنت كنت في يوم شغال عند باباها وبيعطف عليك بلاش تطلع لشئ مش هيحصل.
98	مساء الخير يا لدوغتى.
99	أيه اللى جابك النهارده، إنت إستحليتها ولا أيه كل يوم والتانى ألقاك جاى لينا البيت من غير إحم ولا دستور.
100	هي دى مقابلة واحده لخطيبها تلطعه عالباب كده وتقوله أيه اللى جايبك.
101	أهو عشان تشوف معاملتها الناشفه معايا.
102	سبق وقولتلك لك ربنا، إنت اللى إختارت من البدايه.
103	ده أحسن إختيار.
104	ياريت تثبت على قولك ده بعد كده ومتتراجعيش.
105	يتراجع عن أيه حاسه إنكم بتتريقوا عليا، هو اللى جاى بدون سابق إنذار، وعاوزنى أستقبله وإنت مش موجود في البيت وماما طلعت عالسطح.
106	إحثاثك(إحساسك) مش في محله معقول أنا ومحمد هنتريق عليكى برضوا، بس ماما بتعمل أيه عالسطح، أنا أتصلت عليها وقولت لها إنى عازم محمد عالغدا.
107	آه عشان كده لما رجعت من الجامعه لقيتها مجهزه آكل أشكال و أصناف قولت نوت تطبخ لينا طبيخ الأسبوع كله مره واحده، أتارى عشان العزومه، ومعرفش ماما طلعت ليه عالسطح، هي قالتلى كده.
108	طب وسعى من قدام الباب خلينا ندخل، عيب محمد مش غريب لما تلطعيه عالباب كده.
111	كل سنه وأنت طيبه، يا سيدة خط الصعيد الأولى، والسنه الجاية تكونى في بيتى وسيدة قلبى الأولى.
112	بوكيه الورد ده هديه عيد ميلادى.
113	مش قبل كده قولتى لى نفسك في ورده هديه، أهو جيبتلك بوكيه ورد بحاله.
114	بس مفيش مانع مع البوكيه، غويشه او سلسله أوخاتم إنشاله فضه، هو زى إستير ما قالتلى الاغنيه بيقوا بخله، يلا الحمد لله إنك جبت لى بوكيه ورد.
115	جبتلك موبايل حديث وغالى، قولتلى عاوزه ورده أجيبلك بوكيه ورد بحاله تقوليلي عاوزه غويشه فضه، وفي الآخر برضوا طلعت بخيل أعملك أيه جننتينى.
116	لأ متتعبش نفسك، هي سميحه كده، قمة النتاقضات فيها، خلينا نتغدى وبعدها نبقى نتباحث في أمر هدية تعجب ثميحه.
118	خليكى وأنا اللى هفتح أشوف مين.
120	كويس إنك هنا با نظيم وأنتى يا فتحيه، بصوا بقى أنا مش داقه عصافير، بنتك النصابه ضحكت عليا وأدتنى طقم فخار مغشوش.
121	خدى نفسك يا إستير مالك بتنهجى كده ليه؟
122	كله بسبب بنتك النصابه باعت لى طقم فخار تلات قطع طواجن تدخل الفرن، وأقنعتنى أنها صحيه عن الصوانى الالمونيوم، أجى أحط الأكل في الصوانى وأدخلها الفرن تسرسب الميه اللى عالطبيخ في أرضية الفرن تبوظه غير إن الاكل إتحرق.
123	أنا مدياكى طقم برفيكت تلاقى ده سوء إستخدام منك.
124	الطقم معايا أهو، شوفوا بنفسكم التلات طواجن، مشرخين من الجوانب، عيب صناعه.
126	طب والشروخ دى مشوفتهاش قبل ما تاخدى منها الصوانى.
130	ميت جنيه أيه اللى عاوزاها، عاوزه فلوسك تجيبلى بضاعتى سليمه، كده يبقى سوء إستخدام المنتح رسمى.
132	فعلا زى ما قالت سميحه، عاوزه فلوسك لازم تردى ليها بضاعتها سليمه زى ما أخدتيها منها.
133	أيه ده، محمد إنت هنا من أمتى؟
134	أنا هنا من اول ما دخلتى، بصراحه كان معاكى حق لحد ما وقع منك الطواجن وإتكسرت كده الحق بقى ل سميحه.
135	إنت بدافع عنها دلوقتي، بس بكره، ولا أقولك ربنا يكون في عونك أقعد أما نشرب العصير سوا، واحكيلك مش بتلاقى حد تنصب عليه غيرى وكل مره بقع في فخها إزاى معرفش زى ما تكون بتسحرلى، تكونش سحرالك إنت كمان عشان تخطبها.
144	منزلتيش تفطرى ليه؟
145	أبدا مش جعانه ماليش نفس، وكده كده مش هروح المقر قولت لما أجوع ابقى آكل، وأكمل نوم.
146	طب ليه مش نايمه دلوقتى؟
147	بسبب ناصر بيه العراب، ما بيصدق أنى أحط ضهرى عالسرير ويبدأ وصلة رفص، زى ما يكون بيكره إنى أنام.
149	مالك يا سلسبيل.
151	قومى إلبسى هدوم تانيه وخلينا نروح للدكتوره اللى متابعه معاها الحمل، ممكن تكون حركة البيبى الكتير ده مش كويسه علشانك.
152	لأ انا كويسه وسألت الدكتوره في آخر متابعه عن حركة البيبى وقالتلى عادي، وده كان مغصه كده وراحت وبقيت كويسه، متعطلش نفسك إنت وروح للمقر.
153	بس ملامح وشك بتقول إنك لسه موجوعه
154	لأ الوجع خلاص راح أنا كويسه، حتى حسيت بجوع هقوم أكل.
155	خليكى مستريحه وأنا هنزل أخلى أى شغاله من تحت تجيللك الفطور لحد هنا.
156	إنت سبق وقولتلى ممنوع أى شغاله تدخل الشقه هنا.
157	سلسبيل مش وقت الكلام ده، أنا هنزل أقول لشغاله تجيبلك فطور، لو مش عندى شغل مهم في المقر مكنتش هسيبك...
164	مالك يا سلسبيل.
165	مش قادره حاسه بوجع جامد باين إنى هولد النهارده.
167	جدتى، هنزل اقولها بسرعه.
170	جدتى إلحقى سلسبيل كنت قاعده معاها في الشقه فجأه صرخت بآلم.
171	ربنا ينتعها بالسلامه، إهدى يا بتى وخدى يدى لشجتها، قالت هدايه هذا ونادت على نهله التي آتت لها سريعا، أخبرتها هدايه أن سلسبيل تلد.
