line	text
249	يااخى مش طايقاااك .. انت مابتحسش .. شوف يامجدى طلقنى بسكات ومن غير شوشره ومن بكره هسحب المحضر .. يااما هسجنك وهخلعك .. خليك جدع واحسن صورتك ولو بموقف واحد يااخى ..
19	قال تتجوز قاال !
62	ربنا يديك الصحه وربي يابابا وانت روحت فين ..
63	""" لا منا مركز مع البطل الكبير "" .."
69	لا ياختى مانستش يلا قدامى .. احسن الواحد مايتهورش ...
73	ايوه ايوه ياختى بتحايلينى .. مش كده ..
76	أحنا مش قولنا نبطل قهوه ياهانم !
77	معلش بقي اخر مرة والله .. عشان دوشه السفر ودماغى مصدعه .. ومتنساش احنا يعتبر ما نمناش من امبارح ..
84	اييه ياعم انت كمان هتحسدنى على النوم !
85	لا ياستى نوم الهنا .. خدى راحتك ..
86	هو انا نمت كتير !
87	اااه ياستى طول الطريق قاعد برغى مع نفسي انا ..
89	دانا كنت هطق .. بس دا مايمنعش انه كان فى شويه بنات على الطياره صواريخ ..
90	بتقول ايه ياسي مجدي ..
91	بقولك محلوه لييه .. صاروخ يخربيتك ..
92	اااه بحسب ..
95	ابنك عاوز العيديه هو ومامته ..
96	عينيا ليه هو ومامته .. هو ياخد قلبى ومامته هتاخد حاجات اهم بس نخلص صلاه ..
97	ياابنى اتلم .. ويلا العيد هيخلص ..
101	ما خلاص ياعم انت هتذلنى ولا ايه .. ايام وراحت لحالها وانت استحملتنى لحد ما اتعالجت وبقيت احسن وكتر خيرك كمان ... بس ماتنكرش انى بقيت حلوة بعد كده ؟!
102	سبحان ما كان مصبرنى عليك .. بس دا مايمنعش انى اقولك انى غرقان فيك يابت الايه وبعشقك .. وكان لازم اضحى عشان افوز بجنتك .. ولا ايه ..
103	الجنه الحقيقيه هى حضنك ووجودك جمبى يامجدى .. انا من حسن حظى انك نصيبي الحلو فى الدنيا والاخرة ..
104	لا وحياة عفاف مش وقتك .. بقولك اى نثبت كده لحد مانخلص صلاه ودبيح ونيجى ندبح بمزاج بقي ..
105	مستنيه .. عشان انت كمان وحشتنى جدا ..
109	اووف يامحمد .. انا زهقت دى مابقتش عيشه ..
115	بسخن لبن بس عشان انا عارفه طقوس العيله دى مش بيفطروا غير بكبده العجل .. وممكن تجوع .. فحاجه تسندك ياحبيبي ..
121	عماد نيره فى الحمام  ابعد مايصحش تشوفنا كده ...
122	وفكرك بخاف يعنى .. وبعدين هو الواحد بيخلف عشان يتسجن .. انا اول مرة اشوف حد بيجيب جلاده بنفسه ... وبعدين يعنى !
127	اى رايك ف الدريس بتاعى .. مامى كانت بتقول لى اكيد انه هيعجبك ..
134	""" وماما هتعرف منين .. انت بتبوسنى انا فعشان كده بتشوك .. لكن مامى مش بتبوسها فأكيد يعنى مش هتعرف """
137	"""عماد .. اتلم "" .."
151	روح صلى يامحمد ..
179	انا كنت عندها امبارح دي مش فاكره اى حد فينا غير ماجده ... انا بقيت بروحلها اتوجع وارجع تانى ..
182	""" عليه افضل الصلاة والسلام """
183	واللي اسمه حيدر ده عمل ايه ..؟!
186	جرى ليكم ايه اومال ! ده عيد يابت انت وهى يلا افتحوا لينا الاغانى الحلوه اللى تشق الفرحه على القلب ... وانت ياوجد يلا تعالى نحضروا الفطور قبل الجزار ما يوصل ..
187	وانا ماليش شغلانه يامراة عمى ولا ايه ! ولا هى وجد كلت الجو مننا ؟!
188	لا يالمضه روحى جهزى خلق جوزك عشان الدبيح .. وانت يايسر ادى بتك لصفوة وروحى شوفى البنات جهزوا مكان الدبيح ولا لا ؟!
189	يعجبنى فيك ياعمتى انك عندك شغل مابيخلصش ..
190	ياجماعه انا حماتى بتحبنى والله .. ومافيش بعد كده دلع ... ااه وياريت بسرعه بقى عشان انا واقعه من الجوع .
191	ده عشان بطنك بس ماتتمرعيش قوى .. فوفا مش بترحم حد ..
192	صحيح ياصافى ولد ولا بنوته ..؟!
193	انت متعرفيش .. الهانم طلعت سوسه ..
200	لا بقولكم اي انا لسه ماقولتش لمجدى ومستنياه بعد الصلاه .. محبتش افاجئه غير فى مصر .. بليز محدش يبوظ لى المفاجئه ..
201	ااه ياسيدي ياسيدى .. نطلع منها يعني ..
202	ماتبقيش رخمه وخفى قر بقي ..
203	دي سوسه ياعم .. تعالى تعالى نحضر الفطار واحكيلك كانت تقول ايه وتعمل ايه
207	شايفه ياعمتى ؟!
208	خبر ايه عااااد ماتقصروا ! خلاص يايسر هشيل انا البت وانت روحى ساعدي وجد يلا .. وانت يانورا روحى اقضي مُصلحه ..
213	دى فكره حلوه قوى ! وانا موافق
214	استنى بس يامحمد .. ياعدنان بيه كبارات البلد كتار وكلهم يستهاهلوا المنصب ده ؟!
215	على قولتك يابيه .. هما كتار لكن مافيش فى عقلك وحكمتك واصل ؟!انت اللى تستحق المكانه دي .. خاصه هيكونلك درايه بشئون البلد وعاداتها .. ولا ايه يارجاله !
218	هنشوفوا الموضوع ده فى البيت ..
221	ده قرار كبارات البلد يامعالى المستشار .. ومافيش منه رجعه واصل ...
246	حصل ايه ؟!
256	انا شايفه ان معالى المستشار مايفوتش فرصه زى دى ...
257	هو دا اللى بحاول اقنعه بيه طول الطريق
12	يابيه دول عاوزين ياخدوا تار راجح بيه الله يرحمه .. ومحدش قادر يقف قصادهم واصل ..
45	""" حرب بشرف وبأخلاق ياحمزه بيه .. حرب نرد بيها كرامه النجع وكبيره .. مااحنا لو سبناها عايمه اكده هيركبونا لامؤاخذه وهتبقي بلد ملهاش كبير """
52	معاد الحرب أذنت ياولدى ولازمن نكون يد واحده عشان النجع يفضل بقوته قصاد الكل واللى يستجرى ينطق بكلمه يفكر الف مرة قبل مايقولها .. احنا جاايين نكون مع بعض مش ضد بعض ..
71	ياويلهم من اللى هيجرالهم منينا ..
72	انا شايف ان لمتنا هنا ملهاش لازمه وسايبين الصوان من غير صحابه ..
196	هو كده يا حمزه ..
203	جدى قبل ما يتوفى كان وزع تركته وكل واحد فينا عارف اللى ليه واللى عليه ..
204	عاااال .. يبقي كل واحد يراعى مصالحه وتكونوا يد واحده محدش هيقدر يفرقكم ابدا ..
213	ماتفضها سيره بقي يامحمد !
215	ماتسيب الملك للمالك يااخى انت محمل نفسك فوق طاقتها ليههه ..
217	هو انا مش قولتلك اللى مابيرجعش بالدم عيرجع بالنار ياضكتور ...
218	كيييف ! هااا اى هو مخطط الهوارى الصغير؟!
17	والنبى انت رايق .. سليم ينوبك ثواب هاتلى العلبه الكبيره دي من فوق مش عارفه اجيبها ...
18	يابنى انجز امك مستنيانى يلا ..
24	يلا هسندك ..
41	بقولك ايه .. احنا اصلا متخانقين فوسع كده ؟!
42	ايامنا هنا وحشتنى .. ايه بطلى رخامه بقي دا حتى اليوم عيد ..
43	طيب ممكن يا بابا نأجلها عشان دلعك ده مش وقته ..
44	تؤ .. هو ده وقته ..
52	مش وقته ياوجد !
55	اه ياوجد عارف .. وانتِ كمان عارفه ردي .. ممكن ننسى ونعدي يومنا ؟!
58	وجد انت عتهربى من ايه ..
59	نزلنى قولت ياسليم ..
60	هااا احكى ..
61	لا ماانت عارف ومصمم رايك .. والكلام اللي لا هيقدم ولا ياخر قلته احسن ..
67	زى القمر اوي .. كل سنه وانت طيبه ..
68	وانت طيب ..
77	انت قليل ادب وانا هروح اقول لبابى انك عاوز تبوسنى ..
82	صلاه النبى ! يعني دلوقت حرام ولما تكبروا حلال ..
83	خد ياسالم تعالى ..
84	نعم يابابا ..
85	قولت تعالى هنا ..
89	اللى اتعمل ده مايتكررش ..فاهم !
90	ماانت كمان بتبوس ماما !
91	ااه انت ومحمد بقي اللي باصين لى فى ام الجوازه دي .. قولوا كده ...
94	مانا قولت له يااونكل دي تصرفات كبار .. استنى لما نكبر ..
98	وانت ياخاايب اللي يبوس بيسئذن ! خليك واعى زي ابوك .. الحاجات دي تتخطف خطف كده !
99	نعم !
100	راسك تخينه زي امك .. اوعى تعمل كده تانى فاهم ! عماد هيدبحنا زي العجل اللي لسه شايفه ..
101	هروح اقول لماما انك قولت عليها راسك تخينه ...
103	اخرة اللي يحكى مع عيال !
106	صفوة ! واقفه عندك بتعملى ايه ..
107	مالك وبتتكلمى بشويش ليه !
112	وحد ينسي البركه بتاعتنا ..
113	منا قولت لما افكرك وكده .. وبما اننا مطولين مش هنروح بيتنا دلوقت .. قولت الحق اعتذرلك على دبش يسر الصبح ..
114	ياباشا انا كلى ملكك .. معرفش ازعل منك اصلا .. وخصوصا بعد حركة الجدعنه دي ..
122	بجد ! طب ماتقولى !
127	ماتبقيش حماقيه عاااااد ..
130	ممممممم كده هفجر المفاجئه ؟!
146	ريفريش بقي لليلة المكتبه من 5 سنين .. الخبر دا مش هيعدي كده !
154	""" طب ياولدى .. ابعت حد من العيال يشيع لها !"""
166	البت نايمه اششش قولت ..
169	لا بقولك ايه انا لسه زعلان ؟!
170	منا هنا عشان اصالحك ..
173	اسبوع يادكتور !
176	البنت يامحمد ؟!
179	وانا اولع يعني !
182	وبنت الكلب دي تنيميها من المغرب !
186	شكلك يموت من الضحك حقيقي !
187	طيب اصبري على رزقك الليله .. عشان تضحكى كويس ..
192	ماهى قفشتنا كتير .. دي بقيت مسجلانا كلنا سوابق ! واهو المطبخ احسن من اوضتها ؟!
193	متفكرنيش ! يالهوى انا كل ماافتكر الموقف ده بموت من الضحك ؟!
194	ما انت اللي كنت منفضه لى جامد ومش لاقيه حاجه تهربي منى فيها غير تنضيف اوضه عفاف ! وبصراحه كنت هطق منك احمدي ربنا بقا انها دخلت قبل ما اتهور وووو
195	اشششش اخلاقك بقيت زفت اوى .. كنت فكراك محترم والله !
197	يالهوي عليك تشبيهات فظيعه !
209	وفى اوضه النوم كان يقولك ياعماد بردو !
214	يلا ياولدى الله يهديك خلينا نجهزوا الوكل ونخلصوا ..
215	احمم فى السريع يانورى هاا .. فى مشروع بيبي عاوزين نجيبه سوا
216	ياواد اتحترمنى طب ..
223	ابن اونكل سليم !
224	سالم ! ماله ؟
229	هات لى الواد ده ؟
230	اهدى بس ياعمده واللى اتباس هيتصالح ..
231	قصدي اللي اتكسر هيتصلح ؟!
233	والله ياعمو كنت عاوز اقولها كل سنه وهى طيبه .. وبعدين منا ببوسها فى راسها على طول اشمعنا بؤها يعني اللي زعلها ..
236	انت تخرسي خالص .. لسه حسابك جاي ..
237	مش كنتى تتباسي وتسكتى اهى الترابيزه اتقلبت عليك ..
238	بتقول ايه ياسليم !
240	والله انت اللي عاوز تتربي مش ولدك ..
245	شوفت ياعمده انت اللي مكبر الموضوع
248	ما من شويه كان وهو فى حد لاقى بوس ومايتباسش يبقي مش وش نعمه ..
253	لم دورك وهات الواد اربيه ياسليم ..
254	مالك وقفتوا لعب ليه ! دانا كنت جاي العب معاكم ..
255	ولد بيبوس بتى ياسي محمد ..
256	جدع ياض .. طالع لابوك نمس ..
257	وكمان سالم قليل الادب بيبوسنى !
258	دا ابن سليم لو معملش كده تبقي عيبه فى حق ابوه ! فى المشكله !
259	تصدق ما فى حد عاوز يتربي غيرك ..
270	انا بقول يومك عشان مافيش دماغ لموضوع بنفتحه خمس تلاف مرة كل يوم ..
293	عاوز ليلة من ايام زمان .. شغل الطيارى والعيال دا مش واكل معايا ...
298	ما كان من الاول .. وانت وحشتني اكتر يابت الايه ! الا هو انت كنتى بتغيري هدومك ليه ؟
299	كنت هاخد دش وانزل وو كده يعني ..
302	سليم مش وقته ووو
307	يعني لو كنت صممت وقولت لا .. مكنتيش هتحبينى !
315	ماما صاحيه بره اتلم ..
322	يوسف ..
325	طيب احميك يعني ..
331	تؤ .. لاه
332	لا ياشيخه .. ماهو واضح اهو .. بتحايل عليك عشان اقعد معاك ..
333	انت وحشتني جدا جدا .. بس كنت مخططه شويه حاجات كده وانت اهو بوظتهم ..
337	اد ايه !
344	قوليلهم يأم عماد والنبى .. لسانى نشف معاهم .. وحضرة الظابط مش بنشوفه غير 3 ايام كل 45 يوم .. يرضي مين ده ..
347	يابتى الوحده لما تجيب عيالها صغيرين يتربوا معاها احسن ما تجيبهم ع كبر ..
348	دعواتك ياطنط ..
351	الارض انشقت وبلعته .. ملهوش اثر ..
354	وانت سنتين مش عارفين توصلوا يايوسف !
355	عمك قعد 3 سنين وسط المجرمين وغيرهم واكيد اتعرف على حد هناك وساعده يهرب .. متقلقوش اكيد هيظهر هيروح فين يعني ...
356	مالك ياجماعه ماتفتكروا حاجه حلوه بدل الغم ده ..
365	وهو ده عين العقل بصراحه الغبى اللي يرفض فرصه زي دي !
366	يابت فلترى كلامك يخربيتك ..
367	قولها .. هى امريكا مغيرتكيش يادكتوره !
372	وليه مش بنوته !
373	لالا احساسي مش بيكدب ...
4	"عاجبك كده ؟!عاجبك كل اللي بتعمليه فينا ده .. - ثم التفت الي يسر-""انت بتفكري فى ايه """
5	هتعرفى دلوقت ..
9	طالما انت مش هتقولي لنا الحكايه يقولنا هو ..
10	ابوس على ايدك قوليلنا ايه اللي مخبياه من ورانا ! احنا معاك مش ضدتك ..
16	كنت بحبه ومحبتش غيره ! عمرى ماحبيت ابوكم .. حيدر الوحيد اللي خلانى اقدر اعيش معاه العمر ده كله ؟!
17	اااه وده من علاقتك معاه فى الحرام !
18	انا قرفانه من نفسي انك امى ..
19	انت اللي قتلتى ناصر ياثريا ! مش كده .. انا عارفه من اول يوم غاب فيه انه اتقتل .. ناصر لما خرج انت مكنتش فى البيت ومن ساعتها مارجعش ..
20	ايه الشر دا !
21	ابونا اتقتل ! قتلتى ابونا .. لا ماتقوليش !
22	حيدر اللي قتله زي ماقتل سالم ...
27	بت حمزه الخياط يامحمد .. الحقها جووه وسيبك منىىىىىىىىىى ...
63	هما اتاخروا اووى جووه ... انا قلقانه يكون حصلهم حاجه ...
64	ان شاء الله خير يادكتورة .. الحكومه وصلت جوه وهينقذوهم كلهم ..
65	لالا انا لازم اروح اشوفهم حصل اي .. منا مش هقعد متكتفه كده ..
66	ماينفعش جنابك .. كده هنخالف اوامر سليم بيه ..
67	خلاص انا هقعد فى العربيه وانت تروح تطمنى حصل ايه .. نفذ يلا يااما هروح اشوف بنفسي ...
74	انت اخت وجد ؟!
83	صفوة طمنينى على بنتى .. جرالها حاجه ...
111	ماجده ؟!
118	قولت محدش يقرب ..
129	انا قتلته ياسليم .. هو يستاهل هو اللي جابه لنفسه هما اللي قتلوا اخويا ...
137	خايفه يحصل فيها زي اللي حصلى .. مش هقدر اشوفها متعذبه زي مانا اتعذبت واتحرمت من الخلفه باقيه عمرى .. واتحرمت ان يكونلى ولاد كتير منك .. انا لاول مره اكون جمبك فيها مرعوبه ياحمزه ...
140	هما بيعملوا ايه جوه لكل ده !
143	امه عامله ايه .. طمنينى بتى كويسه ..
144	هى حالتها كانت صعبه اوي بس دلوقت هى احسن ونايمه ساعتين كده وهتفوق متقلقوش .. الف مبروك ..
148	انت هتسمى الواد اييه !
149	قولت الخياط على اسم جدي ؟
150	حمايا بيهزر يادودو متاخديش على كلامه ..
158	ممم خلاص هسيبهاله المره دي عشان الكلمتين الحلوين دول ياوعد ...
161	يعني خلاص على كده هنعيش مرتاحين .. مافيش خووف ؟!
162	طول ماانا موجود مافيش حاجه تخافى منها !
169	ايييه اززاي !
170	ازاي دى هتعرفوها فى وقتها .. المهم يلا نطمن على مراة النقيب حمزه !
171	يابنى البيت والع حريقه وامك على اعصابها وكمان نورا صوتها مش عاجبنى ..
172	المهم دلوقت انا حد يخفينى من وش حمزه الخياط عشان لو شافنى هيخلى الطب يحتار فيا ...
177	سلملى على الانجازات دي لما يقابلها الخياط ...
183	هتدفع التمن غالى ياا ولد الهواري ..
197	هو مش باين انى زعلانه ولا ايه ؟!
199	بص يافؤش انت خدت وقتك وفكرت ياما يابن الناس تكتب عليا وابنك يتربي فى عزك .. يااما تدينى مبلغ معتبر يسكتنى ويادار ما دخلك شر ..
206	كله معمول حسابه .. هو واقع فى ساميه وساميه مش هتسيبه وهيرجع تانى بس لما اختفى واخليه يدور عليا الاول ..
210	اهو نكسب ثواب فى اي عيل من بتوع الملجأ ...
58	فى ايه ياعماد ... مااالك انطق ..
69	معنديش استعداد اخسر بنتى ولا اتعذب تانى .. بنتى حامل يانورا وعلى وش ولاده وانا هتجنن عليها .. ياريتنى صممت انها ماتخرجش انا اللى وقفت قصاد جوزها وحمزه انها تروح معاه قنا ...
89	هو بتتالم ليه كده ياوجد ... هى مش هتولد ..
109	هو ما حدش اتصل ليييه ... والزفت دا خاطفهم ليه طالما متصلش يقول عاوز ايه ؟!
110	ادهم اذكى من انه يعمل كده لانه عارف مش هيقدر يواجهه هو دلوقت بيفكر يلعبها صح ! لو حطينا نفسنا مكانه ممكن نتصرف ازاى نخطف تلات بنات عشان يجيب رجل هدفه الاساسي المفروض انه يتصل ويقول طلباته لكن ادهم مش هيعمل كده ... ادهم عاوز يخلص مننا احنا والبنات بضربة معلم وهو يطلع منها زى الشعرة من العجينه ..
111	او يلبس عمه كل الليله وهو يخرج منها شاهد ملك ...
118	انا عارفه المخزن دا ..
126	تيجى فين انت كمان هى رحله ؟! ماتتكلم يامجدى ..
133	تروحى فين انت كمان .. ما تقعدى على حيلك ..
134	صفوة خطر عليك دول يعتبر طالعين الجبل ...
142	تيجى فين يااسليم انت اتجننت .. انتوا هتاخدوا بنات معاكم مش كفايه اللى عندهم ...
145	جاااي معاكم ...
146	برجلك دى بطل جنان ..
148	مجدى متسبش البنات لوحدهم واحنا هنتصرف ماتقلقش ..
149	اى الجنان ده .. انت مستحيل تتحرك ..
150	دى فرصتى وجات لحد عندى يايسر ولازمًا تار راجح يرجع .. تقلقيش عمر اللى على حق ما هيتهزم ..
161	سيدنا محمد رسول الله ...
174	اييييييه !
208	تصدقى حتى دى مابقتش مصدقاها !
215	على فكره يايسر بالمناسبه اللي حطلك حبوب الاجهاض هى امك مش انا .. واذا كنت قولت كده قدام محمد فده عشان اجيب اخرها واخليها تطمن ..
218	بلاش نحكى فالللى فات يايسر .. خلينا نشوف الست امنا مخبيه علينا ايه تانى ..
219	اما حرمه قليله الاصل صوح ! بقي مكفاكيش كل اللي حصل زمان من تحت راس التعلب ده رايحه تتجوزيه .. لولاش حرام لكنت قتلتك بيدى ..
220	ياما عشان خاطرنا كلنا قولي لنا مخبيه ايه عننا .. واى علاقة بالراجل ده .
221	انا بنفسي مشيت وراها لحد الفندق اللي بيتقابلوا فيه والموظف قالى انهم متجوزين ... ناصر الهواري ابويا فين يااما ؟!
223	معرفش .. معرفش .. واطلعوا بره كلكم ؟!
224	انت اييه مصنوعه من اييه .. معجونه بميه عفاريت ! عقولك عيالى طلعوا وماعارفش اذا كانوا هيرجعوا تانى ولا لا وانت بمنتهى البرود متجوزه التعبان اللي اسمه حيدر
227	عارفه اللي زي مايستاهلش يبقي ام اصلا من ساعه ما قستينا على جوزانا وكل هدفك الورث والفلوس .. وانت لما قولتى لنا المشتري جاهز يتحمل شيلة اراضينا كان قصدك مين ! هو مش اكده ..
228	عال انتوا الاتنين تداروا ورا ستارة التار والخلافات بين العيلتين لحد ما يقضوا على بعض وفى النهايه كل الهلمه دى ليكم .. خطه فى منتهى الذكاء
231	قتلتى ابونا ! قتلتى ناصر الهواري ! طب لييه اى الجحود دا ..
234	اوماااال ايه اللي حصل .. ! اى اللي يخليكى تتجوزى غريب وانت مش متأكده ان ابويا مات ..
236	اومال ماشيه فى الحرام .. كمان ! عذر اقبح من ذنب !
241	قولى فين اي عشان نلحق نتصرف .. قولى يمكن نفكر ونخرجك منها .. مهما غلطتى لازم يكون عندنا فرص تانيه عشان نكفر .. وحيات الدم اللى بيجري مابينا احكى واعملى حاجه واحده صح ..
242	لا مش هنتطق .. بس انا هعرف ازاي اخليها تنطق ...
245	تقف جنب العربيه اللي فيها الدكتورة متتحركش واي حركه غريبه تاخدها تروحها .. فااااااهم !
251	انا قلقانه عليهم يابيشمهندس .. خدنى عند بتى ..
252	انا هروح اشوفهم وانت اطنى وخشي اقعدى مع الحريم جوه .. حمزه بيه موصينى عليك !
253	بالله عليك يابنى خدنى معاك .. انا حاسه برج من دماغى هيطير ..
256	قولت هاجى معاك .. يلا .. زي ماانت قلقان على مرتك انا قلبى بيتقطع على بتى ..
262	شرق المخزن ادهم وحسن قاعدين وبيتعشوا .. فى باب خشب صغير على جنب دا انسب مكان نخش منه اللى الناحيه الغربيه وزي ما حمزه قال مافيش غير راجلين ..
266	فى واحد تانى هناك ..
269	هناك فى 4 رجاله والناحيه دي على اليمين ف 3
270	وقدامك فى اتنين !
