line	text
273	مش دايما الكثرة تغلب الشجاعه .. الصياد برمي شباكه فى قلب البحر ويصطاد سمك .. احنا هنعمل كده .. هنصطاد السمك .. شايف الشجره دي انا هركب فوقها وانت احمى ضهري .. ولما تشوفنى استقريت انزل واركب على الشجره اللى هناك بخفه وانا هحمى ضهرك .. ركز يادكتور !
276	بطل جنان واتحرك ..
279	تمام تمام اهووو ..
282	والله انا ما خايف غير منك عشان كده خليتك معايا .. اركب فوق شجره وحط كاتم الصوت لسلاحك واضرب فى اماكن ماتموتش .. شل حركه الهدف احنا مش قتالين قتله ..
285	التلاته الواقفين هناك دول .. سليم روح اظهرلهم نفسك وانا وعماد هنصطاهم من هنا ..
286	جاهز ..
287	طول عمرى
294	مكانك ياجدع انت !
301	تلاقي حركه المقاطيع .. ربنا يخلصنا منهم
304	الحقنننووووووووونااااااا
307	شكل فى حد فى المكان ؟!
312	فى ايه ..
313	دي بتولد الله ينتقم منكم .. طلعونا من هنا ..
314	سيبنى قولتلك ...
318	بتىىىىىىىىىىىىىىىىىىىى !
319	ياوووولاد الكلللللللللب ...
339	بت حمزه الخياط يامحمد .. الحقها جووه وسيبك منىىىىىىىىىى ...
17	وهما ولاد البلد يتطاولوا على حريهما ... كان عاوز منك اى يانورا ..
18	خلاص ياعماد محصلش حاجه .. هو هيمشي دلوقت ..
19	وان مامشتش !
20	يبقي ماتلومش غير نفسك !
30	هبات معاها .. ماينفعش اسيبها فى الحاله دى ..
31	قولت يلا ياوجد .. كلهم معاها ونورا موجوده ولو فى حاجه هينادوكى !
33	ومين قالك انى هأمن على بتى معاكى .. مستغنين عن خدماتك اتقلعى من اهنه .. قدمك قدم شوووم ..
36	مش يلا ياووجد ..
47	ماللللك !
69	معندكش دم ... وبعدين متغيرش موضوعنا ..
73	ايه اللي عليها .. مافيش حاجه !
74	وانت يعنى شايفه حاجه انا اللي شايف ... استنى متتحركيش اما نشوف ايه دا ...
84	مين اللي هتقابليه بكره دا ياماجده !
85	هاااا لا مافيش .. انت اللي سمعتى غلط ..
99	صح حماتك قدمت فيك بلاغ ومش بعيد الحكومه تيجى تاخدك من وسطينا دلوقت ..
100	كانت ناقصاها الوليه دي هى كمان !
101	ادينى سبب واحد يستدعى انك تعمل فى مرتك كده ... عقلك راح فين ياعاقل يابتاع الحكم والمواعظ ..
102	متشغلش بالك .. انا هخلص كل حاجه ومش هرحمه .. المهم عندى صفوة تسامحنى !
103	بتحلم دى صفوة وامها واخواتها لو عتروا فيك هيعملوا منك شرايح يدرسونا عليها فى الكليه !
104	انا معرفش عملت كده ازاى .. والله ما كنت فى وعيي .. يارب سامحنى يارب ...
106	طيب ياوجد ايامك مش فايته معاي !
109	والله يابيه انا لقيت الست هانم راحت البيت الكبير قولت اقضي مصلحه على السريع ..
110	لقيت الست هانم راحت على البيت الكبير ..هى جوازة مربره انا عارف ...
113	انت مين سمحلك تيجى هنا !
122	انت فعلا مش فاكره !
125	خلاص مش اطمنتى عليها .. قاعده ليييه هنا !
126	خلاص اصلا كنت مستنيه نورا بس اقولها على العلاج وماشيه .. معلش استحملينى الخمس دقايق دوول ...
132	اومال جوزك لسه مجاش ..
133	لا جيه بس كلهم متجمعين مع حماتى تحت حبت تفطرهم بنفسها .. وكمان حادثه مجدى جات سليمه ..
134	جاااه قصف رقبته ... نفد من الحادثه بس لسه مشافش انا هعمل له ايييييه ...
135	مااحنا بردو محدش يعرف السبب الحقيقي اللي خلى مجدي يعمل كده وبعدين ماانت عارفه صفوة وحركاتها تلاقيها هى اللي عصبته ...
140	متشكرين يامتر .. ربنا يباركلك ..
141	يلا مش خساره فيييك تستاهلهم ..
145	كيف الحديت دا ياعمى ..
147	مش مرتاحله !
148	ولا انا وحياتك .. اقولك ايه عاوزك تقطره وتجيبلى خبره ...
150	عظيم يمين تلاته ياثريا لو ما كنتى فى الفندق بعد ساعه لهتشوفى منى اللي عمرك ماشوفتيه ...
151	ياحيدر البت عيانه ماينفعش
157	يااااااااااااااارب ..
161	اي سيبك منى دى .. لا طبعا مستحيل .. اقف هنا وقول لى فيه ايه !
164	خلاص حصل خير .. لوضايقك تانى قوليلى ..
172	قصدك مين حضرتك ؟!
174	اااه اهه قصدك الست ثريا مراة حيدر بيه !
22	شكلكم انتوا اللى مش واعيين انها بقيت مرتى يعنى حديتكم لا هيقدم ولا يأخر .. وياريت كلكم تقبلوا بالامر الواقع .
33	ماتهدى يامحمد .. مالك طايح فى الكل ولا عامل احترام لحد .. هو كان جدك لوحدك اللى مات !
40	ماتحرجش نفسك وتجيبها ياسليم لانى وقتها انا اللى مش هخليهم يدخلوك ..
41	تمام .. هنشوفوا ..
61	سليم ! حصل حاجه ..
62	طبعا حصل وانت ولا على بالك ياهانم ..
68	ماتخلصنا ياعم النحنوح  ..
78	وجدددددددد
90	تفتكرى سليم هيسمع الكلام !
91	سليم اللى اعرفه مش هيسمع كلام حد .. وهيقلبها مجزرة ... استرها يارب .. ناوى على ايه ياولدى الهوارى !
197	طيب قول لى في ايه اوعى تكون اتخانقت مع اخواتك !
218	ربنا يخليك ليا ياروح قلبى .. كنت متاكده ان الخبر دا هيبسطك ..
225	حماتى !
226	ااه معلش .. عشان فرحتنا تتم !
1	كانت ترتب كل شيءٍ للمستقبل، تفكر دائمًا في القادم، وأكاد أجزم أنها لو عرفت بموعد موتها، ستجهز المنزل للعزاء قبل أن تذهب.
7	طيب شوف مين وهو انا هطير يعني .
14	لا ياحبيبي مافيش بس ...
23	اى اللي مش فاهمه ! انت مش معايا ولا ايه ..
39	اي سلومى دى ! مش عجبانى غيريها ..
46	ياقلبك الجامد ! انت بتقولى كده وانت تحت رحمتى ..
56	انا اسفه يامحمد .. انا انسانه انانيه مابتحبش غير نفسها موتت ابن اختها بايدها .. انا اللي زيي ماينفعش يكون اخت ولا خاله ولا يعيش اصلا .. اانا مستعده لاي عقاب يامحمد حتى ولو هتطردنى من البيت .. انا حبيت اريح ضميري قدام ربنا يمكن حاجه تغفر لى ..
80	طيب عصبيتك دى مش هتحل اي حاجه .. اهدى ونفكر بعقل طيب .
81	عقل ايه يانورا واحنا بقينا ناكل فى بعض .. القتل والسجن عندنا بقي سهل .. من يوم ما الهوارى مات وكل واحد ماشي بدماغه وكيفه لحد ماهيودونا فى داهيه .. محدش بقا له كبير .. كل واحد كبير نفسه وماشي براسه لحد ماهيغرقنا كلنا ...
103	وحشتينى ياقلب حيدر .. اي مالك خايفه ليه ؟!
104	مش هينفع البيت هنا مش مظبوط وكله بيشك فيا .. بلاش نتقابل والنبى .
105	بكره تيجى فى البيت ايااه ياثريا والا هجيلك انا وما حد هيقدر يوقفنى  ..
108	وحشتنى شقاوة البيت قولنا نرجع الزمان ولا ايه ياسووسو..
109	هحاول ياحيدر .. هحاول ...
110	اسمها هتيجى ياثريا .. اسمها هتيجي ..
118	ماجده استنى اسمعينى وافهمينى للاخر .. انا محتاجلك قووى .. ماجده متسبينيش ...
119	يابنى ادم افهم انا مش عاوزه اعرفك تانى .. كان يوم اسود يوم مااعرفتك ...
120	ياماجده اسمعينى بس وبعدين قولى اللي عاوزاه ..
154	احنا عرفنا ياسر فتح الله فين
160	الف حمد وشكر ليك يارب .. انا طلبت منك ليله واحده معاه فى حلالك جمبه .. كرمتنى اكتر ماتمنيت .. ربنا يحفظك ليا ياحبيبي زي ماجمعنا ..
163	بتفرج عليك .. اي فى مانع ؟!
179	هتفضلى تبصيلى كده كتير !
192	ومين قالك انى عاوز افر .. انا خلاص لقيت مكانى ومش هسيبه ..
209	كل سنه وانت حبيبي ياسليم ..
210	هو مش لسه باقى يومين بردو ؟!
217	اتمنيت امنيتين ..
220	ربنا يديمك فى حياتى نعمه ياسليم .. وينور حياتنا بولاد شبههك ويغلبونى زيك  ..
225	سليم لازم تتنازل عن المحضر اللي قدمته فى حيدر عم مرتك ..
229	حمزه ساعه وهقابلك عشان مش فاهم حاجه واى اللي قلب ادهم على عمه دول كانوا روح واحده !
176	لا ياولدى .. لا بلااش دم، متقهرش قلب امك عليك ..
177	دا متهجم علي بيتنا يعنى مش هاخد فيه يوم ياما .. تقلقيش دا قدملى السلاح اللى هيتقتل بيه على طبق من فضة ..
217	انت يابنى بتقول شر للبيع ! ما انت كنت في بحريه بتحارب اعداء الوطن و تتكافئى في الاخر باك نجمه على كام مليم تمشي بيهم حالك، جاى ليه لوجع الراس هنا ؟!
225	انا انا بخير ياعمى .. المهم خلص عليهم ميطلعوش منها على رجليهم ..
259	جرحه سطحى يعنى مش مستاهله كل الفيلم الهندى دا ..
294	الدم ناره ما عتنضفيش غير بالدم ياحمزه بيه .. مفهاش دى متعلم ولا جاهل ..
295	محمد .. بطل جنان انت كمان .. ويلا بينا ..
296	انا مش متحرك من هنا غير لما اخد تار الهواري ..
299	اسمع كلام اخوك يادكتور ... والحق مسيره يرجع .. يلا قوموا يارجاله شيلتكم تقيله ...
312	سلسال الدم لازمن يقف ... كفايه راح فيها ولد اخوك والهواري .. اعقلوا وهنجتمعوا كلنا الليله عشان نوصلوا لحل ...
16	بقي النقيب يوسف جيه اللي يقوله اتعدل ومايعرفش يرد عليه ! طيب ياستى عموما خدى راحتك بس لحد المهمه دى ماتخلص .. وبعدها اخلص انا بطريقتى ..
17	ممكن تسمعنى للاخر وبلاش مقاطعه ..
37	يفتش اى وبأى حق يفتش اصلا .. انت معاك اذن نيابه !
40	خاالتك !
43	اهو عندك فوق اتفضل ..
52	يارب عديها على خير .. انت عارف ماليش غيرك .
57	ايوه يابت بطنى .. كوثر اللى ما عرفتش تربي ! وجايه تقطم رقبتك ..
83	حصل ايه ياولدى وضرب النار دا لييه ..
84	دي الست ام وجد جات وقالتلنا عاوزه  اشوف بتى وكانت عتبكى فدخلناها واتفاجئنا انها معاها سلاح وضربت على سي سلييم ..
85	ولددددى .. بت العتامنه هتجيب اجله ..
88	لا ما لولا الدكتور محمد ربنا بعته فى الوقت المناسب كان هيجراله .. بس ست وجد عيانه قوى ..
93	شوف مين بيتكلم !
104	ااه ياسليم خليك جمبها ساعتين تلاته وهتفوق .. انهيار عصبي مستحملتوش فاغمى عليها ..
105	سلليم عاوزاك .. قوم معاي ..
121	انت ضربتى فى نفوخك ولا اي يابت انت .. فوقى وشوفى بت العتامنه عامله زي الحيه عتلف على جوزك كيف ! وانت ياخايبه هتطلعى من المولد بلا حمص ..
137	مجدى طلقك ..
140	لا مستحيل مجدى يعمل كده عشان خايف يتحبس .. انت اكيد فاهمه غلط ..
143	انت بتتكلمى كده ليه ! ماتتكلم عدل !
148	هاااهاا لالا يبقي ماتعرفش صفوة .. وقعت منك دي يامعالى المستشار ..
149	هتشووووفى ..
152	فى اي يامحمد ! مالك ..
155	شربت لبن .. امى جابتلى لبن ! لييه
156	ااااه امكككك .. قولتيلى !
157	فى اي يامحمد مالك !
160	مستحيل طبعا !
163	الحقنى يامحمد ..
169	ايوه اللي همما ميين ؟!
172	يبقي تسمع ابو على هيقولك ايه ..
176	ازاى !
177	هع هقولك على اول ضربه ...
182	لا عندك واسمها وجد كمان وانا مش هتجوز غيرها .. انت مش عاوز تجوزهانى ليه .. اكمنها دكتوره وانا مش دكتور زيها ! بس الاستاذ سالم قدوتنا عمره ما يفكر فى الفروق دي ..
184	انا مش عتنفس غير وجد ..
185	وهى ! رايداك !
197	مفاقتش ياصفوة .. اروح اوديها مستشفى طيب !
198	ان شاء الله مش مستاهله ياسليم !
201	ماتقلقش دى نايمه بس .. وساعه بالكتير وهتلاقيها فاقت .. هقوم انا هخلى حد من البنات فى القصر يجيبلها اكل .. وانت متسبهاش .
202	تعبتك ياصفوة وانت فى الحاله دي !
215	ينفع تنسي كل حاجه وماتفتكريش غيري .. انا زى القرد قدامك اهو !
223	والله انت مشكله ..
224	قلقتينى عليكى جدا .. جالك قلب تعملى فى سليم كده يامفتريه !
229	انسي ياوجد .. كأنه محصلش حاجه وامك معذورة بردو .. انا لو عندى بنت زي القمر كده زيك واتجوزت من ورايا هدفنها .. ولا ايه ..
247	ابدا .. تصفيه حساااب ..
250	جاي تشهد على عمك ! دي شكلها هتحلو اووي !
251	لا انا جاي اقول شهادتى من غير ما عمى يعرف .. اعتبرونى فاعل خير فى القضيه دي ..
252	وخير ايه اللي عندك يا فاعل الخير !
255	يعنى هى متجوزتش من وراكم وعمك مكنش يعرف انها متجوزه !
259	حصل .. وانا مستعده للطب الشرعى يثبت كلامى ..
262	لو سمحت
265	استنى يابنى انت بتكتب اييه .. صفوووة انت اتجننتى ..
266	استاذ عماد خلينا نشوف شغلنا والا هضطر اخرجك برا التحقيق !
269	يااثريا ... تعالى انزلي جييه الوقت اللى تنكشفى فيه قصاد الكل وتبان حقيقتك ..
276	لا انا معملتش انت اللى عملتى لما سقطيها .. وشوفى بقي حطيتى لها ايه فى اللبن قبل ماتشربه ... انت قتلتى ولدى قبل ما يجى ياثريا ..
297	تعبتك معايا امبارح .. مش كده ؟!
302	قومى بس وسليم هيعيشك يومين بره الدنيا يلا ..
305	دى اكيد صفوة جايه تطمن عليك .. او حد من البنات جايب فطور .. مش هتأخر عليك ..
308	الدكتورة وجد متقدم فيها بلاغ من النقابه ومطلوب القبض عليها لتحقيق معاها
309	ايييييييييييه !
8	مش جايه اضاايف ..
28	وهو ؟!
29	مش شايف غيرك ..
30	انت لو عرفتى ان فى حد بيحبك دلوقت ومستعد يحارب الدنيا كلها عشانك .. وانت مش شايفه غير سليم .. هتعملى ايه ! هتروحى للشخص التانى اللي بيحبك ولا هتعيشي على اطلال سليم ؟!
32	وانت اى ذكرياتك مع سليم؟ .. انت شايفه ان سليم قدملك كلمه حلوة تستاهل تضيعى الحلو من عمرك عشانها .. انا عارفه مش بايدك وان لكل واحد مننا قلب اتخلق ليه وعشانه ..
38	هو انا ليه مصدقاكِ .. ليه بسمع كلامك لحد دلوقتى ؟! غريب ان الانسان يسمع ويقتنع من ألد اعدائه ..
42	اسفه عطلتك .. هسيبك وامشي ..
45	انجدينى يااوجد .. الحقي اخوكى بيروووح منى ياوجد !
46	زيييييييييييين !
47	فى حاجه ياوجد ؟!
48	انا جيالك دلوقتى ياما متقلقيش ... خير ان شاء الله ..
49	حصل ايه ياوجد ؟!
52	استنى بس هتروحى فين .. متتجننيش ياوجد !
58	اي يارميو البت دى طالعه وواخده فى وشها ليه .. هببت اي يافقري ...
61	طب ماتوسعه .. خليك ناصح ..
62	والله ياعفاف ماعرفتى تربي عيل فى عيالك دول ..
65	مش عاوز اصدمك ياعفاف واقولك انها جابت ولدك على جدور رقبته ؟!
66	يانيله بختك فى ولادك ياعفاف .. ياريتكم بنات كنت عرفت احكم واربي بدل العيشه والغلب اللي شيفاه على يدكم ...
73	تعالى تعالى اسمع امك هتحكيلنا على غرامياتها مع ابوك ...
80	ابن الوز عوام يااهوارى ..
81	واللي خلف مامتش ياعفاف ..
84	خبر اي يام عماد هو كان حد زعلك ولا ايه داحنا نرميه للسمك ...
87	لا انا مرتاح هنا ..
88	شكله عارف مصيره وان ست صفوة هترجعه تانى بس المره دي بعاهه مستديمه ...
91	مالها وجد ياماجده انطقى ..
96	الحق اخوك يااعماد .. ماتسبهووش ...
108	يازين قووم عشان خاطري قووم والله كنت جايه اخدك انت وورد عشان تعيشه معايا .. زين قووم انت امانة ابوياا اللى معرفتش احافظ عليها .. هقول ايه لابوك .. ليه كده يازين ليييه .. قووم قووم انا جيتلك اهو مش هسيبك تانى خليك جدع انت كمان وماتسبنيش ...
117	قطع لسانك .. ولدى هو اللي هيقتلك ويغسل عاره منك يافاجره ..
142	بتهمه ! انت شكلك نسيت القانون ياسيادة النقيب .. وبدل ماتشغل نفسك بالحاجات دي الافضل تروح تكمل مهمتك اللي انت هنا عشانها ..
143	يافندم اس
144	يووووسف قولت الموضوع منتهى !اتفضل شوف شغلك
148	انت بترجع فى كلامك ليييه .. وبعدين احنا مش اتفقنا وده شرطى انى اصالحك اصلا ؟!
149	ابوكى مش هيرضي على الفوضي دي .. وبعدين انا هكون طول اليوم فى الشغل مش هعرف اخد بالى منك .. هى هكون مكمن عليك اكتر ..
150	ياحمزه انا عاوزه اجى معاك وبعدين عاصم والهام سافروا امريكا ومش راجعين دلوقتى وانا مش هقعد هنا لوحدى .. يلا بقي عشان نوصل قبل الليل .. وبعدين الدكتور اصلا قال لى اهم حاجه المشي الكتير والراحه النفسيه وانا نفسيتى مش هترتاح غير وانا جمبك وكمان عاوزه اتمشي معاك كتير زي زمان ..
155	لا الرمل ده انا الل هدفنك جوه بيدى ياادهم ..
162	ااه جاايه عشان اموتكم بيدى ... واخد تار اخوي منكم ...
167	زين اخوى مات بسببى ياسليم .. انا اللي سكت ومبلغتش عنهم .. انا اللي سبت البيت ومشيت وسبته .. منفذتش وصيه ابويا ياسليم ..
168	لا اله الا الله .. اهدي ياوجد اهدى ياقلبى ..
171	الساعه دي مش غريبه عليا ؟!
172	بص ياسليم الساعه دي جابها ابويا من 4 سنين لعمك ناصر .. واللي مستغرباه ازاى الساعه دي وصلت لعمى ...
173	ومن وقت وفاة ابوكي وعمى مظهرش ! يبقي اكيد عمك يعرف حاجه عن غيبه عمى ناصر ! والساعه دي وصلتله ازاي ... اى الحيره دى ..
176	لا ياحيدر بيه احنا ماشيين .. بس اتاكد اننا هنرجع تانى ..
177	مش هقدر اسيب امى ياسليم بالحاله دي وفى نفس الوقت خايفه منهم .. وكمان ورد آآآآآآآآآآآآآ - ثم صمتت قليلا- هى ورد فين مالهاش اثر من الصبح !
178	ورد فين ياادهم ..
179	وانا هعرف منين .. تلاقيها طفشت ولا اتجوزت كيف مااختها عملت ...
194	ااااااااااااااااااااااه هيجننى لييييه ...
216	يبقي اللي قتل سالم واللي يعرف سر اختفاء عمك هو حيدر !
220	عمك ناصر اتقتل ياسليم وسالم كمان اتقتل واللى عاوزين نوصله دلوق اى السبب اللي يخلى اتنين صحاب يتقتلوا والساعه دي تكون مع حيدر ..
221	استنى استني ياعماد .. هو لما تقوم تار بين العيلتين ومنهم عيله تقضي على التانيه اللي هتتحبس يبقوا الاتنين راحوا فى داهيه مين الوحيد اللي هيستفيد بكل دا .. انه يستفرد بالثروه كلها لوحده !
222	سليم ! انت عارف ليه ثريا وافقت على جوازنا من بنتها .. لانها كانت متفقه معاهم انهم يمضنونا على عقود بيع وشرا وان فى مشتري مستعد ياخد كل دا ويدفع فى وقتها .. انا سمعتها بتقول كده لنورا .. سليم الموضوع بيتعقد ... وفى سر كبير واحنا لازم نعرفه !
240	وّهمك قاتلك على الاخر ودا خطر على صحتك ياهندسه ...
242	انت ازاى تعمل المصيبه دي مين قالك انى عاوزه ابقي مراتك مين سمحلك تردنى !
243	قلبى ! اي عندك اعتراض ؟!
248	من اللاب توب بتاعك ..
249	اييييييييييييييييييييييييه !
268	سليم ! لا مش موجود
278	دماغك دي مافهاش غير الشمال ! ياخى اقصد يعني تقعد معايا نرغى سوا وكده !
279	لالا احنا كرجاله ملناش غير فالشمال .. مش بنحب نضيع وقت يااسووو ..
280	طمنى اخبار الشغل ومجدي وكل المشاكل دى ايه ؟!
281	بقي واحد يكون معاه القمر ده ولوحديهم فى الاوضه الحلوه دي وتالتهم الشيطان وتسالينى على سي مجدى والشغل والمشاكل ! اى النكد ده ! لالالا شكلى هعملها واروح اتجوز واحده تدلعنى ياعم !
282	طيب ورينى هتعملها ازاي .. والله اقتلك انت وهى !
289	مين بره !
290	ياست عشق الحقى حمزه بيه اتصاب فى المهمه وحالته خطر وهو عاوزك حالا فى المستشفى
302	طيب يااحنين !
311	ايييه ! ورد !...
52	يامجدى والله العظيم ماعملت حاجه ..
56	محمد والله فى حاجه مش طبيعيه فوق .. صفوة بتصرخ
57	تلاقي مجدى بيدلع شويه بس .. هاتيلى القميص يايسر خلينى انزل اشوف المستفشى ..
58	والله صوت تكسير يابنى فوق .. اطلع شوف فى ايه ..
65	كنت سرحانه ولا ايه ..
77	دانت ضايعه...
98	خير يارب
105	انت عملت فيها اييييه ؟!
112	انت جرى لراسك اي ياوجد .. من ميته سليم الهواري خدك بذنب العتامنه .. انت لحد دلوق مش واثقه فى حبى ليك اللي اتحديت الكل عشان ..
119	يد عمك الهربان لسه ملوثه بدم ابوي ياسليم .. حدش زرع بذرة الشر غيركم ..
120	ومن ميته حبنا عناخدوه بذنب افعال غيرنا .. انت عفاف قلبت راسك وجايه تطلعيهم عليا !
122	وجد مرقي يومك والا هسيبهالك وامشي ..
126	شكلى مش واخده بالى من حاجات كتير ..
129	الحق ياسليم مصيبه .. صفوة قاطعه النفس خالص .. ومحمد عاوز وجد ضروري تكشف عليها ..
