line	text
7	طاب ما هو شهاب زي الفل
8	لا شهاب دا تربية ايهاب، اما مراد و سليم دول تربيتك، والاتنين اسوء من بعض، كان نفسي يطلعو لعبدالرحمن، حتت سكره كدا يا بخت شمس بيه والله.
9	آيه غوري من وشي دلوقتي
11	بس انا بحب ادهم، بحبه علشان هو ادهم و زي ما هو ادهم ومش حد غيره، ادهم شدها وهو بيحط ايده على وسطها
12	امال ليه الكلام إلى يحرق الدم دا
14	تعاله هنا بقا قولي كنت بتخوني مع مين امبارح لما صحيت تتسحب من جنبي وكلمت واحده
16	اتسحب اي انا كنت خايف لا تصحي. وبعدين حد يبص برا ومعاه القمر بين اديه
18	يعنى انا لسه حلوه يا ادهم
20	لسه قمر زي ما انتي يا حبيبتي
22	يوووووها يا مراد كام مره اقولك سيب جوري في حالها
23	ماما خلص الكلام في الموضوع دا
24	الله الله يا سي مراد كبرت وبقيت بتعرف تخلص كلام
26	روح انت يا مراد
27	حاضر يا بابا
29	محدش مبوظ الواد غيرك
31	اممم وانتي كام مره تتكلمي معاه ومفيش فايده القوانين اتحطو جوري لمراد...
32	قوانين مين دي يا ايهاب باشا
34	رجال الصعيد
37	الحمدلله نزلت شويه. هنا دخلت جوري إلى بقت 15سنه دخلت وهي شايله صنيه
38	خلاص يا بابا هي زي الفل بس بتدلع عليك علشان تشوفيك بتخاف عليها ولا لا. بس متقلقيش يا ست لسه بيحبك
40	ربنا يخليه ليا
42	و يخليكي لينا
46	راحه فين يا عسل
47	متقليش يا عسل
49	راحه عند مين يا شاطره، (كارمن بنت اسر صاحب ادهم)
50	يووووها والله انت انسان بارد.
52	مش بنت إلى تسيب شهاب الخولي وتمشي وهو بيتكلم
54	هااااا
56	هااا اي بس
58	كارمن
60	عمو ادهم، شهاب حس بضيق انها حضنت ابوه كدا.
61	جايه لوحدك ليه فين ابوكي مجاش معاكي
62	بابا مشغول وبعتني مع السواق
64	كارمن حبيبتي اخبارك اي واخبار مامتك
65	بخير وبتسلم عليكي
66	بس جايه ليه لوحدك
67	اسر كان قالي ان كارمن جالها كليه تجاره هنا في الصعيد، بس مكنتش اعرف انك هتيجي
68	اسفه يا عمو اني جيت فجاء بس.
69	يا حبيبتي انتي تيجي في اي وقت، اطلعي ارتاحي وغير هدومك مع آيه علشان تنزلي على العشاء
70	تعالي يا حبيبتي.
74	مالك
76	ابنك دا ماشفش بربع جنيه تربيه يا عمو
77	شهاب لا هو محترم بس انتي إلى دخلتك جات معاه غلط
79	ع. عمو. ه. هو انا
80	لا عادي.
82	صحفلي يا زفت
83	اقعد يا كبير
86	بس محدش قالي ان الفراوله بتطلع شتاء وصيف
87	دي اكبر منك ياروح امك.
88	تؤ ما انا الكبير بكبره والصغير بصغره بدوس في كله
90	ياخي غور من وشي انا اصلا مش طايقك
93	شكرا، علشان جبتولي احله هديه في الدنيا رجال الصعيد...
1	عايزك يا كارمن، كارمن غمضة عنيها و انفاسه الساخنه على رقبتها
3	موافقه يا كارمن
6	عايز اسمعها يا كارمن
8	ا. ايوه موافقه
10	تمام عايزك تقولي كدا لما عمي آسر يسألك
14	اكيد طبعا و بعدها لو في قبول احنا ان شالله نيجي نطلبها من ييتكم
15	ان شاءلله
17	بابا
19	اخبارك ايه
20	بخير يا بابا الحمدلله
21	احم ف عريس متقدم و انا جيت اخد رايك لو رافضه فكرت الجواز و كدا.
23	لا يا بابا انا مش رافضه خليه يتقدم ولي فيه الخير يقدمه ربنا
25	ماشي يا حبيبتي
28	بتعملو اي
29	بنعمل فطير مشلتت الولاد بيحبوه اوي حور كانت قاعده على الطبليه هي و نسمه و نوسه و معاها سلسبيل و جوري.
31	الولاد برضو
33	و ابو الولاد
34	مفيش حيا
35	طاب انا عايزه اعمل معاكم
36	مش هتعرفي يا حبيبتي
37	و ماله تتعلم تعالي يا قمر انت اقعدي جنبي و انا اعلمك
39	اهو يا تيته اعمل ازي بقا.
40	اقطعي بالحتا الصغيره كدا و بعدين افريده بسمنه لحد ما ترق شويه و اعمليها بقا كدا على اديكي
41	اخر حركه دي صعبه عليا انا هعمل اول اتنين بس
42	ماشي يا حبيبتي اعملي إلى عرفتيها و انا هكمل الباقي
45	صباح الخير
46	صباح الخير بعد الضهر يا حبيبي
48	صباح الخير يا ستي، و نسمه.
49	صباح الخير
51	صباح النور عليك يا حبيبي
53	هي الساعه عشره يا ست الكل، بقولك اي يا جوري نوليني قرص من إلى مطلعاهم مرات عمي دول
55	اعملك شاي معاها
57	لا دا لوحده يفكي، همشي انا علشان الحج عماله يرن
58	ربنا معاك و يسهلك طريقك يا حبيبي
60	امي فين الجلبيه البيضه
61	على الحبل فوق
62	هتهالي يا ست الكل معلش و اكويها
63	روحي هتهاله يا كارمن هتعبك معايا بس لو سبت الفرن الفطير هيتحرك، شهاب كان ماشي بس اول ما سمع كلام امه و قف مكانه و لابتسامه مزينه وشه
64	بس انا عايزه اعمل معاكم خلي سلسبيل
65	سلسبيل اديها مليانه سمنه و محتجينها هنا بس خلاص لو مش عايزه هقوم انا و تعالي ياجوري اخبزي مكاني.
66	خلاص يا طنط هروح انا
70	مش دي إلى جنبها
72	و لما انت طلعت مجبتهاش لنفسك ليه
74	مش بعرف اكوي، كمل و هو بيقرب، و الحمدلله مراتي شكله بتعرف تكوي و بعدين كويس انك طلعتي علشان لما نتجوز تعرفي هدومي
76	ا. انا
78	انت اي.
1	حرام عليك إلى بتعمله يا مراد دا انت بنت عمك حتا
3	دا انا حتا هبسطك هو انا مش زيه، مش كنتي واقفه معاها بتضحكي و مبسوطه
4	ولله ما هعمل كدا تاني بس ونبي سيبني انزل. غمض عنيها بضيق و هو بيحاول يسيطر على نفسه هي لسه صغيره برضو
6	غوري من وشي.
8	هااا
9	بقولك غوري ولا هعمل حاجه متعجبكيش
13	كنت فين
14	هكون فين يعنى اكيد مع وحدها
16	عارف لو كان الكلام دا بجد هعمل فيك اي
17	اممم مش خايفه لحد يشوفنا، كمل بخبث. او اقول ل مراد مثلا
19	تؤ كلهم نايمين وانت مش هتقول لمراد حاجه، بصلها و بتسم وهي كملت طريقه بكل ثقه.
20	تصبح على خير يا حبيبي، حط ايده على راسها
21	مجنونه بس بطايه كدا يخربيتها.
22	ممكن تبعد
24	اممم مش انا سافل و مشفتش بربع جنيه تربيه، تيجي اوريكي السفله بيعملو اي
25	هانده على عمو ادهم، قرب منها وهو بيحرك ايده على وشها ركزة في عنيها تقريبا هي تاهت قرب من ودنه وهي غمضة عنيها وهمس
26	اندهي براحتك بابا نايم و مش هيسمع حاجه، بعد شويه لقيها لسه مغمضها ابتسم بغرور على تاثيره عليها و حب يستغل الزوبعه إلى عملها في مشعرها وقرب منها.
1	ايوه هي دي ثبت هنا
3	مين الحيوان دا
4	دا هشام ولد ابن راجل غني كدا بياخد السنه في تلاته مش مظبوط و شمال
5	حرك الفديو شوفه خدها فين، العامل كامل الفديو الشاب طلع من الحمامات و هو جارار كارمن من ايدها و هي بتحاول تبعده، شدها و خدها في البنايه الفارغه ورا الحمامات.
6	يلا بسرعه، شهاب و محمد طلعو على المكان دا، و كل ميقرب يسمع صوت صريخ و شهاب بيجري بجنون اكتر
8	اي بس يا كارمله خايفه كدا ليه، فجاء لقمه بعدته عندها
10	دا انا هطلع اهلك النهارده، و شهاب نزل فيه ضرب، شهاب نزل فيه ضرب و هو مش حاسس بنفسه كان هيموت في ايده.
11	شهاب سيبه هيموت فيها انا هتصرف و انت وف قريبتك
13	محدش يمس شعره منه دا حقي و انا إلى اتصرف، يتلقح كدا زي الكلب و رجالتي شويه و هيجو يخدوه
14	شهاب مينفعش و
16	هي كلمه يا محمد و بلاش غطبي يطولك انت كمان
20	احسن
22	احكيلي دلوقتي بكل هدوء حصل اي
23	ا، انا. ان
25	كل بكل هدوء يا كارمن من غير عياط
26	حاضر، مسحت دموعه
27	خدي نفس و حاولي اهدي، كارمن عملت كدا فعلا و حست نفسها هديت.
28	انا كنت ماشيه عادي فجاء خبطة فيه اعتذرتلو بس هو قعد يقولك كلام مش مظبوط ضربته بالكف و جريت و هو جري وراي استخبيت في الحمام و رنيت عليك
29	انا عارف الباقي، غمض عنيه و كمل، الكلب دا انا هعرف اربيه، كمل و هو بيبص لكارمن
30	مفيش حد في البيت يعرف حاجه ولا عمي اسر.
31	ا. ن. نا مش هرجع الكليه تاني. و قلت لبابا اني عندي محاضرات لحد المغرب
32	لا دي ساهله.
34	انا مستحيل اروح شقتك
36	و مين قلك هنروح شقتي
37	امال هنروح فين
38	اممم هاخدك نفطر بدل فطاري إلى مكملتوش و هفسحك شويه ونتغداء برا كمان و ادينا بنلف لحد ما اليوم يخلص
39	ايوه كدا
42	تعرف انا بحب اوح الملاهي اوي، النادل جبلهم لاكل كارمن اتكلمت و هي بتاكل و شهاب كان عطيها كل تركيزه
43	عارفه اني شحطها بس انا بحب الملاهي اوي و كنت يقعد اعيط علشان اروح، و بحب عصير القصب اوي لدرجه اني كنت بجيب بمصروفي كل عصير
44	خلصي فطارك بس و انا هبهرك
45	اوك
47	بجد شكرا، و جريت على جوه تطنط بين العب
48	شهاب شهاب و انبي تعاله جرب معاي العبه دي
50	انتي عايزه شهاب ادهم الخولي يركب حاجات العيال دي. اركبي انتي و انا متابع من هنا
51	وربنا انت فقر.
55	كارمن. كارمن، كارمن قامت بنوم و همست
56	وصلنا
57	ااه وصلنا
59	شكرا، و نزلة، شهاب حرك العربيه يركنها و هو بيدندن بفرح و غافل عن عيون ابوه إلى كان واقف في البلكونه و شاف كل حاجه.
2	مش هينفع نكمل العربيه عطلت
3	طاب هنعمل اي.
4	هنروح شقتي لانها اقرب لحد ما المطر دا يخف
5	لا طبعا انا مستحيل اروح شقك
6	هو انا هاكلك، كارمن بتوتر: ط. طاب اتصل بعمي ادهم يجي يخدنا
8	و إلى يخلي عمك ادهم يجي يخدنا يخلينا نرحلو احسن، الطريق عطلانه بسبب الطين.
9	لا برضو مستحيل اروح معاك، بعد شوي كانت كارمن بتمشي معاه لطريق الشقه، شهاب دخل الشقه وحط المفاتيح على التربيزه، : اتلفي في البطنيه دي علشان مفيش هدوم و هدومك مبلوله.
12	هو احنا هنقعد هنا لوحدنا اليل كله
14	اه شوفتي، هتقضي اليل كله مع و حد سافل زي ما بتقولي و الشطان شاطر، كارمن بدموع: انا عايزه اكلم عمو
15	نعم يختي
16	عايزه اكلم عمو ادهم، رنلي عليه مليش دعوه
18	خدي خدي متصدعنيش
20	شهاب انت فين وف.
21	دي انا يا عمو
23	كارمن حبيبتي انتي فين و فين شهاب.
24	العربيه عطلت بينا و احنا رجعين من الكليه احم و احنا دلوقتي في شقته يا عمي شقت شهاب. شهاب ابتسم بسخريه لما عرف اصرت ليه تكلم ابوه و تمتم
25	متخفيش يختي اول حتا هيدور فيها لو حصلك حاجه
26	طاب يا حبيبتي خدي بالك من نفسك ماشي
27	حاضر يا عمي، كارمن فصلت و ادت التلفون ل شهاب
28	تقدري تدخل تنامي جوه و تقفلي على نفسك الباب لو خايفه
29	لا انا اصلا مش هنام.
31	انتي حره.
33	مراد
34	اممم بتعملي اي
35	كنت هنام
36	كدا تنامي من غير متتصلي و تطمني عليا
38	ما هو عمي قال انك وصلت بسلامه
39	ماشي هعديه المراد. بس الكلام دا ميتكرارش تاني ماشي
40	حاضر.
42	بتعملي اي يا مجنونه هتبردي
44	تعاله بس هتنبسط اوي العب تحت المطر حلو اوي
45	سلسبيل هنتعب و...
47	مكنتش اعرف ان المطر حلو كدا
48	امال عملي فيها عمي الرومانسي و انت مش فاهمه حاجه
49	امم اديني فهمت يا ستي و على ايدك
50	علشان تعرف بس.
54	كارمن كارمن
56	صباح الخير
57	صباح النور
58	تحبي اعملك تفطري
59	لا انا عايزه امشي.
60	طيب، هعمل بس فنجان قهوه اصحصح بيه و نمشي
62	ماشي بس بسرعه
65	رايح فين على الصبح كدا
67	رايح اجيب كارمن
69	ليه ما هي هتيجي مع شهاب
70	انا اصلا من امبارح منمتش و حاسس عايز ارحلها في طياره.
71	هو انت مش واثق في شهاب
72	واثق فيه يا حبيبتي بس دا بشر برضو و خصوصا اني حاسه مايل ليها
74	صباح الخير يا بابا
75	فين كارمن
76	في اوضتها
77	هروح اطمن عليها
79	حبيبي انت كويس
80	شكله كدا دور برد هاخد اي برشام و انام شويه، . سكت شويه و كمل. و كارمن كمان شكله تعبت اعمليلها حاجه سخنه يا ماما
82	مهتم اوي انت
83	يووووه يا ماما انا رايح انام
84	هسيبك دلوقتي بس لما تصح لازم نقعد و نتكلم
88	ازيك يا كارمن يا حبيبتي
89	الحمدلله يا عمو
90	بصي يا كارمن في حاجه لازم تعرفيه علشان تاخدي راحتك في البيت.
4	امممم كارمن هانم بنفسه
5	هتسكت ولا اقفل
6	هسكت
7	شكرا على المذكرات إلى بعتهم.
8	المذكرات بس؟ مفيش شكرا على وجودك في حياتي
9	اممم بتعمل اي
11	كنت بغير هدومي، غمز و كمل، عبال ما تغيريلي انتي
12	سافل اقسم بالله
14	يلا يا شهاب الغدا اتحط
15	طاب سلام علشان ست الكل بتنده عليا
16	سلمليلي عليها
17	يوصل يا مراتي، شهاب نزل و باس ايد امه
18	تسلم ايدك يا ست الكل.
19	ربنا يخليك ليا يا حبيبي
22	كل يا حبيبي
24	مش جعان يا ماما، و قام مشي
26	مش هي دي إلى كنت بتنفضله
27	يوووه كنت اعمه يا شهاب
28	انت عايز اي يا سليم
29	عايز سلسبيل يا شهاب عايزها ولا هخطفا
31	انت لازم تحط النقط على الحروف يا سليم.
32	ازاي
34	شوف انت ازي، شهاب دخل و سليم خد عربيته و فضل يلف بيها
39	انت اي جبله مبتحسيش انا بقيت انسان تاني علشان
40	ااه جبله
42	اسمع انا خلاص تعبت دا هيبقا اخر، سكت شويه و كمل، انت عايزاني يا سلسبيل، لو كان جوابك اه فرحنا هيبقا مع شهاب لو كان لا، غمض عنيه انا هسافر و مش هرجع تاني و انتي تقدري تشوفي حياتك
3	ابوك دا يا شهاب عليه تحكمات رهيبه ليه يعنى نجيب الدهب من الصعيد ماله القاهره
4	معلش علشان اخوي و ابن عمي و ستي مصره كل حاجه نعمله سوى
5	طاب معلش وقف هنا
6	محتاج حاجه انزل اجبهالك
7	لا هنزل انا علشان هروح الحمام
8	هاجي معاك
9	عايزه حاجه يا كارمن
10	لا يا بابا
13	شهاب
14	بقا اقولك غيري الفستان تقليلي لا مش هغير
15	ما انا غيرته يا شهاب
16	بعد ما طلعتي عيني
17	خلاص يا شهاب بابا جاي
18	ما إلى يجي يجي انت مراتي
20	يا شهاب ونبي ابعد
22	ما تيجي يا كارمن تقعد جنب امك و انا اقعد من قدام
24	لا هي مرتاحه كدا
25	اه اه.
27	اي الحلاوه دي امال تقلنين ليه من لاول
28	انا وافقة علشان مرات عمي بس
30	مش مهم المهم انك وفقتي
33	حلو دي يا مراد
34	وريني كدا يا حبيبتي
36	تحفة يا روحي.
38	اي رايك في دا
39	مش حلو انا عجبني دا
40	إلى انتي عايزه يا روحي
42	خلاص هاخد إلى قلت عليه في لاول
43	شهاب
45	عيون شهاب
46	شيل ايدك من على ضهري
47	لا و اختاري و انتي ساكته كلهم بيبصولنا
49	لفيني دا كدا.
51	ضيفو على الحساب
54	شفت حلو ازي يا عبدالرحمن
56	ميغلاش عليك يا روحي
58	مش عجباكي حاجه
59	انت لسه جيبلي سلسله امبارح على فكره
60	و لو جبتلك دهب الدنيا كله ميغلاش عليك
63	هيبقا جامد عليكي يا ماما، مسك ايدها و لبسهولها وباسها
64	ربنا يحفظك ياابني
66	شهاب ولله كدا ما ينفع
67	ممتلكاتي و انا حر فيها
69	بعد اذنكم هروح الحمام.
