line	text
48	بصي يا حبيبتي عمره ما هيبطل كدا، مش هيبطل غير لما ياخد قلم جامد و مش يمكن لما يتجوز ربنا يهديه
50	هه. لما يتجوز بقا.
52	وحشتني، ادهم شدد على حضنه
53	و انتي اكتر يا روحي
55	شهاب
57	ماله يا حبيبتي ما هو في شقته
58	تفتكر هيعمل زي زمان و يقعد بلايام فيها.
59	سعتين و هتلاقيه هنا دلوقتي
61	تعالي بقا.
65	انا مش عارف إلى زي دي يمسكوه تلفون و تعمل وتس فيس ليه معدن عليه تلفون بزراير علشان لو اتاخرت في الدرس بس، كمل تقليب لقي ليها فديو هي و صحباته بيضحكو و يهزرو
66	طاب اقوم ارحله و اكسر راسها ولا اعمل اي
68	لا دا كدا كتير بقا.
2	احم طبعا زي ما انت عارف جييني نطلب ايد كارمن لشهاب ابني، و احنا موافقين على أي شروط ان شاءلله
3	والله انا معنديش اي شروط، انا بشتري راجل و هو الحمدلله عنده شغله و كمان شقته، احم صحيح انت هتعيش في شقتك ولا في بيت العيله
4	إلى هي عايزه ان شاءلله يا عمي
5	طاب تمام على بركة الله
7	ان شاءلله يا عمي هي تقضي ايام الدراسه بتاعته في الصعيد و الأجازه هجيبها هنا، كدا كدا معرض ابوي محتاح حد فيه
9	ان شاءلله
10	آسر انا لما طلبت كارمن معنها ان شهاب بقا ابنك و كارمن بنتي في الوقت إلى تحس فيه كارمن وحشتك تقول و هو هيجبهالك
11	احم. طاب انا عايز اكتب الكتاب بالمره
12	لا كتب كتاب اي احنا متفقناش على كدا.
13	معلش يا عمي علشان ابقا على راحتي و خصوصا اني احتمال اطول شويه لان ستي مصره كلنا نتحوز في ليله وحده
15	خلاص يا آسر متقفلهاش
16	خلاص ماشي
17	المأذون جاي في الطريق
20	الف مبروك يا حبيبتي
21	الله يبارك فيكي يا طنط.
25	طاب مفيش امل برضو
27	بعد اذنك يا سليم عايزه اخلص
28	طاب ولله اسف و حقك عليا
29	سليم هو الكلام إلى قلتله كان بجد انك بتتسلا بيا
30	انتي عبيطه يا بت انت بت عمي هتسلا ببت عمي
31	امال قلتلي كدا ليه
33	كنت عايز ابعدك عني، كنت حاسس بذنب و انا شايف كل الحب دا منك و سيبه كدا
35	انت عارف كلامك دا دبحني ازي قعت كام يوم حاسه بقلبي مشروخ انا بكرهك
37	حقك عليا، حمار انا عارف
41	هديتي
43	طاب سماح ولا اي
45	لا.
46	الفستان هياخد منك حته
48	بجد عجبك
49	قمر اقسم بالله و بعدين شهاب الخولي مش هيختار اي وحده علشان تبقا مراته برضو
51	مغرور
53	طاب بمناسبة ابوكي إلى طلع عيني عبال ما كتبنا الكتاب انا عايز بوسه
54	شهاب
55	لا ما هو انا مقعدتش 35سنه مصبر نفسي و يوم ما ربنا يهونها تقوليلي شهاب.
56	شهاب هو انت بجد محبتش قبل كدا
58	طول عمري عيني ما اترفعتش على بت و كانت نيتي وحشه او ابصله بصه مترضيش ربنا اشوفه، انا محوش حبي كله و قلت تلقائين هيطلع للي هحس نفسي مشدود ليها و إلى كل حاجه فيا عايزها، سند راسه على راسها و همس، و انا عايزك انت يا كارمن
61	شهاب.
63	روحي با كارمن امك عايزاكي
65	طلعت مش سهل يا شهاب
66	تربيتك انت و اخواتك يا باشا
67	مكنش ينفع إلى تعمله دا احنا مكناش متفقين على كتب الكتاب
69	حقك عليا يا حج انا أسف
70	طاب يلا يا خوي
73	وحشتيني
74	محتاج حاجه.
75	اه محتاجك
77	خلاص يا عم الحبيب
79	اي ياض موضوع انت و اختي دا
80	عايز اتنيل على عيني اتجوزها بس شكلي هبور جنبيها
81	انا اصلا مش هجوزهالك، سليم: هي ترضا بس و بعدين نشوف الحوار دا.
2	حطيها هنا، كارمن حطتها و كانت عايزه تقعد و لما ملقيش غيره بس في المكان كانت لسه هتمشي بس لما لقيت جوري جات و وراها سليم و سلسبيل و لسه بيتخانقو
4	تعالي يا جوري
6	نعم يا ابيه
8	عامله ايه
9	الحمدلله بخير
10	عامله اي في دروسك
11	زي الفل
13	اممم المس اتصلت بيا و قلتلي السبوع إلى فات محضرتيش حصت الكمياء.
14	ان. انا يعنى
15	جوري الحقيقه
16	مراد خدني و اتفسحنا
18	يادي زفت مرد إلى هيضيعا مستقبلنا، كل دا و كارمن قعده بتبص بستغراب ازي مدخل في حياته كدا كل دا من حق ابوها بس
20	طاب ينفع يا حبيبتي تسيبي درسك علشان تخرجي معا مراد
21	ولله قلتله كدا بس هو أصر
22	ماشي انا هتكلم معاها.
23	كارمن، كارمن لفة ورها تشوف مين إلى بينده عليها و كان ابوها و امه، كارمن اتصدمة و قامت تجري بفرحه و حضنتة اسر
24	بابا
25	حبيبتي بابا
28	اسر اي المفاجئ الحلوه دي
30	حسيت ان ست كارمن زعلانه مهنش عليا وجتلها
32	اي يا كارمن هي امك موحشتكيش
34	برضو دا انت الغاليه يا ماما.
35	عامله اي يا حبيبتي
36	كويس يا ماما
38	ازيك يا باشمهندس اسر
39	الحمدلله انت اخبارك ايه
40	الحمدلله، قربة من دليا خدتها بالحضن
41	عامله اي يا داليا
42	الحمدلله بخير. بس اي مزعلين البت ليه
43	كارمن ازي مين قال انها زعلانه
44	لا لا مفيش يا طنط انا كنت تعبانه شويه بس
45	اسر هنا
46	اه لسه و اصل من شويه اسر يعرف العيله كله لانه كان بيزورهم علطول.
48	ازيك يا عمي اسر
49	ازيك يا شهاب ماشاء لله عليك بقيت راجل، عايزين نفرح بيك و قريب نجبلك العروسه
51	ولله احنا لسه فيها يا عمو اسر شوفيلي انت عروسه و انا جاهز
53	اي هنفضل وقفين كدا كتير ادخلي العشاء جاهز
54	فين بس عم عباس اسلم عليه لاول
55	تعاله معاي، آيه خدي كارمن و امه.
57	لام وتكه عن بتها اقسم بالله
59	يخربيتك يا شيخه
61	خدي هنا.
63	ان شاءلله انت مش هتقعدلك اقل من شهر هنا يا اسر
64	لا شهر اي هما يا دوب 15يوم علشان كارمن تبقا كملت شهر في كليتها و اقدر احولها
65	ليه ما هي تكمل ال 4سنين هنا
66	معلش مش هبقا مطمن عليها
67	إلى تشوفه بس كل اجازه تنزلو
68	ان شاءلله
70	رايح فين يا شهاب.
71	مكالمه مهم يا بابا هخلصها ورجع
72	ماشي
74	بتكلمي مين
76	دا انا يا شهاب
78	و انت تكلمه ليه يا بيه
79	شهاب ما انت عارف إلى فيها.
80	لا يا زفت مش عارفه و مترنش عليها تاني، علشان انت شكلك ناو تضيع مستقبله
81	هو انت عرفة
82	ايوه عرفة. اتنهد و كمل، مراد دا مستقبله هي لسه صغره تخلص بس السنه دي و انا هسلمهالك بأيدي
83	حاضر
84	تمام سلام هرن عليك اخر السهره
85	ماشي يا باشا. شهاب قفل و عطا التلفون لي جوري
86	ادخلي يلا.
89	اكيد زمانه نزلة
93	ش. شهاب ووو.
3	بتعيطي ليه طيب
4	انا كنت مكسوفه اوي و انا قاعده تحت و مش عارفه اخد راحتي و. و انت...
6	خلاص خلاص اهدي
7	ا. انت
8	متزعليش مش هعمل كدا تاني
12	في حاجه يا جوري
14	عمي آسر بيقول لكارمن يلا
15	قوليلو كارمن نامت و شهاب بكره هيخدها و جبلها الدهب إلى عايزه
16	كدا الصايغ هيمشي
18	دي اوضتي على فكره يا ابيه.
19	لا يا بابا ما انتي اليله دي هتنمي مع سليبيل او ابوكي و امك شفيلك حته، وقفل الباب اتجه لسرير ونام جنب كارمن وخدها في حضنه و هو بيتامل فيها
22	فين كارمن
23	نامت فوق و شهاب بيقول بكره هيخدها و يشترو الدهب لنفسهم
24	ليه كان نفسي يتصورو كلهم بدهب
25	معلش يا ماما يوم الحنه نعملكك إلى انتي عايزه
26	حم خلاص كدا كل واحد لقي نصه التاني وعايزين نحدد معد للفرح.
27	لما جوري تخلص امتحانات
28	فضلي امتحانين و اخلص امتحانات الترم بتاعتي
29	السبوع الجاي
30	خلاص السبوع الجاي يناسبك يا آسر
31	إلى تشوفه يا عمي
32	على بركة الله اطلو ارتاحو دلوقتي، واه صحيح الشباب يطلعو على شقتهم السبوع دا
33	ايه ليه يا جدي وبعدين اشمعنا شهاب
34	شهاب نام اول ما يصحا هيحصلكم
35	يلا يا مراد إلى يقوله جدك يتنفذ
36	طاب يا جدي.
37	مفيش كلام.
44	صباح الخير
45	ازي. انت هنا ازي و انا و انت
46	هو انا خاطفك انتي مراتي يا بابا
47	لا مش مراتك
48	نعم؟!
49	ايوه لسه متجوزناش.
50	يا حبيبتي ما احنا كتبنا الكتاب يعنى في حكم متجوزين
52	بابا عارف
54	لا كلهم فيهمين انك نايمه هنا لوحدك
56	طاب ابعد
58	لا.
1	انا مش عارفه ابوكي قلك و لا لا بس انا و اسر اخوات في الرضاعه يعنى انتي زي بنتي (هي هتبقا زي بنته ولا لا يا جماعه علشان انا معرفش)
3	ما انا عارفه يا عمو بس انا فكرتك حد تاني
4	ماشي يا حبيبتي انت احسن دلوقتي
5	ايوه يا عمو
8	تلفونك. نستيه في العربيه.
10	بابا اكيد رن عليا، هنا تلفون ادهم رن طلعه و بتسم
11	دا أسر. فتح التلفون و تكلم بحب
12	اي يا عم محدش بقي بسمع صوتك
13	معلش والله انت عارف الورشه و المعرض بتاعك، المهم أنت اخبارك ايه
14	الحمدلله بخير. مش ناوي تيجي
15	ان شاءلله لله قريب. امال فين كارمن من امبارح ارن عليها
17	خد اهي معاك، كارمن خدته بلهفه و محستش بنفسها و هي بتعيط
18	بابا وحشتني اوي.
19	انت كويسه يا روحي، كل دا و شهاب واقف بيبصلها بضيق و شايف كل دا دلع
20	مفيش يا بابا تعبانه شويه
21	ازي يعنى تعبانه انا هكلم ادهم اخليه ياخدك و تروحي عند دكتور ولا اجيلك
22	دا هو دور برد يا بابا
23	يا حبيبتي اتغطي كويس و كلي و اي حاجه عايزه قولي ل ادهم و هو مش هيتاخر
24	حاضر يا بابا، هي ماما فين عايزه اسلم عليها.
25	انا في الشغل دلوقتي و هي في البيت امبارح كانت هتموت من القلق عليكي. تلفونك مقفول ليه
26	الفون فصل شحن و النور كان قاطع
27	طاب يا حبيبتي خدي بالك من نفسك و اول متفتحي فونك رني على مامتك
28	حاضر
29	اديني بقا عمك ادهم
34	عامله اي يا ستي.
35	كنت بتفكر في اي
36	مفيش حاجه سرحت شويه
38	دا لمون مغلي مع نعناع اشربها كلها علشان البرد ماشي
39	حاضر يا ستي، احم طاب بقولك عملتي ل كارمن هي كمان تعبانه
40	ايوه عملت لكارمن بس لسه ما ودتهلهاش و سلسبيل و مرد
42	طاب اديها دا يا ستي مع المون
43	حاضر يا حبيبي اشرب دي انت و ارتاح.
45	هااا بقا احكيلي كل إلى حصل مكي انت و شهاب
47	ايوه. علشان شهاب مقلش حاجه
48	يا طنط ولله ما حصل حاجه
50	الواد دا طول عمره فقر نفسنا نفرح بحد من العيال و بعدين كلهم بينين، جوري ل مراد، و سلسبيل ل سليم، كارمن و هي ماسكه المج بين اديها
51	ربنا يرزقه ببنت الحلال
53	يارب و يرزقك با ابن الحلال، كملت بخبث و هي بتمد ايده بشريط البرشام، طاب شهاب بعتلك دا
55	ماشي
56	طاب يا حبيبتي هنسيبك ترتاحي.
59	طنط حور جعانه
60	اقعدي يا حبيبتي و هحطلك لاكل انت متغدتيش ولا انت ولا شهاب، كارمن قعدت و حور حطت لاكل قدام كارمن
62	مرات عمي جعان.
63	تعاله يا حبيبي، لاكل جاهزه اهو، شهاب قرب و قعد قصاد كارمن كارمن اتوترت بس الجوع اتغلب عليها و بدأت تاكل و شهاب كل بهدوء و هو مركز معاها اوي
65	حور فين الجلبيه السوده إلى جبتها من اسبوع
66	منشوره على الحبل
67	طاب تعالي هتهالي
68	حاضر
70	احسن دلوقتي
72	احم اه الحمدلله
73	طاب براحه هتزوري.
75	شبعت
77	اكملي اكلك، انا شبعت
79	بت ولله اضربك
81	طاب مد ايدك كدا
83	ولله هزعلك لو متهدتيش
84	شهااااب الحقني
85	سيبها يا زفت
86	علشان الكبير بس
88	فين جوري
89	فوق
90	روح اندهالي.
92	خلي الزفته دي
93	طاب ولله ما انا طالعه طلامه انت إلى قلت
95	جاتك مصيبه و انت شبه حمدي المرغني
97	مين دي ياض إلى شبه حمدي خد هنا
100	طنط بعتتلك الشاي دا.
2	هو انت اشتغلت قهوجي ولا اي يا سليم
3	سليم قلي هعملك شاي على العضم مش هتشرب زيه تاني
4	طاب ركز يا خوي بدل ما يغلي منك و يكوب
5	اوعا يا شهاب علشان ولله ما طايق نفسي و الدخان دا عماني
6	اخلص يا زفت بقالي ساعه مستني الشاي بتاعك دا
10	مالك
11	مفيش يا ماما عايزه انام شويه
13	ممكن تنامي معاي انت و جوري
14	معلش مره تاني انا تعبانه
15	علشان خاطري.
16	ايوه بالله دي هتبقا سهره جامده
17	ماشي
19	طاب يلا علشان نسيب البنات ترتاح
22	مالك
24	ه، هو انا رخيصه يا كارمن راميه نفسي على سليم
26	لا يا سلسبيل انت بس بتعتبري سليم حاجه تخصك و بدافعي عنها ممكن تكون الطريقه غلط بس علشان انت وخده عليها و بحكم ابن عمك و كدا
28	حصل اي يا سلسبيل بينك و بين سليم
30	اعملي نفسك مش شيفاه و هو هيعرف بقيمتك سوى بيحبك او ليك اي اعتبار في حياته هيعرفه منه تبقي عملتي إلى عليكي و منه ربتيه
31	حاضر
32	يلا فكي كدا بس اصلا ابيه سليم ميستهلكيش
33	بنات فيلم يوچين و ربنزل هيجي كمان خمس دقايق تعالو نسمعه
34	ايوه انا بحب الفيلم دا اوي.
36	اهلا اهلا بالباشا إلى مقضيه صرمحه مع بنات الناس
38	مش فاهمه
40	بص يا شهاب كارمن بنت اغله صاحب عندي يعنى زي بنتي
42	و بعدين
43	بعدين انا مش برضا بلحرام يا شهاب و حضرتك مقضيها بوس مره في الشقه عندك و مره في العربيه و المطبخ
45	طاب انا عايز ابوس في الحلال يا باشا. شوفلي اقدر اشرب مع ابوها الشاي امتا
47	شهاب انا مش بهزر
48	ولا انا
49	يعنى انت بتحب كارمن
50	اممم مش بظبط بس مش ضروري اوي الحب يعنى كفايه اني عايزها
51	شهاااااب كارمن مش لعبه.
52	و انا مقلتش بلعب انا عايزها و دخلت مزاجي ممكن اكون موصلتش لمرحلة الحب بس انا عايز اوصلها بعد جوازنا و هي حلالي وبعدين مش كل الجواز بيتبني على حب يعنى في ناس بتتجوز علشان دي بنت ناس و مناسبه
53	تمام هشوف معاد مع ابوها برضو بس لأصول لما ترجع هي و ابوها تروح تتطلبها
54	عارف
56	هو مفيش ولا مرا عطيت معا امي قبل جوازكم.
57	عطيت!، امك اول ما تمت ال 18انا كنت كاتب عليها
58	جامد يا باشا.
60	ببفرجو على اي
62	الواد الحلو و البت ام شعر طويل
63	مراد لو سمعك هيعقلك...
64	خياااااانه بتعملو اي
65	بنتفرج على التلفزيون.
66	اتفرج معاكم، سليم ملقيش مكان يقعد قعد على لارض، كارمن كل شويه تخطف نظرا على شهاب إلى طول القعده بيبصلها، شويه و شهاب نفخ بملل، ضرب سليم على قفاه
67	ما تقوم تشفلنا امك صاحيه تعملي اكل، انا جعت
69	من شويه خبط عليهم و الحج قال نايمه و مش هيصحيها
70	طاب قوم اعمل انت مكرونه
71	معرفش
74	احم انا كمان جعانه، هقوم اعمل و اعملك معاي
77	خمس دقايق و المكرونه تستوي
78	اممم براحتها
79	هي اي.
3	هااا وبعدين
5	بعدين. كملت بتوتر. الاقي فين مكوا علشان اكوهالك
6	في اوضتي
8	في وحده في اوضة طنط آيه هكويها فيها
9	ماشي بسرعه بس
13	شكل الزرعه و الخضار هنا تحفه
14	الله الله اي الحلاوه دي يا كارمن
16	حلوه بجد يا عمو
17	قمر يا حبيبتي
19	سايبه المذاكره بتاعتك و دايره تتمرقعي يا هانم
20	زهقت يا بابا
21	نص ساعه و تروحي.
22	حاضر، جوري قربت من سلسبيل و همستلها
23	روحي يلا قليله
24	متروحي انت انا هيشخط فيا
25	بالله عليكي بالله
26	ماشي ياختي
28	اي يا باشا
29	عبده موته قاعد جنبي
30	طاب معلش عبده موته هيتعبك تقوم تهز شجرة السفاندي دي
31	لا و قومي من جنبي، كمل و هو بيشاور على سليم إلى وشه في التلفون و كل شويه يبص لسلسبيل، خلي سليم
32	اي دا محدش قلك اني مخصماه.
33	مخصماه ليه هو زعلك في حاجه و انا اقوم اكسر عضمه
34	لا انا بخاصم الناس بمزاجي
35	طاب و مش خلاص بقالك يومين مخصماني كفايه
36	بتكلم مين
39	ما تخرج معاهم بدل ما انت كئيب يلا كدا.
40	يلا يا سلسبيل علشان الرجاله إلى بيشتغلو هيجو يتغدوا معانا
41	يلا يا ابيه و نبي
43	طاب يا غبيه مش تقولي جوري إلى عايزه و انا كنت هقوم اجري
44	طاب يلا يا خوي
48	الجو هنا حلو اوي
49	طاب اي رايك تعيشي هنا علطول
50	هننقل هنا بجد.
51	اممم لا، بس عمك ادهم طالب ايدك لشهاب و مستني مني كلمه علشان نرجع القاهره و يطلبك رسمي
53	شهاب مفيش منه و انا لو لفية الدنيا كله مش هلاقي احسن منه يحافظ عليكي كفايه انك هتبقي مع صاحب عمري دا اكبر اماني ليكي بنسبه ليا. اي رايك بقا
54	إلى تشوفه يا بابا
55	يبقا على بركة لله بكره نرجع القاهره.
59	في حاجه
60	عريس جاي يتقدم لسلسبيل
61	نعم!
62	في حاجه؟
64	لا مفيش. ادي قعده لما نشوف الباشا
67	احم. و انت شغال اي يا ابني بقا
68	مع ابوي في لارض يا عمي.
69	و شفتها فين بقا ان شاءلله
70	من يومين كانت مع حضرتك راحين مشور تقريبا
71	هتعيش في بيت لوحدك ولا مع اهلك
74	و من امتى الهانم بتحط مكياج
75	و انت مالك
76	ولله لا اطربقه عليكي و عليه علشان ترتاح و شوفي
77	و انت بقا شهاتك اي يا سامح
78	دبلوم.
79	و انا بنت عمي مخلصه تعليم عالي
80	دا معهد يا باشا
81	ولله المعهد دا مخليها في البطاقه باشمهندسه. لو اشتغلت بيه هطلع في الشهر للواحد اكتر من إلى بتطلعه انت في سنه. و من لأخر بت عمي مينسبهاش واحد اقل منها في التعليم
83	انا اسف يا ابني. محصلش نصيب
86	حد سمحلك تتكلم ولا انت خلاص كبرت على ابوك و عمامك بترفض كمان
87	ايوه لما يبقا مش مناسب من حقي ارفض
88	و انت بقا إلى مناسب يا شبح
89	ايوه بحبها و عايز اتجوزها
91	لما تبقا راجل يروح امك و تبطل صرمحتك ور البنات ابنا قول عايز اتجوز ولي رفضته دلوقتي ارجل منك
92	هتجوزها يا بابا و هتشوف.
2	وحشاني
4	هتقعد كام يوم ان شاءلله
5	معرفش يختي اجازه ممدوده وبعدين مالك بتبعدي كدا
6	اصل. اصل شهاب قلي مسمحلقش تقرب مني. كملت بسرعه. انا والله عندي عادي انت و سليم و شهاب اخواتي ولله بس هو مش عارفه قلي كدا ليه انت اخوي
8	انزلي تحت يا جوري علشان انت قفلتيني
9	انا عملت اي.
10	مفيش يا جوري انزلي نامي الوقت اتأخر
11	ماشي تصبح على خير
13	اممم ادهم سيبني انام
14	يا حبيبتي انا زهقان اصحي اقعدي معايا
16	ايوه يا ادهم
18	وحشتيني
20	مصحيني علشان تقولي كدا
21	اعملك اي ما انت إلى طول اليوم مشغوله مع البيت و العيال و بتيجي تترمي اخر اليوم مفيش وقت ليا خالص
23	معلش حقك عليا، آيه قربت منه بدلع و هي بتحرك ايده على صدره إلى مكتوب عليه اسمها.
24	بحب اسمي هنا اوي
26	اه بدليل انك كل ما نبقى سوا تسيبي كل حاجه و تقعدي تبوسي فيه
27	حصل، رفعت حاجبه، خد التقيله بقا، جابت شعرها على جنب و ظهر اسمه إلى كتبته على رقبته
30	انا بحبك اوي يا ادهم.
32	عبدالرحمن. عبدالرحمن
34	الواحد كل ما بيصحا على المنظر دا يفضل يحمد ربنا اليوم كله
36	و انا بحمد ربنا في كل وقت علشان رزقني بيك و جوري
39	جوري صحيت
41	ايوه صحيت من بدري صلت الفجر و طلعت تذاكر
43	ماشي يا حبيبتي.
46	متنسيش يا ست الكل ماشي
48	حاضر. السفره جهزت و اتجمع عليها الرجال
50	معلش يا كارمن نسيت تلفوني فوق اطلعي هتهولي علشان عايزه في حاجه مهمه
51	حاضر يا طنط
54	في حاجه
56	احم آسر انا هدخل دغري شهاب طلب ايد كارمن لجواز انا عارف ان ألاصول لما ترجع بيتكم نطلبها بس قلت بدل ما تقعد تحول في الورق من هنا القاهر ويمكن يكون في قبول ترجع الورق تاني
59	مالك خايفه
61	ا. انا مش.
1	انت بجد بتغير من سليم يا ادهم
2	ما هو إلى عيل مش مظبوط في حد يقول لامه متيجي ي آبله ارقصك على الطبله
3	دا عيل يا ادهم
5	دا بقي شحط في تالته ثانوي، اضحكي اضحكي
6	تربيتك بقا
