line	text
1	بتعملي اي، قالها شهاب لكارمن لما وصل البيت كانت الساعه 2 و لقي كارمن في المطبخ، كارمن او ما سمعت صوته القمه و قفة في زوره بلعته بصعوبه و ردت
2	ا. انا كنت جعانه و نزلة اكل
4	كدا!، كارمن بصت لنفسها، كانت لابسه بجامه و الطرحه على راسها
5	ليه مالي...
6	افرض حد من اخواتي الشباب نزل ياخد حاجه و شافك. و اه صحيح امسحي صورك إلى على الفيس.
7	امسح صوري إلى على الفيس! دا ليه ان شاءلله
8	بقولك اي مش ناقصه صداع هي، قلت امسحيهم امسحيهم
10	شهاب! انت مش كنت في شقتك يا ابني
12	اطلعي انتي. بص ل مراد و كمل. تلفوني كان فاصل شحن و الشاحن في لاوضه هنا ف جيت
13	طاب روح نام عندنا شغل بكره.
15	عايز القميص لاسود بتاعك يا باشا
16	مزه جديده
17	ايوه بس اي تقفيل اوربي يا جدع
18	ماشي يا خوي بس خف حط مش هحوش ابوك عنك تاني
19	حاضر فين القميص
20	خده في الدولاب
22	تسلم ياريس، اه صحيح بابا بيقولك يلا علشان توصل كارمن الكليه
23	يادي النيله علينا و على كارمن.
24	يعم حد لاقي، كمل و هو بيعض على شف تها، والبت اي بطايه
26	اتلم، دي بذات مش هينفع يا سليم
27	يعم هو انا جيت جنبها
29	طاب يلا يخوي علشان نفطر.
31	صباح الخير يا ماما
32	صباح النور يقلب ماما
33	امال فين بابا
34	في المكتب قاعد مع جدك
35	ماشي يا ست الكل جهزيلي الفطار
36	حاضر يا حبيبي
38	صباح الخير يا بابا، ميل باس ايد عباس، صباح الخير يا جدي
39	صباح الخير يا ابني
40	في حاجه يا شهاب
41	لا كنت جاي اصبح عليك عادي
42	عملت اي في نقلت الخضار
43	وصلت و استلمت الفلوس.
44	ولارض إلى عايزينه ولاد حسان
45	اهم دول بقا إلى عايزين قرصة ودن
46	بلاش يا ابني و ندخل في مشاكل و حورات
47	حورات اي يا جدي دول جاين يقولو لينا في ارضكم. انهاره قالو ارض بكره يقولو حريم
48	اعمل إلى يريحك بس بحزر يا شهاب انا مش عايز اخسر حد منكم، و ولد الحساينه دول خبثه و معندهم ريحت الرجوله
49	حاضر يا جدي
50	طاب يلا علشان توصل كارمن.
51	انا مش عارفه كارمن دي ما يوصله اي حد
52	يا خفيف الكارنيه بتاعها لسه مطلعش و انت إلى قيل بلسانك امبارح ان العميد عارفك و هتعرف تدخل عادي
53	ماشي يا بابا، فين هي الهانم التانيه
54	اسلوبك يا زفت
56	كارمن هانم فين
57	رنيت عليها دلوقتي قالة نازله، روح افطر عبال ما تيجي
59	مش طافح. كمل بصوت عالي، و اه صحيح خليها تمسح صوره إلى منزله على الفس علشان انا خلقي ضيق و هزعلها.
61	مش هتكبري يا حور كام مره اقولك متطليش و انا واقف مع حد
62	يا حبيبي هو مشي
63	طيب بس متعمليش كدا تاني
64	حاضر
65	مراد مشي ولا لسه
67	هو انا اقدر امشي من غير ما اسلم عليك انت وست الكل
68	ربنا يحفظك.
69	ترجع بسلامه يا حبيبي، جات سلسبيل عليهم و هي بتجري
70	كدا عاايز تمشي من غير متسلم عليا
72	ما انتي كنتي نايمه مهنش عليا اصحيكي
73	ولله ازعل منك
74	هو انا اقدر على زعلك.
76	تعالي شايفك
78	على طول كفشني كدا
80	اعمل اي لقلبي إلى بينبضلك علطول
82	بحبك على فكره...
83	و انا بموت فيكي.
2	بابا
4	حقا عليا
6	خلاص يا حج هو اتعلم الدرس
7	ايوه ولله و هشتغل زي ما انت عايز و هبطل اكلم بنات حتى خد الفون اهو.
8	ماشي مسامحك، بس لو عرفة انك رجعت تعط تاني هزعلك
9	حاضر ولله، احم طاب بخوص طلب الجواز من سلسبيل.
10	ولله لو اتعدلة و هي موافقه معنديش مانع غير كدا تبقا بتحلم
11	حاضر ولله هتعدل
12	هنشوف
13	اخبارك اي يا عمي عبده
14	بخير الحمدلله
15	احم طاب بما ان يعنى شهاب و سليم خلاص اختارو إلى عايزينهم، فانا طالب ايد جوري
16	جوري مين؟ بنتي
17	ايوه يا عمي. هستناها لما تخلص تعليمه بس على لاقل يبقا بينا كلام
18	ازي دي بتعتبرك اخوها.
19	لا انا مش اخوها و طالب ايدها لجواز
20	اشوفها و اقولك
21	ان شاءلله توافق.
24	وحشتيني. كارمن سكتت
25	اممم طاب عامله اي
26	الحمدلله
27	بقالي اسبوع اتحايل على الحج علشان نجيلكم يقلي برحتي بيعاند معاي، عبال منعمل الفرح و انتي تيجي هنا هنبقا دخلين على امتحاناتك، هتمتحني امتا؟
28	امتحاناتي فضلها شهر.
29	الناس تقول عليا اي و انا تاني يوم مودي مراتي الكليه، طاب بعيد عن الناس انا محتجلي شهر مش هنزل فيه من فوق بعد جوازنا و...
30	هتسكت ولا اقفل
31	خلاص ماشي
32	شهاب لأكل جاهز
33	جاي يا ست الكل، كمل لكارمن
34	سلام يا، سكت شويه و كمل ببتسامه، مراتي، وقفل
36	كل يا حبيبي كل شكلك هفتان و خاسس النص، كملت بحزن، وبعدين كدا تسافر من غير ما تقلي.
38	متزعليش يا ست الكل.
39	آيه
40	ايوه
41	نولينى محشي من إلى جنبك
44	اسف
45	على اي
46	و حشتيني و وحشني كل حاجه فيك
47	طاب و بعدين
48	حقا على عارف اني غلطان و استاهل ضرب الجزم
50	بعد اذنك عايزه اطلع.
52	هتغير هتغير ولله علشانك يا سلسبيل.
56	جوري انتي لسه صغيره خدي القرار على مهلك
58	يستنا لحد ما اخلص السنه دي و اول سنه كليه
59	هو قال كدا برضو
60	إلى تشوفه يا بابا
63	خلاص ماشي.
65	متبصليش كدا، انا بحبه و من زمان بس الوش الكيوت لزوم الشغل وكدا
66	ياما تحت السواهي دواهي، كملت وهي بتقلد جوري. ابيه ابيه
1	هي اي
2	المكرونه
4	اه اه زمانه استوت، هعبي لأطبقا و اطلعهم برا
5	اقسم بالله محد يضوقها يادوب يكفوني، عبي بس انت و هتيلي انا
6	حرام عليك و بعدين في كتير هيكفي و يزيد
7	هاكل ولي يزيد يكلوه هما، علشان محدش كان راضي يقوم يعمل
9	و انت فين طبقك
10	لا انا هاكل برا معاهم.
11	احم لا اغرفي طبق و تعالي كلي علشان عايزك في موضوع، كارمن غرفت لنفسها طبق بستغراب و قعدت
12	احم لو جالك عريس الفترة دي ترفضيه
13	امم لا لو هو كويس مش هرفض
15	اكتر حاجه تتمنيها في إلى هتتجوزيه اي
16	يكون متفهم
17	اشمعنا
18	عارف لو هو متفهم و بيفهمني عمرنا ما هيكون في مشاكل بينا
19	طاب الشكل؟ الفلوس؟ الحب؟
20	بص الشكل و الفلوس مش بتفرق معاي اممم اما الحب فا انا شيله كل حبي للشخص إلى هتجوزه حاسه كدا اني هطلع كل حبي دا ليها بس، كارمن بقيت تاخد رحتها معاها في الكلام اكتر من ساعة مفسحها و خدها الملاهي
21	طاب لو عمي اسر قلك شهاب متقدملك؟!
23	انا هتجوزك مش هتقلك
24	ا. انا بس شنقت
26	طاب عايز الرد علس سؤالي بقا هتوافقي.
27	لله لله شهاب باشا في المطبخ مره وحده، قالها مراد بغمز إلى كان لسه دأخل
29	روحي نامي دلوقتي نتكلم بعدين
31	مش هو دا إلى حرام و عيب برضو يا كبير يا عاقل
33	لا اله لا لله مالكم و مال الحرام، وبعدين يا سيدي انا كنت بتكلم معها علشان عايز اطلبها من ابوها بس حضرتك بوشك إلى يكبه محفظات جيت.
34	طاب ولي يطلب حد يطلبه في المطبخ برضو ولا يبقا قريب منه كدا اممم عمي ادهم لو عرف هيزعل اوي
35	انت عارف كويس اني ما بتهددش يا مراد بس هجبهالك على بلاطه، عايز اي؟
36	حلو بحبك و انت لماح كدا، المهم عايز اقعد مع جوري ساعه كدا علشان وحشتني
37	و انت هتعمل اي معها في الساعه دي
38	إلى بيعملوه الناس لما تقعد مع ناس وحشوهم
39	ايوه يعنى هتعمل اي برضو.
40	احضن ابوس حاجات من إلى يحبه قلبك دي
42	إلى يوحشه حد بيبقا كفايه عليه انه بيسمع صوته و عيونه شيفاه مش ضروري خالص لأحصان و البوس
43	ما انت كنت هتعمل كدا من شويه ولا انت كنت مقرب منها اوي كدا ليه، كمل بسخريه، بترقيها
44	طاب اه كنت ببوسها و مفيش قعدان مع جوري لوحدكم
46	شهاب ولله انا جاي و مش طايق نفسي اجازتي اسبوع وتخلص، شهاب صعب عليه شكله
47	خلاص ماشي نصايه. كمل و هو بيحط ايده على كتف مراد، انت عارف ان عمي عبدالرحمن سلملي كل مسؤليتها و انا بعتبرها اختي
48	و هي قبل ما تكون حبيبتي اختي
49	اطلع يلا من هنا
52	بشفا يا ابو ايهاب
54	تسلم ايدك
56	اليومين دول اول ما شهاب مسك الشغل و انت صحتك بقيت احسن الحمدلله
57	ربنا يخليه لابوه من صغره شايل هم كل حاجه
58	يارب يا حج يارب. بس هو مش ناوي يتجوز كل ما نكلمه في الموضوع يقعد يتهرب
59	لا ما هو شكله هيتجوز قريب ان شاءلله
60	كارمن.
62	سلسبيل
63	نعم
64	دي عامله فيها زعلانه
65	عايز اي
66	لا مش عايز حاجه تصبحي على خير
1	قوم خليني اخد المفارش اغسلهم
2	حبقت دلوقتي يعنى
3	ايوه و يلا عشان موقفه الغساله بسببك
4	امي هتغسلهم
6	ياخي قوم مش فالح غير ترجع وش الفجر
8	انتي عايزه اي مني يا بت ما تسبيني في حالي
10	سيبني، بقولك سيبني، سليم حطها على السرير و كتف اديها.
11	يا شيخا اقسم بالله انا لا طايقك و لا طايق لارض الابتمشي عليها
12	طايق سوزان كفايه عليك، سليم جاب قميص وربط بوقها بيه بعد و هو بينهج، لم كل الهدوء الوسخها وحطها عليها
13	خدي يا شيخها خدي يكش طفطسي و تموتي.
16	عارف اني جامد، كمل بخبث و هو بيحرك ايده على منخيره، بس انتي حالتك صعبه اوي، كارمن بصتلها و عيونه مليانه دموع، طلعت تجري على فوق علشان تستخبا من نظراته، رجع على صوت سليم إلى قعد جنبه.
17	اااااه
18	مالك يا حبيبي فيك حاجه
20	قلبي يا ماما تعبان اووي، مش انتي دكتوره متشفهولي ماله، كل ما بشوفك بيدق جامد
21	دا انا إلى هاجي ادق فيك جامد دلوقتي
22	سليم
23	احنا اسفين يا ريس، كارمن استغربة ازي بيخاف من اخوه اكتر من ابوه
24	طاب همشي انا علشان اتاخرت على الشغل
25	خد كارمن معاك الكليه علشان تقدم.
26	يخدها سليم او تروح مع اي السواق
27	شهاب
29	مستنيها برا
30	عمو انا ممكن اروح مع اي ح
31	قفلنا على كدا، خلصي اكلك و روحي شوفي كليتك
33	حاضر يا عمي.
35	تخلصي و ترني عليا، مفيش وقوف مع مستر ولا زميلك ولا اي صنف دكر فاهمه
36	حاضر
38	يلا يا حبيبتي شدي حيلك و ركزي عايز طب ماشي، و ان شاءلله ليكي عندي احله عربيه زي ما وعتك
39	حاضر
41	خدي مصروفك
42	بابا عطاني
43	انا مليش دعوه بمصروف بابا ماشي
44	حاضر.
45	يلا روحي هتااخر، جوري نزلة وخدت شنطتها و شورتله بايده قبل ما تمشي، مراد رجع راسها لورا و بتسم.
46	ظبطي حجابك و شيلي الزفت إلى انتي حطها دا
48	انا
49	امال امي
50	مش هشيله
52	هتشليه ولا اشيله انا و انتي ماشاء الله مبتخديش في ايدي خمس دقايق
53	قصدك ايه
54	عايزه تعرفي قصدي من عنيا.
1	مشاءالله
4	الحمدلله الذي بنعمته تتم الصالحات
6	مكنتش عارف انك هتبقي حلوه كدا، ياريتني ماقلت نعمل فرح، بقولك اي متيجي نطلع على بيتنا
7	شهاب
9	لينا بيت يلمنا، شهاب طلع رأسه من الشباك بتاع العربيه لما سمع صوت زمير وراها وكان مراد و جوري إلى لابسه الأبيض جنبه
10	انت إلى جبته لنفسك
17	وفي عين كل إلى شافكم و مصلاش على النبي
21	اي
23	اي
25	هقولك انا اي
26	شهاب لا
28	قومي غيري هدومك.
32	في حاجه يا اخ
34	الحمدلله برضو
36	الحمدلله شبعت
37	طاب يلا قومي غيري.
39	قومي غيري علشان ننزل و انا كمان هغير
41	الشاب نزلو كل حاجه جاهزه
42	ايوه كله تمام
43	ايهاب يروح يصحي نوسه و ادهم يصحي نسمه يلا
45	اطفي النور يا شهاب.
48	خالتي الحقي ابوي تعبان قوي
50	تعبان ماله
51	تعالي معاي هو في الحوش
52	خالتي وسه الحقي الحج وقع بطوله
54	يمري فين
55	في الحوش.
58	happy birthday
60	حرام عليك وقعت قلبي
62	تعالي بس دا الحج بقاله شهر يخطط لليوم دا
64	تعيش و تعمل يا حج
66	و تكونو انتو في حياتي يارب
67	لا كدا حضن جماعي
69	ربنا ما يحرمني منكم يا رجال الصعيد.
1	ش. شهاب، كارمن اتعدلة و شهاب سند على الرخام إلى وراها و حصرها
2	بتعملي اي
4	باكل
5	امممم. بصيلي و انت بتكلميني يا كارمن
8	كارمن.
11	كارمن
13	عايزه انام في حضنك يا بابا
14	تعالي ياروح بابا
17	غبي غبي اي إلى عملته دا
20	صباح الخير
22	يلا يا كارمن علشان هوصلك في طريقي
23	لا. ا. انا هروح مع بابا
24	لا يا حبيبتي روحي مع شهاب احسن لاني معرفش الطريق هنا و كدا كدا هو رايح
25	هستناكي في العربيه.
27	سليم
29	في اي
30	قومي يلا علشان عايزك تروح معاي مشوار
32	خدي ابوكي معاكي
34	ولله ان ما قمت دلوقتي لا انزل و اقول لعمي اني لقيت قزازة خمر. ه في اوضتك
35	غور. ي اجهزي و انا هغير و نازل
36	اوك بيبي
37	ربنا ياخد. ك من وشي يا بعيده.
40	احم، كنت عايز اقولك اني مقصدش إلى حصل امبارح
43	شهاب الحقني
44	انتي فين.
45	انا في، فجاء صرخت و التلفون اتقفل
49	الو ايوه يا محمد بقولك اي في كميرات مراقبه في كليه تجاره.
50	استناني في غرفة المراقبه بسرعه.
53	يلا
55	سلسبيل
57	انا مش خايف من بابا يا سلسبيل هو عارف انا بعمل اي كويس مفيش حاجه تخفا على ادهم الخولي و سيبني براحته فبلاش تهدديني بيه تاني، امم و على فكره انا جيت معاكي مش خوف من بابا لا بس بتسلا لوحد راميه نفسها عليه لي لا
59	يلا اركبي علشان اوصلك اصل عندي معاد مع مزه تاني
1	كارمن يا حبيبتي
2	يلهوي دا بابا، حولت تزق شهاب، يلا قوم استخبا بسرعه
4	وستخبا ليه هو انا بعمل حاجه غلط
5	شهاب انت قلتلي مش هتعمل كدا تاني
7	طيب بس مش هستخبا برضو، قومي افتحي الباب و اطلعي علطول و هو مش هيشوفني
8	طيب
10	صباح الخير يا بابا
12	صباح الفل عليك ياروح بابا، امبارح قلتي هروح الحمام ابعتلك بنت عبدالرحمن تقولي نامت
13	معلش يا بابا محستش بنفسي من تعب الطريق و سفر
14	ماشي يا حبيبتي
17	صباح الخير
18	صباح النور
20	امال فين سليم و مراد
21	كل واحد راح الشقه بتاعته لحد معاد الفرح
22	اي دا هو انتوا حدتوه
23	ايوه جدك حدد بعد اسبوع ان شاءلله.
24	اقسم بالله ملينا غير جدي حبيبي
26	اه ما هو جدك حبيبك كان بيدور عليك امبارح علشان تطلع معا اخوك و ابن عمك على شقتك
28	وانا اطلع على شقتي ليه؟! هما طلعو علشان إلى هيتجوزوهم معاهم في نفس البيت انما انا مراتي هتسافر اخر النهار
29	طاب يا خوي، شهاب قام و باس ايده
30	بس حاضر يا بابا ان شاءلله بعد ما اوصل عمي آسر القاهره هرجع على شقتي، شهاب سابهم و دخل المطبخ.
31	يلا يا كارمن
32	على فين
33	هتنقي يا حبيبتي شبكتك إلى مختارتهاش امبارح
34	ايوه صحيح.
35	حوش رجلك انا مش عارفه مرحتش شقتك ليه
36	هو انا جيت جنبك يا ابني، وبعدين مبحبش اقعد لنفسي
37	وربنا لانا قايم
40	اعملي افطر
44	سليم
46	ريحت شياط
48	ولع في البيت ولع في البيت
49	اعمل اي حاجه يخربيتك
52	الف هنا ياريس
54	تعاله تعاله هنطلب دليفري.
55	يلا يا برنسيسه
58	التفضل يا فندم
59	جهزت إلى قلتلك عليها، قالها شهاب بعد ما قعد و كارمن جنبه
60	ايوه، وبدأ يحط قدامه انوع مختلفه من الصيغه
61	اختاري يابرنسيسه
64	وريني ايدك كدا.
66	فنان اقسم بالله فنان
67	هخدو، كملت بحماس. اختار معاي الباقي
69	في حاجه تاني عايزها يا برنسيسه
70	لا
72	لو سمحت
74	اتفضل
78	اوعي تقلعيها.
79	حاضر
80	يلا علشان ابوكي عماله يرن.
84	ان شاءلله الدور الجاي لما اجي القاهره اخدك ونتي لابسه لأبيض
2	اقولك اي انت إلى غلطان، بعدين من امتى و انت عندك دم و بتزعل
3	يا شهاب انزل كدا القيهم بيقولولي جاي يخطبه
4	و بعدين
5	بعدين اي يا شهاب، سلسييل دي ليا
6	دا في عرفي مين ان شاءلله، ما البت طول عمره تجري وراك اشمعنا دلوقتي بقيت ليك.
7	من صغرانا و ستي نوسه و نسمه يقول كدا وبعدين من امتا و عندنا بنات بتطلع برا العيله ما طول عمره معروفه البت لأبن عمه
8	لا يا سليم مفيش حاجه اسمه البت لابن عمه طلامه مفيش حد من ولاد عمه مناسب تتجوز غيره
9	اعملك اكل معاي
10	ايوه اعمل بزياده علشان مراد كمان جاي.
12	عبال يارب ما تسافري بس و انتي رايحه بيت جوزك
16	هتبخجل، العربيه اتحركة و مشيو
18	هنروح نطلبها امتا بقا
19	نعم
20	لا يا حج متمعلش فيها تقيل. انا عايز اتجوز. اتجوز و اتقل براحتك
22	يارب صبرني
25	خلاص يا شهاب انا هسافر اكمل شغل بابا إلى في القاهره
27	انت كويس يا سليم
28	لا يا شهاب حاسس نفسي مليش لزمه. كل إلى عملته في دنيتي، طاب بنات الناس دي لو سلسبيل ولا جوري حد عمل فيهم كدا، انا بكرهني اوي يا شهاب
29	استهدا بالله كدا كويس انك عرفت غلطك قوم اتوضا و تعاله نصلي الجمعه.
31	ادخل
33	ابيه
35	يادي ابيه دي، كمل. نعم يا جوري
36	امممم كنت زهقانه قلت اجي اقعد معاك
37	مش خايفه من شهاب
39	ما انا عارفه انه مش هنا
40	اممم. طاب افتحي الدرج إلى جنبك كدا
42	لا. بجد. طاب احلف، ولله ما ما مصدقه، جوري جريت عليه و حضنته بفرحه
43	شكرا اوي يا مراد
45	بحبك يا جوري. بحبك و عايز اتجوزك.
2	انزلي، كمل و هو بيحرك ايده على راسه
3	لو امي او ابوي سئلو شهاب راح فين قوليلهم راح شقته التانيه
6	مساء الخير يا طنط
7	مساء الورد يا حبيبتي، امال فين شهاب
8	احم راح شقته، قربة منهة و هي بتبلل طرف شفيفها
9	طنط هو شهاب عنده شقه لنفسه، هنا ضحكت حور بخفه.
10	كل واحد من شباب العيله عنده شقه لنفسه شهاب و مراد حتا سليم
11	بيعملو فيها اي. احم يعني قصدي البيت كبير ليه يشترو شقق
12	قال اي يختي بياخد فيه رحتهم، قال يعني حد بيقدر يقول تلت التلاته كام هنا، هنا شمس خبطتها على دماغه بخفه
13	ركزي في إلى في ايدك، بصت لكارمن و اتكلمت بحنيه.
14	بصي يا حبيبتي هما بيحبو ياخدو رحتهم اصل احنا امهات رخمين شويه و بنفضل نسال مالهم علشان كدا هما، لما بيحب يهربو بيرحو شققهم
15	ااااه
16	اممم و انتي مهتمه ليه
17	احم عادي فضول، اه صحيح امال فين البنوته الحلوه إلى اسمه جوري
18	فوق مراد بيذاكرلها
19	طاب انا هطلع اغير هدومي و انزل علشان العشاء
20	ماشي يا حبيبتي روحي
22	وبس يا ستي هتطلع س=11. 2 فهمتي.
23	ايوه فهمته
24	عامله اي في باقي المواد
25	الحمدلله كويس
27	شدي حيلك يا جوريتي
28	حاضر والله
29	يلا ننزل هبعتلك ماما بلاكل بلاش تنزلي ذاكري شويه و نامي.
30	حاضر
33	ايوه يا موزتي. ااه، ماما معاكي اهي.
35	ابوك لو عرف اني بكلم البنات بتوعك دول هيعلقني
36	يعم تلاقيه كان خربه
37	فشر ابوك البنات كانت تتمنا نظره منه بس هو مكنش في باله، دا يوم ما وحده عرضة نفسها عليها خدني معاه المعرض وقالها اني مراته علشان يبعدها عنه
39	هييييح المعرض دا عليه شوية مزز. كمل و هو بيعض على باطن شفته، كله شهرين ولاجازه تيجي و نروح نطل عليه طله كل دا و سلسبيل واقفه تتابع بغل
41	اااااه يا يخربيت ابوكي يا شيخه مش تفتحي
42	ولله انا مفتحه الدور و الباقي على إلى اعما نظر و قلب.
45	إلى عملتيه دا بقصد صح
46	ايوه يا مرات عمي علشان ابنك السافل دا مش راضي يتلم كسرت الخط و حطيت التلفون في الغسالة قبل كدا و هو بيرجع يا جمع بنات تاني
