line	text
48	والله هو بخير وعاصم باشا قالى اوصل الورقه دى لشبل بيه وقالى انه منتظر من حضرته تلفون هيشرحله في كل حاجه بس قالى لو سألوك عن واحد اسمه مروان قلهم انه بخير ولما الانسه الى...
51	فاهم فاهم
54	وبعد مارجع من المستشفى للفندق مالقاش الموبايل بتاعه عشان كدا ماعرفش يتصل عليكم وبعد يومين ساب الفندق ودا الى اخرنى للوصول اليه فضلت ادور وعرفت انه ساكن مع شاب وبنت جبت العنوان ومنه وصلت لرقم الهاتف هو الى عندك في الورقه وكمان فيها كل المعلومات عن الشاب والبنت الى جالس معاهم.
57	الحمدلله ياعمى المصدر الى جايب المعلومات قال انه كويس وكمان ابتدا دراسته وبيحضر كل يوم.
58	الحمد لله اللهم لك الحمد
59	ماشى يا عاصم تسلم ياحبيب اخوك
60	انت تؤمر ياشبل احنا اخوات يلا في رعاية الله وربنا يطمنكم عليه
62	ماتجلجش عنشحنهولك حالا يلا يابكف رجيج وصغير البيه بتاعك رايدك
63	ماشى ياعاصم مع السلامه هكلمك لاإله الا الله
65	بلا اهدى بلا ماهداش اسكت انت حسابك معاي بعدين
66	اجعدوا اتخانجوا وفوتوا البنته الى عتموت على خيها بدل ماتشوفوا هتبلغوهم كيف وتتصلوا عليه مشان نطمن
67	عندك حج يابوى
71	والله انك جليل الزوق انت وواد عمك الى واجف ده
72	واه وانا مالى ياعمى عتشتم ليه دلوك.
73	بلا عمى بلاعمتى غور منك ليه شوفوا عتبلغوا حريمكم كيف وجول لبهانه تحضر عشا للضيف يابو مخ تخين منك له.
80	ماحصلش حاجه ياحج هو سوء تفاهم اكيد هو فهم خطأ
81	ايوه هوه ايه بجى الى فهمه خطأ ده
82	هو ال يعنى
83	مافيش ياخالى الحكايه انه داس على رجلى وهو خارج وانا كنت متعصب ومشان اكده ضربته.
84	ده الى حصل يادكتور
86	ايوه ياحاج دا الى حصل
88	كدا بجى يبجى احنا مديونين لك باعتزار ياولدى حب على راسه يامراد
89	عتجول ايه ياخالى.
90	الى سمعته حب على راسه ماهو مش عشان ربنا مديك شوية صحه عتفترى بيها على خلجه
96	طبعا ياولدى اخولت امال ايه مش كلنا مسلمين.
100	عامله ايه ياحببتى
101	الحمد لله يابوى عامله انت اتوحشتك جوى
103	حجك على يابوي بس جعدتى اهنه بتحسن حالة امى كثير
104	ماشي يابتى ربنا يجومها بالسلامه لاجل خاطرك
105	سامحها والنبي يابوى عشان خاطرى
112	جهزتى غرفة سيدك يونس يابت.
113	الغرفه زينه ياست الناس هو يانضرى بينام عليها ولا عيدخلها من اساسه
115	ايوه ياحبيب عمته مالحجش يتهنا والله ماخابره عين مين دى
116	واه عين مين عين بنات البلد كلها كبار وصغار ده سي يونس كل البنته تتمناه
120	بجولك ايه يابت اجرى جيبى جردل ميه وحطى في شويه ملح وتعالى نميح الاوضه بتاعتهم وهاتى كمان المبخره وجيبى المسجل من اوضتى لما نشغلهم سورة البقره
122	الله ينور عليكى ياستى اهو ده الكلام ولا بلاش ربناويبعد عنهم العين يارب.
128	تاعبه نفسك ليه بس اناعايزك ترتاحى ولو احتاجت حاجه هعملها لنفسي
25	تعرفى الست الى بيقولوا عليها دى
26	ايوه يافندم دى مستجده هنا جايه على زمة قضيه لسه ماتحكمش فيها.
27	طيب روحى هاتيها وتعالى فورا
42	ايوه انا
43	اممم وقتل جوهره
44	لاء انا ماقتلتش حد
45	بس البنات الى انت اتفقتى معاهم اعترفوا عليكى
46	كذبين ماحصلش انا معرفش حاجه عن الكلام دا.
49	بسم آلَلَهّ الرحمن الرحيم.
51	ليه عملت فيا كدا كنت عارف انه بيحبها ومش ممكن ينساها ليه خلتنى احبه
56	انا حبيته حبيته اكثر من نفسي شفت في امانى صدقت ان مافيش غيرى افتكرت انى قدرت امحى الماضى من ذاكرته افتكرت ان قلبه رجع يدق عشانى.
60	صدجينى يابتى يونس عيحبك جوهره كانت ماضى بس العشره يابتى ماتهونش الا على ولد الحرام ومهما كانت دى اتسمت مرته برضو.
61	انا عايزه امشي ياعمى ارجوك خلينى امشي مش عايزاه يرجع يلاقينى مش عايزه اشوف حزنه عليها ياعمى ارجوك مش هقدر استحمل مش هقدر اشوفه وهو بيبكى على موت حببته مش هقدر والله ماهقدر
73	ها لسه مصممه على كلامك.
74	انا ماقتلتهاش ايوه انا خليتهم يحوطلها مخدرات في الاكل بس دا عشان نتسلى مش اكثر بعدين كان مخدر ضعيف
76	على العموم الجثه هتتشرح وهنعرف اذا كانت المده دى مخدره ولا سامه وساعتها
81	يلا يايونس روحوا انتم ولما الجثه تتشرح ونعرف ايه سبب موتها هكلمك عشان تيجى تستلمها
82	الموضوع ده هياخد كثير
83	والله على حسب
84	كيف يعنى على حسب اكرام الميت دفنه ياسراج
85	والله يايونس انت الى عايز ده يحصل وانت الى قولت انك شاكك في موتها
86	وكان عندى حج
87	يبقى تصبر لحد مانعرف هي ماتت ازاى.
89	مالك ياجلب مراد هنفضل على اكده يابت خالى الكل اتجوز واستقر واحنا نجضوا عمرنا اكده كيف الجط والفار
90	انا تعبت يامراد تعبت جوى
91	تعالى معاى ياعمرى واوعدك هتنسى تعبك ده واصل
92	عمرك ماهتنسى ان امى كانت...
93	هششششش ماريدش اسمع كلام في الموضوع ده انت بنتى انا تربيتى انا وخابرك زين مش معنى انها كانت سيئه انك تطلعيلها
95	يبجى تاخدنى وماتفوتنيش لعجلى
97	عيحصول ياجلب مراد يونس ينتهى من دفن جوهره وهكلم خالى وندخلوا اول السبوع جولتى ايه
98	الى تشوفه يا.
99	جوليها يابت خالى جوليها تطفى النار الى جايده في جلبي
100	ياحبيبي
101	يا بووووووى
102	طب ايه بجى
103	ايه
104	مافيش حاجه تصبيره اكده
105	مراد بكفياك
106	بكفايه هو انا لسه عملت حاجه
107	مراد
108	شاورى يا جلب وعين وعمر مراد
109	ربنا يباركلى فيك ياواد عمتى ومايحرمنى منك واصل.
110	ولا منك ياجلب مراد
112	واه اغيرها ليه
113	هيكون ليه يعنى دماغك راح فين يابت خالى واه ميته عتفكرى اكده انت
114	هفكر في ايه انا جصدى هنروح فين
115	وماله ياجلب مراد هو انت عتفكرى في حاجه عفشه اياك بعدين انا جوزك يع...
116	والله لو كملت حديت يامراد مافى فرح بعد سبوع ولا حتى شهر.
117	واه واه لاه جلبك ابيوض ماشي ياستى سكتنا
118	جول بجى هنروحوا فين
119	غيرى بس انت خلجاتك وبعدين هتعرفى
120	اكده طيب اخرج بره يلا اخرج
121	واه عتطرمن غرفة مرتى ياجبروتك
122	ايوه اخرج بجى
123	اكده بردك يابسمه ماكنش العشم
124	واه انت زعلت انا بهزر معاك والله انا جصدى تخرج عشان ابدل ثيابى
125	طيب ما انا خابر.
127	طبعا عخاف على زعلك امال عخاف على مين يعنى
128	لاه انا خارج اصل كلامك ده عيخلينى اعمل حاجات الصراحه هموت واعملها
129	لاه اخرج احسن
132	حرما يابوى.
133	جمعا ياولدى عملت ايه دفنتها على امك برضو
134	لسه يابوى ماتدفنتش خالص
135	واه كيف امال كنت فين كل ده
136	بعدين يابوى الله لايسئك الحكايه كبيره الصبح احكيلك كل شيء
137	بكيفك ياولدى
138	امال فين عمتى ماشيفهاش في البيت
139	عمتك راحت مع منى عتبيت عنديها النهارده
140	اه. و منه ماشفتهاش اصلها مش في الغرفه
141	توك لسه فاكر تسأل عليها.
142	في ايه يابوى انا لسه راجع من بره وبعدين هي هتروح فين يعنى
143	على جولك عتروح فين ملهاش حته تروحها صوح نجوم ايه بجى نبهدل فيها ونطفحها المرار بدل مانحاجى عليها ونحتويها
145	ايه الى بتجوله ده يابوى مين الى عمل اكده منه عايشه معايه متصانه ماحدش يجدر يجى عليها واصل
146	فعلا ياولدى ماحدش بستجرى ياجى جمب حاجه تخص يونس الراوى
148	منه فين يابوي مرتى فين
149	ماتت
150	بتجول ايه يابوى ماتت كيف.
4	مين دى ياولدى
5	دى ولدت جوهره.
8	منه
10	فوجى ياحببتى منه، منه
11	منه قومى ياحببتى ايه الى حصل منه، منه
12	طلعها غرفتها ياولدى وانت يامراد ارمح نادم على الدكتور ارمح ياولدى
13	حاضر ياخالى حاضر.
16	انا اسف ياجلب يونس مش بيدى الى عيحصول كله جدر ومكتوب
21	لاه ياحبت جلبى لاه الا دموعك
23	الدكتور جه يايونس.
25	اتفضل يادكتور
27	المفروض انك هاتسيبى السرايا بكره
28	ماتفكريش ان لما افوت السرايا اكده هبجى بعيده ولا ماعرفش الى عيجرى
30	ماشي بس مش عايزه تعملى اى حاجه من غير ماتخدى رأي مش عايزه الشغل يبوظ انا ماصدقت اتفقت مع يونس
31	ماشى وربنا يستر مامرتحاش انا لثجتك دى
32	مالكيش دعوه انت ليكى فلوس وبس.
34	اتفجت مع يونس كيف يعنى
36	يعنى هي حامل يادكتور.
37	ان شاء الله ياست كريمه كل الاعراض بتوضح ده بس هي لازم تيجى المستشفى وطبيبة نسا تفحصها وياريت في اقرب وقت عشان الاغماء ده خطر في الحمل
38	طبعا اكيد هتاجى يادكتور
39	طيب الدواء ده هيحسنها شويه ويخليها تقدر تقوم بس اول ماتبقى كويسه تروح تكشف علطول
41	خير ياولدى طمنا.
42	اطمن ياخوى ماتجلجش عتبجى جد يا واد ابوى
43	جد يادكتور
44	ان شاء الله يكون بجد يا حاج بعد اذنكم انا وزى ماقولتلك ياست كريمه
45	مع الدكتور يامروان وابعت جابر يجيب الروشته دى
46	حاضر ياعمتى حاضر
48	حامل انا حامل يعنى جوايه حته منه، وبتلقاءيه وضعت يدها على بطنها وبنظره ليونس
54	الف مبارك ياولدى مبارك يابت اخوي
55	الله يبارك فيك يابوى
56	الله يبارك في حضرتك يا عمو
59	منه
60	يونس.
62	ربنا يتمم لهم بخير يااااه اخيرا فرحت بيك ياشبل
63	ربنا يجعلها جوازت الضهر ويرزقه برها ويرزقه الزريه الصالحه
64	اللهم امين ادعي لهم يافاطمه
65	دعيالهم ياحاج دعيالهم في كل صلاتى ربنا يجعل دعاءى من نصيبه
66	تصبحو على خير.
67	واه مالك يا عيشه مش كيف عوايدك يعنى
68	مافيش حاجه يابوى بس تعبانه ورايده انام
69	لا والله مش حكاية نوم دى انت متغيره وكأن في حاجه مديجاكى
70	انت رايده يبجى في حاجه وخلاص بجولكم تعبانه
71	عيشه، حديتك يبجى بصوت واطى وباحترام اتفضلى اطلعى على غرفتك ولينا حديت ثانى لما الشمس تطلع
73	واه مالها دى.
75	عتجولى ايه انت يا وليه
76	انت خابر هي روحها في شبل كيف يمكن حست انه اكده عيبعد عنها
77	لا حول ولا قوة الا بالله جومى يافاطمه جومى ننام النهار جرب يطلع جومى مشان الناس الى عتيجى الصبحيه
78	على جولك ياحاج بكره ورانا مصالح كثير.
81	نورتى بيتك يابت عمى
82	شكراً. احم. يابن عمى
86	مبروك يا حببتى
88	ايه ماخبراش انك حببتى ولا مامصدجاش
89	شبل ا...
90	هشششش ماتتحدتيش يابت عمى لو هتجولى كلام عفش يبجى ماتتحدتيش
91	شبل احنا اتفقنا ان...
92	خابر اتفاجنا يابت عمى ماخلفش وعدى انا، انا بس كنت حابب اباركلك حتى لو بالكدب لكن انا سعيد انك معايا وعلى زمتى، البيت جدامك اهه اجعدى في براحتك واعتبرينى مش موجود
93	شبل انا...
94	مالوش عازه الحديت اتفضلى ادخلى غرفتك انا هنام في اوضة الاطفال.
95	لاء طبعا خليك في اوضتك وانا الى هنام في الاوضه الثانيه
96	اتفضلى يابنت عمى على غرفتك
99	منى
102	لو احتاجتى حاجه انا هنا
103	شكراً.
115	ليه البكى في يوم كيف ده يا حببتى.
120	سبحان من صورك جميله انت يابت خالى.
125	اتحدت يا اخى اتحدت.
126	مبروك احم مبروك يابت عمى
127	بجد مبروك
128	كيف يعنى بجد
129	يعنى بتقولها من قلبك فرحان يعنى ان هيجينا طفل
130	ايوه يا منه فرحان طبعا كيف مافرحش وفي حته منى جواكى
132	ممكن. اسألك حاجه.
133	اسالى يابت عمى الى انت رايده تعرفيه هجولهولك هجولك كل حاجه الليله.
135	ازاى الى انت بتقوله ده لاء اتصرف بابي لازم يرجع لاء مش هيتحاكم هنا هناك هنقدر نخليه ياخد حكم خفيف وكمان ممكن يطلع بكفاله لكن هنا لاء اكيد مش هيسبوه اتصرف في خلال يومين بالكتير لازم يكون سايب مصر.
140	اوف استغفرالله العظيم يارب اتقلع بقى اعمل ايه ياربى انادى عليه يفكهولى لاء لاء طبعا مش هعمل كدا ايه الهبل دا فوقى كدا يادكتوره وفكرى في طريقه تفوكى بيها السوسته دى، اه يارب بقى
149	منى في حاجه عتنادمى على الفستان ليه يابت عمى وبسخريه. فاتك اياك ومشى
150	فستانى ياشبل فستانى
151	ماله فستانك
152	هيء هيء فستانى هيء هيء هيء.
153	فستانى فستانى وعتبكى عمل فيها ايه الوغد ده
155	الباب مفتوح اه ه ه ادخل ياشبل هيء هيء هيء
156	الباب مفتوح يخرب بيتك ياشبل فاتحه الباب وانت جاعد اكده يخيبك واد
158	بسم الله ماشاءالله ولا حول ولا قوة الا بالله
159	اه ه ه ه ه اطلع بره برااااااااااااه.
2	استهدوا بالله يا ولاد مش اكده
3	اسمع يا حاج بعد بنتك من جدامى مشان مااعملش شى معيعجبكش وقتها
4	اهدى يابنى دى بردك في مجام امك
5	ام مين مابجاش غير كريمه كومان تشبهنى بيها
6	صوح انت عتجيبى روحك لستك وتاج راسك
7	جال ستى جال الست هي الى تصون شرفها وماتخونش صحبتها وتاخد حبيبها منها.
9	ماتفكريش انى ماعرفش الى حصول زمان وعتضحكى عليا بكلمتين كيف المسكينه دى
12	بسمه
13	بتى
19	واه انت جيت ياولدى لمؤخذه ياحبيبي ماكنتش اعرف انك اهنه
20	تعالى ياعمه مافيش حاجه
21	عامله كيف دلوك ياحببتى.
22	الحمدلله ياعمتو اخدت شاور وان شاءالله هبقى كويسه
23	مالك انت تعبانه ولا ايه
24	شويه
25	شويه ايه دى ياحبت عينى كانت مولعه نار وجسمها كله بيرتعش
26	مالك حسه بايه
27	ماتقلقش والله هبقى كويسه اظاهر انى داخله على دور برد
28	انا هكلم الدكتور ياجى يشوفك
29	مش مستهله صدقنى
30	ماتجلجش ياولدى ان شاء الله هتبجى زينه بس شطارتك بجى تسجيها الشوربه دى.
31	اكيد طبعا لازم تشربها
32	لاء مش هقدر والله بطنى بتوجعنى
33	معلش ياحببتى مشان الى في بطنك لو الدور تجل غلط عليه
35	كفايه بقا والله مش قادره
36	ابدا لسه معلجه بتخديها وخلاص
37	مش قادره يايونس والله
38	ابدا هتاخديها.
41	لاه اكده كتير يابت عمى مانجعوش مع بعضينا غير ماتنهيها اكده
46	خير صادق في حاجه.
47	مالك يابنتى كل دا نوم من امبارح وانت نايمه ودلوقتى بقينا المغرب ايه مش ناويه تصحى
48	ازاى يعنى، ازاى المغرب
49	انت بتسالينى انا من الصبح
51	انا
52	مالك
53	لاء مافيش ايوه اه افتكرت اصلى عندى صداع شديد وكنت محتاجه ارتاح
54	طيب قوم بقا وكفايه كدا عندنا شغل ماتنسيش ان بكره معادنا مع ابن الراوى.
55	اوك هاخد شاور واجى
56	ماشي بس ماتتاخريش
59	ماشي يايونس انا هعرفك مين هي كرستين وازاى تضحك عليها.
65	منه فيكى حاجه ياحببتى
66	لاء ماتتخضش انت نمت وانت قاعد
67	لاه انا بس كنت مريح اكده.
68	طيب ادخل نام شويه انت صاحى بدرى وخرجت و، اه صح انت كنت فين
70	هاااافى ايه يا يونس
71	مالك انت عتتخرعى كل ما اجربلك
72	انت بتقول ايه انا سألتك حاجه ماجوبتش وشلتنى هو ايه دا
73	تفهمى ايه من اكده
74	افهم ايه
75	انى مش رايد اجاوب
76	والله
77	والله
78	يونس.
79	عين وجلب وعجل يونس
82	انا مش هرجع السرايا يامراد
97	اوعى تفكرى انى ممكن اخون مرتى وقبل اغضب ربنا لو انت ماتعرفيش ربنا انا بجى بترجى رضاه.
5	انا مش هجعد على زمته دجيجه واحده الى شمتان في امى وهي بين
7	ميته شمت انا يابت خالى ميته جولت انا ولا اى حد كلمه عفشه في حجها.
8	انتم ماجلتوش بس هي دى الحجيجه هي عملت حاجات كثير واكيد شمتانين فيها
12	ماتبكيش مش كل حاجه تفضلى تبكى عتغلطى وتبكى بكفياكى بجى صبرت كثير واستحملت كثير رايده تطلجى ماشي يابت خالى هعملك الى انت عايزاه بس يارب وجتها ترتاحى وتعرفى انى ماشمتانش في حد
15	لي اكده يابتى لي بتعملى فيكى وفينا اكده.
19	جومى ياجلب عمتك طلى على منه اجعدى وياها واحكوا مع بعض شويه
22	واه ب???س???م???آلَلَه??ہآلَرح???م???ن??? آلَرح???ي??ہم??? بسمه جرالك ايه ياجلب عمتك
32	بسمه مالها يا امى ايه الى حصول
33	ماخبراش ياولدى ماخبراش مره واحده وجعت منى
36	ها بسمه
37	ارمح يامروان نادم عالدكتور
41	كنت فاكره روحك عتموتى وتخلصى
43	انا ماعملتش حاجه والله ما...
44	مالفيتحش بالله يابت المركوب
46	احب على يدك يايونس بيه احب على يدك ارحمنى
47	ارحمك افتكرتى الرحمه دلوك ولما كنت بتعملى جريمتك كانت فين الرحمه
54	وحيات اعلى حاجه عندك يايونس بيه
55	اغلاوحاجه راحت وانت كنت السبب في ده
57	سراج
58	مين دى يايونس بيه وبتعملوا ايه هنا
60	خدى اهنه يابنت المركوب والله ليكون اخر يوم بعمرك
61	الحجنى يابيه واظا اعيش هدامتك طول العمر.
63	اهدى يايونس مايبقاش كدا البلد فيها قانون والى غلط يتحاسب
65	يامرك يا نعمه عليكى وعلى الى خلفتك يانعمه
66	يلا يايونس
68	الو
69	الحقنا يايونس بسمله اغمى عليها ومش عارفين مالها
74	المهم تفوقى لدراستك هي دى الحاجه الوحيده الى هتنفعك صدقينى يا عيشو
75	طبعا يامرت اخوى انت خابره كيف انا عحب العلام
76	ايوه كدا شطوره ياحببتى
77	كمان انا رايده ابجى دكتوره كيف مروان
80	عايشو هو انت يعنى بتشوفى مروان ازاى
81	كيف يعنى
82	قصدى يعنى بتشوفيه اخوكى زى يونس ومراد
83	انا با...
86	ا انا هنا ياشبل
87	يارب ديما ياجلب شبل
88	حمدلله على السلامه
89	يابوووى جولى اكده جولتى ايه ثانى
90	حمدالله على السلامه
91	وهو في سلامه اكثر من انى ابجى شايفك جدامى ومنوره حياتى اكده
92	احم احم حمدالله على السلامه ياخوى.
93	سمعتى حاجه ياجلب شبل
94	لاء
95	واه بجى اكده يامرت اخوى طيب يعنى انا بجيت عزول دلوك
96	لاء طبعا ماتقوليش كدا بهزر معاكى عايشو
97	ماشي يامرت اخوى مجبوله
98	واه انت عتفضلى تحدتى روحك ياحببتى
100	واه انت اهنهزيا عائش طيب جولى يابنتى
101	والله انت ياخوي الى ماعتشوفش حد ومناك هنا.
102	طيب ولما انت خابره اكده لساتك بتعملى ايه اهنه
103	ها انت عتطردنى ياخوى
104	لاء طبعا ياحببتى هو بيهز معاكى
105	دا شكل واحد عيهزر
106	شبل
107	عيونه
108	واه واه هي عيونه وجلبه وانا عتطردنى ماشى ياشبل
110	عيشه
112	المفروض ياحببتى الواحد منا يبجى حسيس لجتينى بتجاهلك تخدى بعضك وعلى تحت عدل صح ياجلب اخوكى
113	جلب اخوى
114	طبعا جلبه
118	تصبح على خير ياحبيب اختك
124	الموضوع دا زاد يابسمه احنا لازم ننزل مصر ونشوف موضوع الطب النفسي دا.
125	انا مش مجنونه ياخوى
126	مين جال اكده مش كل مريض نفسي مجنون
127	ماتشيلش هم يايونس انا هاخد مرتى ونروح نسوف الموضوع دا وفي اقرب وقت مشان انا رايد اعمل الفرح على طلعت الهلال باذن الله
128	واه بجد الحديت ده ياولدى
129	جد جدا يا امى ده بعد اءن خالى طبعا
130	انا موافج ياولدى
131	ابوى انا...
132	رايد اطمن عليكى يابتى جبل ماموت
133	بعيد الشر عليك يابوى.
134	يبجى تسمعى الكلام وتفرحى وتفرحينا
135	حاضر يابوى الى تشوفه
136	مبروك ياحببتى الف مبروك
137	الف الف مبروك ياولاد الحمدلله يارب هتحججلى امنيتى الى عشت طول عمرى احلم بيها
138	مبروك يامراد مبروك يابسمه
139	الله يبارك فيك يامراد عجبالك
140	ياعم قولى اخلص دراسه الاول
